"No.","Time","Source","Destination","Protocol","Length","Info"
"604","5.353283","194.29.146.149","194.29.146.97","TCP","66","cvsup > 39745 [ACK] Seq=1 Ack=7 Win=647 Len=0 TSval=1219238077 TSecr=346067241"
"606","5.361034","194.29.146.149","194.29.146.97","TCP","66","cvsup > 39745 [ACK] Seq=1 Ack=13 Win=647 Len=0 TSval=1219238084 TSecr=346067249"
"607","5.367738","194.29.146.149","194.29.146.97","TCP","196","cvsup > 39745 [PSH, ACK] Seq=1 Ack=13 Win=647 Len=130 TSval=1219238091 TSecr=346067249"
"609","5.381369","194.29.146.149","194.29.146.97","TCP","168","cvsup > 39745 [PSH, ACK] Seq=131 Ack=23 Win=647 Len=102 TSval=1219238105 TSecr=346067256"
"646","5.422308","194.29.146.149","194.29.146.97","TCP","66","cvsup > 39745 [ACK] Seq=233 Ack=35 Win=647 Len=0 TSval=1219238145 TSecr=346067270"
"648","5.422546","194.29.146.149","194.29.146.97","TCP","66","cvsup > 39745 [ACK] Seq=233 Ack=75 Win=647 Len=0 TSval=1219238146 TSecr=346067310"
"650","5.423325","194.29.146.149","194.29.146.97","TCP","168","cvsup > 39745 [PSH, ACK] Seq=233 Ack=75 Win=647 Len=102 TSval=1219238147 TSecr=346067310"
"702","5.464537","194.29.146.149","194.29.146.97","TCP","66","cvsup > 39745 [ACK] Seq=335 Ack=85 Win=647 Len=0 TSval=1219238188 TSecr=346067312"
"704","5.464803","194.29.146.149","194.29.146.97","TCP","66","cvsup > 39745 [ACK] Seq=335 Ack=115 Win=647 Len=0 TSval=1219238188 TSecr=346067353"
"706","5.465060","194.29.146.149","194.29.146.97","TCP","66","cvsup > 39745 [ACK] Seq=335 Ack=121 Win=647 Len=0 TSval=1219238189 TSecr=346067353"
"708","5.472820","194.29.146.149","194.29.146.97","TCP","66","cvsup > 39745 [ACK] Seq=335 Ack=127 Win=647 Len=0 TSval=1219238196 TSecr=346067361"
"710","5.481420","194.29.146.149","194.29.146.97","TCP","66","cvsup > 39745 [ACK] Seq=335 Ack=133 Win=647 Len=0 TSval=1219238205 TSecr=346067369"
"712","5.488795","194.29.146.149","194.29.146.97","TCP","66","cvsup > 39745 [ACK] Seq=335 Ack=139 Win=647 Len=0 TSval=1219238212 TSecr=346067377"
"714","5.496762","194.29.146.149","194.29.146.97","TCP","66","cvsup > 39745 [ACK] Seq=335 Ack=145 Win=647 Len=0 TSval=1219238220 TSecr=346067385"
"717","5.504806","194.29.146.149","194.29.146.97","TCP","66","cvsup > 39745 [ACK] Seq=335 Ack=151 Win=647 Len=0 TSval=1219238228 TSecr=346067393"
"719","5.512863","194.29.146.149","194.29.146.97","TCP","66","cvsup > 39745 [ACK] Seq=335 Ack=157 Win=647 Len=0 TSval=1219238236 TSecr=346067401"
"721","5.521176","194.29.146.149","194.29.146.97","TCP","66","cvsup > 39745 [ACK] Seq=335 Ack=163 Win=647 Len=0 TSval=1219238245 TSecr=346067409"
"723","5.529079","194.29.146.149","194.29.146.97","TCP","66","cvsup > 39745 [ACK] Seq=335 Ack=169 Win=647 Len=0 TSval=1219238252 TSecr=346067417"
"725","5.537830","194.29.146.149","194.29.146.97","TCP","66","cvsup > 39745 [ACK] Seq=335 Ack=175 Win=647 Len=0 TSval=1219238261 TSecr=346067425"
"727","5.544973","194.29.146.149","194.29.146.97","TCP","66","cvsup > 39745 [ACK] Seq=335 Ack=181 Win=647 Len=0 TSval=1219238268 TSecr=346067433"
"729","5.553081","194.29.146.149","194.29.146.97","TCP","66","cvsup > 39745 [ACK] Seq=335 Ack=187 Win=647 Len=0 TSval=1219238276 TSecr=346067441"
"731","5.562851","194.29.146.149","194.29.146.97","TCP","66","cvsup > 39745 [ACK] Seq=335 Ack=193 Win=647 Len=0 TSval=1219238286 TSecr=346067449"
"733","5.578948","194.29.146.149","194.29.146.97","TCP","66","cvsup > 39745 [ACK] Seq=335 Ack=199 Win=647 Len=0 TSval=1219238302 TSecr=346067467"
"735","5.582155","194.29.146.149","194.29.146.97","TCP","66","cvsup > 39745 [ACK] Seq=335 Ack=205 Win=647 Len=0 TSval=1219238305 TSecr=346067467"
"737","5.592946","194.29.146.149","194.29.146.97","TCP","66","cvsup > 39745 [ACK] Seq=335 Ack=211 Win=647 Len=0 TSval=1219238316 TSecr=346067480"
"739","5.593295","194.29.146.149","194.29.146.97","TCP","66","cvsup > 39745 [ACK] Seq=335 Ack=217 Win=647 Len=0 TSval=1219238317 TSecr=346067481"
"741","5.603922","194.29.146.149","194.29.146.97","TCP","66","cvsup > 39745 [ACK] Seq=335 Ack=223 Win=647 Len=0 TSval=1219238327 TSecr=346067492"
"743","5.610429","194.29.146.149","194.29.146.97","TCP","66","cvsup > 39745 [ACK] Seq=335 Ack=229 Win=647 Len=0 TSval=1219238334 TSecr=346067498"
"745","5.617897","194.29.146.149","194.29.146.97","TCP","66","cvsup > 39745 [ACK] Seq=335 Ack=235 Win=647 Len=0 TSval=1219238341 TSecr=346067505"
"747","5.625367","194.29.146.149","194.29.146.97","TCP","66","cvsup > 39745 [ACK] Seq=335 Ack=241 Win=647 Len=0 TSval=1219238349 TSecr=346067513"
"749","5.632834","194.29.146.149","194.29.146.97","TCP","66","cvsup > 39745 [ACK] Seq=335 Ack=247 Win=647 Len=0 TSval=1219238356 TSecr=346067521"
"751","5.643536","194.29.146.149","194.29.146.97","TCP","66","cvsup > 39745 [ACK] Seq=335 Ack=253 Win=647 Len=0 TSval=1219238367 TSecr=346067529"
"753","5.649120","194.29.146.149","194.29.146.97","TCP","66","cvsup > 39745 [ACK] Seq=335 Ack=259 Win=647 Len=0 TSval=1219238372 TSecr=346067537"
"755","5.657082","194.29.146.149","194.29.146.97","TCP","66","cvsup > 39745 [ACK] Seq=335 Ack=265 Win=647 Len=0 TSval=1219238380 TSecr=346067545"
"757","5.665082","194.29.146.149","194.29.146.97","TCP","66","cvsup > 39745 [ACK] Seq=335 Ack=271 Win=647 Len=0 TSval=1219238388 TSecr=346067553"
"759","5.673229","194.29.146.149","194.29.146.97","TCP","66","cvsup > 39745 [ACK] Seq=335 Ack=277 Win=647 Len=0 TSval=1219238397 TSecr=346067561"
"765","5.683225","194.29.146.149","194.29.146.97","TCP","66","cvsup > 39745 [ACK] Seq=335 Ack=283 Win=647 Len=0 TSval=1219238407 TSecr=346067569"
"767","5.690377","194.29.146.149","194.29.146.97","TCP","66","cvsup > 39745 [ACK] Seq=335 Ack=289 Win=647 Len=0 TSval=1219238414 TSecr=346067577"
"769","5.697589","194.29.146.149","194.29.146.97","TCP","66","cvsup > 39745 [ACK] Seq=335 Ack=295 Win=647 Len=0 TSval=1219238421 TSecr=346067585"
"771","5.705045","194.29.146.149","194.29.146.97","TCP","66","cvsup > 39745 [ACK] Seq=335 Ack=301 Win=647 Len=0 TSval=1219238428 TSecr=346067593"
"773","5.712865","194.29.146.149","194.29.146.97","TCP","66","cvsup > 39745 [ACK] Seq=335 Ack=307 Win=647 Len=0 TSval=1219238436 TSecr=346067601"
"775","5.723472","194.29.146.149","194.29.146.97","TCP","66","cvsup > 39745 [ACK] Seq=335 Ack=313 Win=647 Len=0 TSval=1219238447 TSecr=346067609"
"777","5.738151","194.29.146.149","194.29.146.97","TCP","66","cvsup > 39745 [ACK] Seq=335 Ack=319 Win=647 Len=0 TSval=1219238461 TSecr=346067625"
"779","5.753137","194.29.146.149","194.29.146.97","TCP","66","cvsup > 39745 [ACK] Seq=335 Ack=325 Win=647 Len=0 TSval=1219238476 TSecr=346067641"
"781","5.763265","194.29.146.149","194.29.146.97","TCP","66","cvsup > 39745 [ACK] Seq=335 Ack=331 Win=647 Len=0 TSval=1219238487 TSecr=346067649"
"783","5.770825","194.29.146.149","194.29.146.97","TCP","66","cvsup > 39745 [ACK] Seq=335 Ack=337 Win=647 Len=0 TSval=1219238494 TSecr=346067657"
"785","5.778061","194.29.146.149","194.29.146.97","TCP","66","cvsup > 39745 [ACK] Seq=335 Ack=343 Win=647 Len=0 TSval=1219238501 TSecr=346067665"
"786","5.778661","194.29.146.149","194.29.146.97","TCP","122","cvsup > 39745 [PSH, ACK] Seq=335 Ack=343 Win=647 Len=56 TSval=1219238502 TSecr=346067665"
"788","5.796842","194.29.146.149","194.29.146.97","TCP","213","cvsup > 39745 [PSH, ACK] Seq=391 Ack=353 Win=647 Len=147 TSval=1219238520 TSecr=346067667"
"790","5.837458","194.29.146.149","194.29.146.97","TCP","66","cvsup > 39745 [ACK] Seq=538 Ack=365 Win=647 Len=0 TSval=1219238561 TSecr=346067685"
"792","5.838032","194.29.146.149","194.29.146.97","TCP","66","cvsup > 39745 [ACK] Seq=538 Ack=405 Win=647 Len=0 TSval=1219238561 TSecr=346067726"
"794","5.841453","194.29.146.149","194.29.146.97","TCP","66","cvsup > 39745 [ACK] Seq=538 Ack=411 Win=647 Len=0 TSval=1219238565 TSecr=346067729"
"796","5.849099","194.29.146.149","194.29.146.97","TCP","66","cvsup > 39745 [ACK] Seq=538 Ack=417 Win=647 Len=0 TSval=1219238573 TSecr=346067737"
"798","5.857733","194.29.146.149","194.29.146.97","TCP","66","cvsup > 39745 [ACK] Seq=538 Ack=423 Win=647 Len=0 TSval=1219238581 TSecr=346067745"
"800","5.867960","194.29.146.149","194.29.146.97","TCP","66","cvsup > 39745 [ACK] Seq=538 Ack=429 Win=647 Len=0 TSval=1219238591 TSecr=346067753"
"802","5.875586","194.29.146.149","194.29.146.97","TCP","66","cvsup > 39745 [ACK] Seq=538 Ack=435 Win=647 Len=0 TSval=1219238599 TSecr=346067761"
"804","5.882372","194.29.146.149","194.29.146.97","TCP","66","cvsup > 39745 [ACK] Seq=538 Ack=441 Win=647 Len=0 TSval=1219238605 TSecr=346067769"
"806","5.890016","194.29.146.149","194.29.146.97","TCP","66","cvsup > 39745 [ACK] Seq=538 Ack=447 Win=647 Len=0 TSval=1219238613 TSecr=346067777"
"808","5.897097","194.29.146.149","194.29.146.97","TCP","66","cvsup > 39745 [ACK] Seq=538 Ack=453 Win=647 Len=0 TSval=1219238621 TSecr=346067785"
"810","5.907676","194.29.146.149","194.29.146.97","TCP","66","cvsup > 39745 [ACK] Seq=538 Ack=459 Win=647 Len=0 TSval=1219238631 TSecr=346067793"
"812","5.915243","194.29.146.149","194.29.146.97","TCP","66","cvsup > 39745 [ACK] Seq=538 Ack=465 Win=647 Len=0 TSval=1219238638 TSecr=346067801"
"814","5.921229","194.29.146.149","194.29.146.97","TCP","66","cvsup > 39745 [ACK] Seq=538 Ack=471 Win=647 Len=0 TSval=1219238645 TSecr=346067809"
"816","5.932358","194.29.146.149","194.29.146.97","TCP","66","cvsup > 39745 [ACK] Seq=538 Ack=477 Win=647 Len=0 TSval=1219238655 TSecr=346067817"
"818","5.937514","194.29.146.149","194.29.146.97","TCP","66","cvsup > 39745 [ACK] Seq=538 Ack=483 Win=647 Len=0 TSval=1219238661 TSecr=346067825"
"820","5.945246","194.29.146.149","194.29.146.97","TCP","66","cvsup > 39745 [ACK] Seq=538 Ack=489 Win=647 Len=0 TSval=1219238668 TSecr=346067833"
"822","5.963532","194.29.146.149","194.29.146.97","TCP","66","cvsup > 39745 [ACK] Seq=538 Ack=495 Win=647 Len=0 TSval=1219238687 TSecr=346067849"
"825","6.018360","194.29.146.149","194.29.146.97","TCP","66","cvsup > 39745 [ACK] Seq=538 Ack=501 Win=647 Len=0 TSval=1219238742 TSecr=346067906"
"827","6.147561","194.29.146.149","194.29.146.97","TCP","66","cvsup > 39745 [ACK] Seq=538 Ack=507 Win=647 Len=0 TSval=1219238871 TSecr=346068033"
"832","6.246756","194.29.146.149","194.29.146.97","TCP","66","cvsup > 39745 [ACK] Seq=538 Ack=515 Win=647 Len=0 TSval=1219238970 TSecr=346068133"
"833","6.356910","194.29.146.149","194.29.146.97","TCP","1514","cvsup > 39745 [ACK] Seq=538 Ack=515 Win=647 Len=1448 TSval=1219239080 TSecr=346068133"
"834","6.357146","194.29.146.149","194.29.146.97","TCP","2962","cvsup > 39745 [ACK] Seq=1986 Ack=515 Win=647 Len=2896 TSval=1219239080 TSecr=346068133"
"836","6.357841","194.29.146.149","194.29.146.97","TCP","1096","cvsup > 39745 [PSH, ACK] Seq=4882 Ack=515 Win=647 Len=1030 TSval=1219239081 TSecr=346068245"
"838","6.361765","194.29.146.149","194.29.146.97","TCP","66","cvsup > 39745 [ACK] Seq=5912 Ack=535 Win=647 Len=0 TSval=1219239085 TSecr=346068249"
"912","6.447618","194.29.146.149","194.29.146.97","TCP","66","cvsup > 39745 [ACK] Seq=5912 Ack=543 Win=647 Len=0 TSval=1219239171 TSecr=346068325"
"927","6.505454","194.29.146.149","194.29.146.97","TCP","534","cvsup > 39745 [PSH, ACK] Seq=5912 Ack=543 Win=647 Len=468 TSval=1219239229 TSecr=346068325"
"929","6.506206","194.29.146.149","194.29.146.97","TCP","66","cvsup > 39745 [ACK] Seq=6380 Ack=553 Win=647 Len=0 TSval=1219239230 TSecr=346068394"
"935","6.790663","194.29.146.149","194.29.146.97","TCP","1514","cvsup > 39745 [ACK] Seq=6380 Ack=553 Win=647 Len=1448 TSval=1219239514 TSecr=346068394"
"936","6.790911","194.29.146.149","194.29.146.97","TCP","1680","cvsup > 39745 [PSH, ACK] Seq=7828 Ack=553 Win=647 Len=1614 TSval=1219239514 TSecr=346068394"
"939","6.793604","194.29.146.149","194.29.146.97","TCP","66","cvsup > 39745 [ACK] Seq=9442 Ack=693 Win=656 Len=0 TSval=1219239517 TSecr=346068681"
"1039","7.927984","194.29.146.149","194.29.146.97","TCP","1514","cvsup > 39745 [ACK] Seq=9442 Ack=693 Win=656 Len=1448 TSval=1219240651 TSecr=346068681"
"1040","7.928232","194.29.146.149","194.29.146.97","TCP","2962","cvsup > 39745 [ACK] Seq=10890 Ack=693 Win=656 Len=2896 TSval=1219240651 TSecr=346068681"
"1042","7.928487","194.29.146.149","194.29.146.97","TCP","1514","cvsup > 39745 [ACK] Seq=13786 Ack=693 Win=656 Len=1448 TSval=1219240651 TSecr=346068681"
"1043","7.928987","194.29.146.149","194.29.146.97","TCP","1514","cvsup > 39745 [ACK] Seq=15234 Ack=693 Win=656 Len=1448 TSval=1219240652 TSecr=346069816"
"1045","7.929228","194.29.146.149","194.29.146.97","TCP","2962","cvsup > 39745 [ACK] Seq=16682 Ack=693 Win=656 Len=2896 TSval=1219240652 TSecr=346069816"
"1046","7.929654","194.29.146.149","194.29.146.97","TCP","1514","cvsup > 39745 [ACK] Seq=19578 Ack=693 Win=656 Len=1448 TSval=1219240653 TSecr=346069817"
"1047","7.929905","194.29.146.149","194.29.146.97","TCP","2962","cvsup > 39745 [ACK] Seq=21026 Ack=693 Win=656 Len=2896 TSval=1219240653 TSecr=346069817"
"1049","7.931453","194.29.146.149","194.29.146.97","TCP","1514","cvsup > 39745 [ACK] Seq=23922 Ack=693 Win=656 Len=1448 TSval=1219240654 TSecr=346069819"
"1050","7.931703","194.29.146.149","194.29.146.97","TCP","2962","cvsup > 39745 [ACK] Seq=25370 Ack=693 Win=656 Len=2896 TSval=1219240654 TSecr=346069819"
"1051","7.931952","194.29.146.149","194.29.146.97","TCP","1590","cvsup > 39745 [PSH, ACK] Seq=28266 Ack=693 Win=656 Len=1524 TSval=1219240654 TSecr=346069819"
"1054","7.936054","194.29.146.149","194.29.146.97","TCP","66","cvsup > 39745 [ACK] Seq=29790 Ack=803 Win=656 Len=0 TSval=1219240660 TSecr=346069824"
"5419","46.470367","194.29.146.149","194.29.146.97","TCP","293","cvsup > 39745 [PSH, ACK] Seq=29790 Ack=803 Win=656 Len=227 TSval=1219279192 TSecr=346069824"
"5421","46.470769","194.29.146.149","194.29.146.97","TCP","66","cvsup > 39745 [ACK] Seq=30017 Ack=813 Win=656 Len=0 TSval=1219279193 TSecr=346108359"
"5835","49.501336","194.29.146.149","194.29.146.97","TCP","66","cvsup > 39745 [ACK] Seq=30017 Ack=819 Win=656 Len=0 TSval=1219282223 TSecr=346111389"
"5845","49.533187","194.29.146.149","194.29.146.97","TCP","66","cvsup > 39745 [ACK] Seq=30017 Ack=825 Win=656 Len=0 TSval=1219282255 TSecr=346111421"
"5913","50.021530","194.29.146.149","194.29.146.97","TCP","66","cvsup > 39745 [ACK] Seq=30017 Ack=831 Win=656 Len=0 TSval=1219282744 TSecr=346111909"
"5915","50.029395","194.29.146.149","194.29.146.97","TCP","66","cvsup > 39745 [ACK] Seq=30017 Ack=837 Win=656 Len=0 TSval=1219282752 TSecr=346111917"
"5918","50.037419","194.29.146.149","194.29.146.97","TCP","66","cvsup > 39745 [ACK] Seq=30017 Ack=843 Win=656 Len=0 TSval=1219282760 TSecr=346111925"
"5920","50.045442","194.29.146.149","194.29.146.97","TCP","66","cvsup > 39745 [ACK] Seq=30017 Ack=849 Win=656 Len=0 TSval=1219282768 TSecr=346111933"
"5922","50.061559","194.29.146.149","194.29.146.97","TCP","66","cvsup > 39745 [ACK] Seq=30017 Ack=855 Win=656 Len=0 TSval=1219282784 TSecr=346111949"
"5924","50.069457","194.29.146.149","194.29.146.97","TCP","66","cvsup > 39745 [ACK] Seq=30017 Ack=861 Win=656 Len=0 TSval=1219282792 TSecr=346111957"
"5926","50.077384","194.29.146.149","194.29.146.97","TCP","66","cvsup > 39745 [ACK] Seq=30017 Ack=867 Win=656 Len=0 TSval=1219282800 TSecr=346111965"
"5928","50.085464","194.29.146.149","194.29.146.97","TCP","66","cvsup > 39745 [ACK] Seq=30017 Ack=873 Win=656 Len=0 TSval=1219282808 TSecr=346111973"
"5930","50.101566","194.29.146.149","194.29.146.97","TCP","66","cvsup > 39745 [ACK] Seq=30017 Ack=879 Win=656 Len=0 TSval=1219282824 TSecr=346111989"
"5932","50.117281","194.29.146.149","194.29.146.97","TCP","66","cvsup > 39745 [ACK] Seq=30017 Ack=885 Win=656 Len=0 TSval=1219282839 TSecr=346112005"
"5934","50.125218","194.29.146.149","194.29.146.97","TCP","66","cvsup > 39745 [ACK] Seq=30017 Ack=891 Win=656 Len=0 TSval=1219282847 TSecr=346112013"
"5936","50.133464","194.29.146.149","194.29.146.97","TCP","66","cvsup > 39745 [ACK] Seq=30017 Ack=897 Win=656 Len=0 TSval=1219282856 TSecr=346112021"
"5938","50.141490","194.29.146.149","194.29.146.97","TCP","66","cvsup > 39745 [ACK] Seq=30017 Ack=903 Win=656 Len=0 TSval=1219282864 TSecr=346112029"
"5940","50.149291","194.29.146.149","194.29.146.97","TCP","66","cvsup > 39745 [ACK] Seq=30017 Ack=909 Win=656 Len=0 TSval=1219282872 TSecr=346112037"
"5942","50.157689","194.29.146.149","194.29.146.97","TCP","66","cvsup > 39745 [ACK] Seq=30017 Ack=915 Win=656 Len=0 TSval=1219282880 TSecr=346112045"
"5944","50.165452","194.29.146.149","194.29.146.97","TCP","66","cvsup > 39745 [ACK] Seq=30017 Ack=921 Win=656 Len=0 TSval=1219282888 TSecr=346112053"
"5946","50.176108","194.29.146.149","194.29.146.97","TCP","66","cvsup > 39745 [ACK] Seq=30017 Ack=927 Win=656 Len=0 TSval=1219282898 TSecr=346112061"
"5948","50.183172","194.29.146.149","194.29.146.97","TCP","66","cvsup > 39745 [ACK] Seq=30017 Ack=933 Win=656 Len=0 TSval=1219282905 TSecr=346112069"
"5950","50.190393","194.29.146.149","194.29.146.97","TCP","66","cvsup > 39745 [ACK] Seq=30017 Ack=939 Win=656 Len=0 TSval=1219282912 TSecr=346112077"
"5952","50.198240","194.29.146.149","194.29.146.97","TCP","66","cvsup > 39745 [ACK] Seq=30017 Ack=945 Win=656 Len=0 TSval=1219282920 TSecr=346112085"
"5954","50.207144","194.29.146.149","194.29.146.97","TCP","66","cvsup > 39745 [ACK] Seq=30017 Ack=951 Win=656 Len=0 TSval=1219282929 TSecr=346112093"
"5956","50.213748","194.29.146.149","194.29.146.97","TCP","66","cvsup > 39745 [ACK] Seq=30017 Ack=957 Win=656 Len=0 TSval=1219282936 TSecr=346112101"
"5958","50.221792","194.29.146.149","194.29.146.97","TCP","66","cvsup > 39745 [ACK] Seq=30017 Ack=963 Win=656 Len=0 TSval=1219282944 TSecr=346112109"
"5960","50.232496","194.29.146.149","194.29.146.97","TCP","66","cvsup > 39745 [ACK] Seq=30017 Ack=969 Win=656 Len=0 TSval=1219282955 TSecr=346112117"
"5962","50.240309","194.29.146.149","194.29.146.97","TCP","66","cvsup > 39745 [ACK] Seq=30017 Ack=975 Win=656 Len=0 TSval=1219282962 TSecr=346112125"
"5964","50.246782","194.29.146.149","194.29.146.97","TCP","66","cvsup > 39745 [ACK] Seq=30017 Ack=981 Win=656 Len=0 TSval=1219282969 TSecr=346112133"
"5966","50.254516","194.29.146.149","194.29.146.97","TCP","66","cvsup > 39745 [ACK] Seq=30017 Ack=987 Win=656 Len=0 TSval=1219282977 TSecr=346112141"
"5968","50.261981","194.29.146.149","194.29.146.97","TCP","66","cvsup > 39745 [ACK] Seq=30017 Ack=993 Win=656 Len=0 TSval=1219282984 TSecr=346112149"
"5970","50.270270","194.29.146.149","194.29.146.97","TCP","66","cvsup > 39745 [ACK] Seq=30017 Ack=999 Win=656 Len=0 TSval=1219282993 TSecr=346112157"
"5972","50.278182","194.29.146.149","194.29.146.97","TCP","66","cvsup > 39745 [ACK] Seq=30017 Ack=1005 Win=656 Len=0 TSval=1219283000 TSecr=346112165"
"5974","50.285519","194.29.146.149","194.29.146.97","TCP","66","cvsup > 39745 [ACK] Seq=30017 Ack=1011 Win=656 Len=0 TSval=1219283008 TSecr=346112173"
"5976","50.293527","194.29.146.149","194.29.146.97","TCP","66","cvsup > 39745 [ACK] Seq=30017 Ack=1017 Win=656 Len=0 TSval=1219283016 TSecr=346112181"
"5978","50.301526","194.29.146.149","194.29.146.97","TCP","66","cvsup > 39745 [ACK] Seq=30017 Ack=1023 Win=656 Len=0 TSval=1219283024 TSecr=346112189"
"5980","50.309484","194.29.146.149","194.29.146.97","TCP","66","cvsup > 39745 [ACK] Seq=30017 Ack=1029 Win=656 Len=0 TSval=1219283032 TSecr=346112197"
"5982","50.317561","194.29.146.149","194.29.146.97","TCP","66","cvsup > 39745 [ACK] Seq=30017 Ack=1035 Win=656 Len=0 TSval=1219283040 TSecr=346112205"
"5984","50.325530","194.29.146.149","194.29.146.97","TCP","66","cvsup > 39745 [ACK] Seq=30017 Ack=1041 Win=656 Len=0 TSval=1219283048 TSecr=346112213"
"5986","50.333636","194.29.146.149","194.29.146.97","TCP","66","cvsup > 39745 [ACK] Seq=30017 Ack=1047 Win=656 Len=0 TSval=1219283056 TSecr=346112221"
"5988","50.341560","194.29.146.149","194.29.146.97","TCP","66","cvsup > 39745 [ACK] Seq=30017 Ack=1053 Win=656 Len=0 TSval=1219283064 TSecr=346112229"
"5990","50.349648","194.29.146.149","194.29.146.97","TCP","66","cvsup > 39745 [ACK] Seq=30017 Ack=1059 Win=656 Len=0 TSval=1219283072 TSecr=346112237"
"5992","50.358039","194.29.146.149","194.29.146.97","TCP","66","cvsup > 39745 [ACK] Seq=30017 Ack=1065 Win=656 Len=0 TSval=1219283080 TSecr=346112246"
"5994","50.365643","194.29.146.149","194.29.146.97","TCP","66","cvsup > 39745 [ACK] Seq=30017 Ack=1071 Win=656 Len=0 TSval=1219283088 TSecr=346112253"
"5996","50.373531","194.29.146.149","194.29.146.97","TCP","66","cvsup > 39745 [ACK] Seq=30017 Ack=1077 Win=656 Len=0 TSval=1219283096 TSecr=346112261"
"5998","50.381519","194.29.146.149","194.29.146.97","TCP","66","cvsup > 39745 [ACK] Seq=30017 Ack=1083 Win=656 Len=0 TSval=1219283104 TSecr=346112269"
"6000","50.397842","194.29.146.149","194.29.146.97","TCP","66","cvsup > 39745 [ACK] Seq=30017 Ack=1089 Win=656 Len=0 TSval=1219283120 TSecr=346112285"
"6002","50.405794","194.29.146.149","194.29.146.97","TCP","66","cvsup > 39745 [ACK] Seq=30017 Ack=1095 Win=656 Len=0 TSval=1219283128 TSecr=346112293"
"6005","50.421851","194.29.146.149","194.29.146.97","TCP","66","cvsup > 39745 [ACK] Seq=30017 Ack=1101 Win=656 Len=0 TSval=1219283144 TSecr=346112309"
"6007","50.429821","194.29.146.149","194.29.146.97","TCP","66","cvsup > 39745 [ACK] Seq=30017 Ack=1107 Win=656 Len=0 TSval=1219283152 TSecr=346112317"
"6009","50.445809","194.29.146.149","194.29.146.97","TCP","66","cvsup > 39745 [ACK] Seq=30017 Ack=1113 Win=656 Len=0 TSval=1219283168 TSecr=346112333"
"6035","50.469533","194.29.146.149","194.29.146.97","TCP","66","cvsup > 39745 [ACK] Seq=30017 Ack=1119 Win=656 Len=0 TSval=1219283192 TSecr=346112357"
"6096","50.509239","194.29.146.149","194.29.146.97","TCP","66","cvsup > 39745 [ACK] Seq=30017 Ack=1125 Win=656 Len=0 TSval=1219283231 TSecr=346112397"
"6101","50.565380","194.29.146.149","194.29.146.97","TCP","66","cvsup > 39745 [ACK] Seq=30017 Ack=1131 Win=656 Len=0 TSval=1219283288 TSecr=346112453"
"6110","51.325570","194.29.146.149","194.29.146.97","TCP","66","cvsup > 39745 [ACK] Seq=30017 Ack=1137 Win=656 Len=0 TSval=1219284048 TSecr=346113213"
"6112","51.341688","194.29.146.149","194.29.146.97","TCP","66","cvsup > 39745 [ACK] Seq=30017 Ack=1143 Win=656 Len=0 TSval=1219284064 TSecr=346113230"
"6114","51.354430","194.29.146.149","194.29.146.97","TCP","66","cvsup > 39745 [ACK] Seq=30017 Ack=1149 Win=656 Len=0 TSval=1219284077 TSecr=346113242"
"6116","51.357632","194.29.146.149","194.29.146.97","TCP","66","cvsup > 39745 [ACK] Seq=30017 Ack=1155 Win=656 Len=0 TSval=1219284080 TSecr=346113245"
"6118","51.365381","194.29.146.149","194.29.146.97","TCP","66","cvsup > 39745 [ACK] Seq=30017 Ack=1161 Win=656 Len=0 TSval=1219284088 TSecr=346113253"
"6120","51.374035","194.29.146.149","194.29.146.97","TCP","66","cvsup > 39745 [ACK] Seq=30017 Ack=1167 Win=656 Len=0 TSval=1219284096 TSecr=346113262"
"6122","51.381382","194.29.146.149","194.29.146.97","TCP","66","cvsup > 39745 [ACK] Seq=30017 Ack=1173 Win=656 Len=0 TSval=1219284104 TSecr=346113269"
"6124","51.389323","194.29.146.149","194.29.146.97","TCP","66","cvsup > 39745 [ACK] Seq=30017 Ack=1179 Win=656 Len=0 TSval=1219284112 TSecr=346113277"
"6126","51.397351","194.29.146.149","194.29.146.97","TCP","66","cvsup > 39745 [ACK] Seq=30017 Ack=1185 Win=656 Len=0 TSval=1219284120 TSecr=346113285"
"6128","51.405624","194.29.146.149","194.29.146.97","TCP","66","cvsup > 39745 [ACK] Seq=30017 Ack=1191 Win=656 Len=0 TSval=1219284128 TSecr=346113294"
"6130","51.413616","194.29.146.149","194.29.146.97","TCP","66","cvsup > 39745 [ACK] Seq=30017 Ack=1197 Win=656 Len=0 TSval=1219284136 TSecr=346113301"
"6132","51.421629","194.29.146.149","194.29.146.97","TCP","66","cvsup > 39745 [ACK] Seq=30017 Ack=1203 Win=656 Len=0 TSval=1219284144 TSecr=346113310"
"6134","51.429707","194.29.146.149","194.29.146.97","TCP","66","cvsup > 39745 [ACK] Seq=30017 Ack=1209 Win=656 Len=0 TSval=1219284152 TSecr=346113318"
"6136","51.437631","194.29.146.149","194.29.146.97","TCP","66","cvsup > 39745 [ACK] Seq=30017 Ack=1215 Win=656 Len=0 TSval=1219284160 TSecr=346113326"
"6138","51.445610","194.29.146.149","194.29.146.97","TCP","66","cvsup > 39745 [ACK] Seq=30017 Ack=1221 Win=656 Len=0 TSval=1219284168 TSecr=346113334"
"6140","51.453492","194.29.146.149","194.29.146.97","TCP","66","cvsup > 39745 [ACK] Seq=30017 Ack=1227 Win=656 Len=0 TSval=1219284176 TSecr=346113341"
"6158","51.461557","194.29.146.149","194.29.146.97","TCP","66","cvsup > 39745 [ACK] Seq=30017 Ack=1233 Win=656 Len=0 TSval=1219284184 TSecr=346113349"
"6168","51.469759","194.29.146.149","194.29.146.97","TCP","66","cvsup > 39745 [ACK] Seq=30017 Ack=1239 Win=656 Len=0 TSval=1219284192 TSecr=346113357"
"6178","51.473784","194.29.146.149","194.29.146.97","TCP","168","cvsup > 39745 [PSH, ACK] Seq=30017 Ack=1239 Win=656 Len=102 TSval=1219284196 TSecr=346113357"
"6202","51.492735","194.29.146.149","194.29.146.97","TCP","1984","cvsup > 39745 [PSH, ACK] Seq=30119 Ack=1249 Win=656 Len=1918 TSval=1219284215 TSecr=346113362"
"6235","51.532581","194.29.146.149","194.29.146.97","TCP","66","cvsup > 39745 [ACK] Seq=32037 Ack=1255 Win=656 Len=0 TSval=1219284255 TSecr=346113381"
"6237","51.533115","194.29.146.149","194.29.146.97","TCP","66","cvsup > 39745 [ACK] Seq=32037 Ack=1289 Win=656 Len=0 TSval=1219284255 TSecr=346113421"
"6239","51.533710","194.29.146.149","194.29.146.97","TCP","66","cvsup > 39745 [ACK] Seq=32037 Ack=1295 Win=656 Len=0 TSval=1219284256 TSecr=346113421"
"6241","51.541354","194.29.146.149","194.29.146.97","TCP","66","cvsup > 39745 [ACK] Seq=32037 Ack=1301 Win=656 Len=0 TSval=1219284264 TSecr=346113429"
"6243","51.549654","194.29.146.149","194.29.146.97","TCP","66","cvsup > 39745 [ACK] Seq=32037 Ack=1307 Win=656 Len=0 TSval=1219284272 TSecr=346113437"
"6247","51.570230","194.29.146.149","194.29.146.97","TCP","66","cvsup > 39745 [ACK] Seq=32037 Ack=1313 Win=656 Len=0 TSval=1219284292 TSecr=346113445"
"6249","51.590544","194.29.146.149","194.29.146.97","TCP","66","cvsup > 39745 [ACK] Seq=32037 Ack=1319 Win=656 Len=0 TSval=1219284313 TSecr=346113458"
"6251","51.598387","194.29.146.149","194.29.146.97","TCP","66","cvsup > 39745 [ACK] Seq=32037 Ack=1337 Win=656 Len=0 TSval=1219284321 TSecr=346113479"
"6253","51.600804","194.29.146.149","194.29.146.97","TCP","66","cvsup > 39745 [ACK] Seq=32037 Ack=1343 Win=656 Len=0 TSval=1219284323 TSecr=346113487"
"6255","51.605527","194.29.146.149","194.29.146.97","TCP","66","cvsup > 39745 [ACK] Seq=32037 Ack=1349 Win=656 Len=0 TSval=1219284328 TSecr=346113493"
"6257","51.613437","194.29.146.149","194.29.146.97","TCP","66","cvsup > 39745 [ACK] Seq=32037 Ack=1355 Win=656 Len=0 TSval=1219284336 TSecr=346113501"
"6259","51.622794","194.29.146.149","194.29.146.97","TCP","66","cvsup > 39745 [ACK] Seq=32037 Ack=1361 Win=656 Len=0 TSval=1219284345 TSecr=346113509"
"6261","51.631959","194.29.146.149","194.29.146.97","TCP","1926","cvsup > 39745 [PSH, ACK] Seq=32037 Ack=1367 Win=656 Len=1860 TSval=1219284354 TSecr=346113517"
"6265","51.673337","194.29.146.149","194.29.146.97","TCP","66","cvsup > 39745 [ACK] Seq=33897 Ack=1377 Win=656 Len=0 TSval=1219284396 TSecr=346113521"
"6267","51.673976","194.29.146.149","194.29.146.97","TCP","66","cvsup > 39745 [ACK] Seq=33897 Ack=1407 Win=656 Len=0 TSval=1219284396 TSecr=346113562"
"6269","51.677782","194.29.146.149","194.29.146.97","TCP","66","cvsup > 39745 [ACK] Seq=33897 Ack=1413 Win=656 Len=0 TSval=1219284400 TSecr=346113565"
"6271","51.685621","194.29.146.149","194.29.146.97","TCP","66","cvsup > 39745 [ACK] Seq=33897 Ack=1419 Win=656 Len=0 TSval=1219284408 TSecr=346113573"
"6273","51.693362","194.29.146.149","194.29.146.97","TCP","66","cvsup > 39745 [ACK] Seq=33897 Ack=1425 Win=656 Len=0 TSval=1219284416 TSecr=346113581"
"6275","51.704187","194.29.146.149","194.29.146.97","TCP","66","cvsup > 39745 [ACK] Seq=33897 Ack=1431 Win=656 Len=0 TSval=1219284426 TSecr=346113589"
"6277","51.712219","194.29.146.149","194.29.146.97","TCP","66","cvsup > 39745 [ACK] Seq=33897 Ack=1437 Win=656 Len=0 TSval=1219284434 TSecr=346113597"
"6279","51.720066","194.29.146.149","194.29.146.97","TCP","66","cvsup > 39745 [ACK] Seq=33897 Ack=1443 Win=656 Len=0 TSval=1219284442 TSecr=346113605"
"6281","51.725400","194.29.146.149","194.29.146.97","TCP","66","cvsup > 39745 [ACK] Seq=33897 Ack=1449 Win=656 Len=0 TSval=1219284448 TSecr=346113613"
"6283","51.733375","194.29.146.149","194.29.146.97","TCP","66","cvsup > 39745 [ACK] Seq=33897 Ack=1455 Win=656 Len=0 TSval=1219284456 TSecr=346113621"
"6285","51.749496","194.29.146.149","194.29.146.97","TCP","66","cvsup > 39745 [ACK] Seq=33897 Ack=1461 Win=656 Len=0 TSval=1219284472 TSecr=346113637"
"6287","51.757771","194.29.146.149","194.29.146.97","TCP","66","cvsup > 39745 [ACK] Seq=33897 Ack=1467 Win=656 Len=0 TSval=1219284480 TSecr=346113646"
"6289","51.767195","194.29.146.149","194.29.146.97","TCP","66","cvsup > 39745 [ACK] Seq=33897 Ack=1473 Win=656 Len=0 TSval=1219284489 TSecr=346113653"
"6291","51.775543","194.29.146.149","194.29.146.97","TCP","66","cvsup > 39745 [ACK] Seq=33897 Ack=1479 Win=656 Len=0 TSval=1219284498 TSecr=346113661"
"6292","51.781273","194.29.146.149","194.29.146.97","TCP","801","cvsup > 39745 [PSH, ACK] Seq=33897 Ack=1479 Win=656 Len=735 TSval=1219284503 TSecr=346113661"
"6294","51.821622","194.29.146.149","194.29.146.97","TCP","66","cvsup > 39745 [ACK] Seq=34632 Ack=1485 Win=656 Len=0 TSval=1219284544 TSecr=346113670"
"6296","51.822160","194.29.146.149","194.29.146.97","TCP","66","cvsup > 39745 [ACK] Seq=34632 Ack=1525 Win=656 Len=0 TSval=1219284544 TSecr=346113710"
"6298","51.829387","194.29.146.149","194.29.146.97","TCP","66","cvsup > 39745 [ACK] Seq=34632 Ack=1531 Win=656 Len=0 TSval=1219284552 TSecr=346113717"
"6300","51.837363","194.29.146.149","194.29.146.97","TCP","66","cvsup > 39745 [ACK] Seq=34632 Ack=1537 Win=656 Len=0 TSval=1219284560 TSecr=346113725"
"6302","51.845405","194.29.146.149","194.29.146.97","TCP","66","cvsup > 39745 [ACK] Seq=34632 Ack=1543 Win=656 Len=0 TSval=1219284568 TSecr=346113733"
"6304","51.856434","194.29.146.149","194.29.146.97","TCP","66","cvsup > 39745 [ACK] Seq=34632 Ack=1549 Win=656 Len=0 TSval=1219284579 TSecr=346113741"
"6306","51.867416","194.29.146.149","194.29.146.97","TCP","66","cvsup > 39745 [ACK] Seq=34632 Ack=1555 Win=656 Len=0 TSval=1219284589 TSecr=346113753"
"6308","51.871094","194.29.146.149","194.29.146.97","TCP","66","cvsup > 39745 [ACK] Seq=34632 Ack=1561 Win=656 Len=0 TSval=1219284593 TSecr=346113757"
"6310","51.878825","194.29.146.149","194.29.146.97","TCP","66","cvsup > 39745 [ACK] Seq=34632 Ack=1567 Win=656 Len=0 TSval=1219284601 TSecr=346113765"
"6312","51.885496","194.29.146.149","194.29.146.97","TCP","66","cvsup > 39745 [ACK] Seq=34632 Ack=1573 Win=656 Len=0 TSval=1219284608 TSecr=346113773"
"6314","51.893506","194.29.146.149","194.29.146.97","TCP","66","cvsup > 39745 [ACK] Seq=34632 Ack=1579 Win=656 Len=0 TSval=1219284616 TSecr=346113781"
"6317","51.901388","194.29.146.149","194.29.146.97","TCP","66","cvsup > 39745 [ACK] Seq=34632 Ack=1585 Win=656 Len=0 TSval=1219284624 TSecr=346113789"
"6319","51.909420","194.29.146.149","194.29.146.97","TCP","66","cvsup > 39745 [ACK] Seq=34632 Ack=1591 Win=656 Len=0 TSval=1219284632 TSecr=346113797"
"6321","51.917637","194.29.146.149","194.29.146.97","TCP","66","cvsup > 39745 [ACK] Seq=34632 Ack=1597 Win=656 Len=0 TSval=1219284640 TSecr=346113806"
"6323","51.925619","194.29.146.149","194.29.146.97","TCP","66","cvsup > 39745 [ACK] Seq=34632 Ack=1603 Win=656 Len=0 TSval=1219284648 TSecr=346113814"
"6326","51.933615","194.29.146.149","194.29.146.97","TCP","66","cvsup > 39745 [ACK] Seq=34632 Ack=1609 Win=656 Len=0 TSval=1219284656 TSecr=346113822"
"6328","51.941692","194.29.146.149","194.29.146.97","TCP","66","cvsup > 39745 [ACK] Seq=34632 Ack=1615 Win=656 Len=0 TSval=1219284664 TSecr=346113830"
"6330","51.949606","194.29.146.149","194.29.146.97","TCP","66","cvsup > 39745 [ACK] Seq=34632 Ack=1621 Win=656 Len=0 TSval=1219284672 TSecr=346113838"
"6332","51.957663","194.29.146.149","194.29.146.97","TCP","66","cvsup > 39745 [ACK] Seq=34632 Ack=1627 Win=656 Len=0 TSval=1219284680 TSecr=346113846"
"6334","51.966512","194.29.146.149","194.29.146.97","TCP","66","cvsup > 39745 [ACK] Seq=34632 Ack=1633 Win=656 Len=0 TSval=1219284689 TSecr=346113854"
"6335","51.967049","194.29.146.149","194.29.146.97","TCP","122","cvsup > 39745 [PSH, ACK] Seq=34632 Ack=1633 Win=656 Len=56 TSval=1219284689 TSecr=346113854"
"6338","52.007560","194.29.146.149","194.29.146.97","TCP","66","cvsup > 39745 [ACK] Seq=34688 Ack=1643 Win=656 Len=0 TSval=1219284730 TSecr=346113855"
"6340","52.008175","194.29.146.149","194.29.146.97","TCP","66","cvsup > 39745 [ACK] Seq=34688 Ack=1673 Win=656 Len=0 TSval=1219284730 TSecr=346113896"
"6342","52.013435","194.29.146.149","194.29.146.97","TCP","66","cvsup > 39745 [ACK] Seq=34688 Ack=1679 Win=656 Len=0 TSval=1219284736 TSecr=346113901"
"6344","52.021723","194.29.146.149","194.29.146.97","TCP","66","cvsup > 39745 [ACK] Seq=34688 Ack=1685 Win=656 Len=0 TSval=1219284744 TSecr=346113909"
"6346","52.031705","194.29.146.149","194.29.146.97","TCP","66","cvsup > 39745 [ACK] Seq=34688 Ack=1691 Win=656 Len=0 TSval=1219284754 TSecr=346113917"
"6348","52.038836","194.29.146.149","194.29.146.97","TCP","66","cvsup > 39745 [ACK] Seq=34688 Ack=1697 Win=656 Len=0 TSval=1219284761 TSecr=346113925"
"6350","52.046553","194.29.146.149","194.29.146.97","TCP","66","cvsup > 39745 [ACK] Seq=34688 Ack=1703 Win=656 Len=0 TSval=1219284769 TSecr=346113933"
"6352","52.053585","194.29.146.149","194.29.146.97","TCP","66","cvsup > 39745 [ACK] Seq=34688 Ack=1709 Win=656 Len=0 TSval=1219284776 TSecr=346113941"
"6354","52.061469","194.29.146.149","194.29.146.97","TCP","66","cvsup > 39745 [ACK] Seq=34688 Ack=1715 Win=656 Len=0 TSval=1219284784 TSecr=346113949"
"6356","52.069475","194.29.146.149","194.29.146.97","TCP","66","cvsup > 39745 [ACK] Seq=34688 Ack=1721 Win=656 Len=0 TSval=1219284792 TSecr=346113957"
"6358","52.080129","194.29.146.149","194.29.146.97","TCP","66","cvsup > 39745 [ACK] Seq=34688 Ack=1727 Win=656 Len=0 TSval=1219284802 TSecr=346113965"
"6360","52.087390","194.29.146.149","194.29.146.97","TCP","66","cvsup > 39745 [ACK] Seq=34688 Ack=1733 Win=656 Len=0 TSval=1219284810 TSecr=346113973"
"6362","52.101974","194.29.146.149","194.29.146.97","TCP","66","cvsup > 39745 [ACK] Seq=34688 Ack=1739 Win=656 Len=0 TSval=1219284824 TSecr=346113989"
"6364","52.109972","194.29.146.149","194.29.146.97","TCP","66","cvsup > 39745 [ACK] Seq=34688 Ack=1745 Win=656 Len=0 TSval=1219284832 TSecr=346113997"
"6366","52.117465","194.29.146.149","194.29.146.97","TCP","66","cvsup > 39745 [ACK] Seq=34688 Ack=1751 Win=656 Len=0 TSval=1219284840 TSecr=346114005"
"6368","52.125748","194.29.146.149","194.29.146.97","TCP","66","cvsup > 39745 [ACK] Seq=34688 Ack=1757 Win=656 Len=0 TSval=1219284848 TSecr=346114013"
"6369","52.129306","194.29.146.149","194.29.146.97","TCP","168","cvsup > 39745 [PSH, ACK] Seq=34688 Ack=1757 Win=656 Len=102 TSval=1219284852 TSecr=346114013"
"6371","52.169465","194.29.146.149","194.29.146.97","TCP","66","cvsup > 39745 [ACK] Seq=34790 Ack=1767 Win=656 Len=0 TSval=1219284892 TSecr=346114018"
"6373","52.169997","194.29.146.149","194.29.146.97","TCP","66","cvsup > 39745 [ACK] Seq=34790 Ack=1785 Win=656 Len=0 TSval=1219284892 TSecr=346114058"
"6375","52.191322","194.29.146.149","194.29.146.97","TCP","66","cvsup > 39745 [ACK] Seq=34790 Ack=1791 Win=656 Len=0 TSval=1219284914 TSecr=346114078"
"6377","52.213969","194.29.146.149","194.29.146.97","TCP","66","cvsup > 39745 [ACK] Seq=34790 Ack=1797 Win=656 Len=0 TSval=1219284936 TSecr=346114102"
"6379","52.231849","194.29.146.149","194.29.146.97","TCP","66","cvsup > 39745 [ACK] Seq=34790 Ack=1803 Win=656 Len=0 TSval=1219284954 TSecr=346114118"
"6381","52.239158","194.29.146.149","194.29.146.97","TCP","66","cvsup > 39745 [ACK] Seq=34790 Ack=1809 Win=656 Len=0 TSval=1219284961 TSecr=346114126"
"6383","52.245928","194.29.146.149","194.29.146.97","TCP","66","cvsup > 39745 [ACK] Seq=34790 Ack=1815 Win=656 Len=0 TSval=1219284968 TSecr=346114134"
"6385","52.253746","194.29.146.149","194.29.146.97","TCP","66","cvsup > 39745 [ACK] Seq=34790 Ack=1821 Win=656 Len=0 TSval=1219284976 TSecr=346114142"
"6387","52.273437","194.29.146.149","194.29.146.97","TCP","66","cvsup > 39745 [ACK] Seq=34790 Ack=1827 Win=656 Len=0 TSval=1219284996 TSecr=346114157"
"6389","52.278948","194.29.146.149","194.29.146.97","TCP","66","cvsup > 39745 [ACK] Seq=34790 Ack=1833 Win=656 Len=0 TSval=1219285001 TSecr=346114165"
"6391","52.294029","194.29.146.149","194.29.146.97","TCP","66","cvsup > 39745 [ACK] Seq=34790 Ack=1839 Win=656 Len=0 TSval=1219285016 TSecr=346114182"
"6393","52.328110","194.29.146.149","194.29.146.97","TCP","66","cvsup > 39745 [ACK] Seq=34790 Ack=1845 Win=656 Len=0 TSval=1219285050 TSecr=346114214"
"6395","52.336057","194.29.146.149","194.29.146.97","TCP","66","cvsup > 39745 [ACK] Seq=34790 Ack=1851 Win=656 Len=0 TSval=1219285058 TSecr=346114222"
"6397","52.389538","194.29.146.149","194.29.146.97","TCP","66","cvsup > 39745 [ACK] Seq=34790 Ack=1857 Win=656 Len=0 TSval=1219285112 TSecr=346114277"
"6400","52.438030","194.29.146.149","194.29.146.97","TCP","66","cvsup > 39745 [ACK] Seq=34790 Ack=1863 Win=656 Len=0 TSval=1219285160 TSecr=346114326"
"6402","52.453926","194.29.146.149","194.29.146.97","TCP","66","cvsup > 39745 [ACK] Seq=34790 Ack=1869 Win=656 Len=0 TSval=1219285176 TSecr=346114342"
"6420","52.464111","194.29.146.149","194.29.146.97","TCP","66","cvsup > 39745 [ACK] Seq=34790 Ack=1875 Win=656 Len=0 TSval=1219285186 TSecr=346114350"
"6426","52.469941","194.29.146.149","194.29.146.97","TCP","66","cvsup > 39745 [ACK] Seq=34790 Ack=1881 Win=656 Len=0 TSval=1219285192 TSecr=346114358"
"6443","52.477857","194.29.146.149","194.29.146.97","TCP","66","cvsup > 39745 [ACK] Seq=34790 Ack=1887 Win=656 Len=0 TSval=1219285200 TSecr=346114366"
"6463","52.486542","194.29.146.149","194.29.146.97","TCP","66","cvsup > 39745 [ACK] Seq=34790 Ack=1893 Win=656 Len=0 TSval=1219285209 TSecr=346114373"
"6474","52.494024","194.29.146.149","194.29.146.97","TCP","66","cvsup > 39745 [ACK] Seq=34790 Ack=1899 Win=656 Len=0 TSval=1219285216 TSecr=346114381"
"6490","52.502390","194.29.146.149","194.29.146.97","TCP","66","cvsup > 39745 [ACK] Seq=34790 Ack=1905 Win=656 Len=0 TSval=1219285224 TSecr=346114389"
"6499","52.510761","194.29.146.149","194.29.146.97","TCP","66","cvsup > 39745 [ACK] Seq=34790 Ack=1911 Win=656 Len=0 TSval=1219285233 TSecr=346114397"
"6502","52.519291","194.29.146.149","194.29.146.97","TCP","66","cvsup > 39745 [ACK] Seq=34790 Ack=1917 Win=656 Len=0 TSval=1219285241 TSecr=346114405"
"6505","52.527949","194.29.146.149","194.29.146.97","TCP","66","cvsup > 39745 [ACK] Seq=34790 Ack=1923 Win=656 Len=0 TSval=1219285250 TSecr=346114414"
"6507","52.535555","194.29.146.149","194.29.146.97","TCP","66","cvsup > 39745 [ACK] Seq=34790 Ack=1929 Win=656 Len=0 TSval=1219285257 TSecr=346114421"
"6509","52.541709","194.29.146.149","194.29.146.97","TCP","66","cvsup > 39745 [ACK] Seq=34790 Ack=1935 Win=656 Len=0 TSval=1219285264 TSecr=346114429"
"6511","52.549467","194.29.146.149","194.29.146.97","TCP","66","cvsup > 39745 [ACK] Seq=34790 Ack=1941 Win=656 Len=0 TSval=1219285272 TSecr=346114437"
"6513","52.557442","194.29.146.149","194.29.146.97","TCP","66","cvsup > 39745 [ACK] Seq=34790 Ack=1947 Win=656 Len=0 TSval=1219285280 TSecr=346114445"
"6514","52.558117","194.29.146.149","194.29.146.97","TCP","122","cvsup > 39745 [PSH, ACK] Seq=34790 Ack=1947 Win=656 Len=56 TSval=1219285280 TSecr=346114445"
"6517","52.598450","194.29.146.149","194.29.146.97","TCP","66","cvsup > 39745 [ACK] Seq=34846 Ack=1957 Win=656 Len=0 TSval=1219285321 TSecr=346114446"
"6519","52.598979","194.29.146.149","194.29.146.97","TCP","66","cvsup > 39745 [ACK] Seq=34846 Ack=1975 Win=656 Len=0 TSval=1219285321 TSecr=346114487"
"6521","52.621636","194.29.146.149","194.29.146.97","TCP","66","cvsup > 39745 [ACK] Seq=34846 Ack=1981 Win=656 Len=0 TSval=1219285344 TSecr=346114510"
"6528","52.656382","194.29.146.149","194.29.146.97","TCP","66","cvsup > 39745 [ACK] Seq=34846 Ack=1987 Win=656 Len=0 TSval=1219285378 TSecr=346114525"
"6530","52.676668","194.29.146.149","194.29.146.97","TCP","66","cvsup > 39745 [ACK] Seq=34846 Ack=1993 Win=656 Len=0 TSval=1219285399 TSecr=346114545"
