"No.","Time","Source","Destination","Protocol","Length","Info"
"336","2.704128","194.29.146.149","194.29.146.97","TCP","66","cvsup > 39746 [ACK] Seq=1 Ack=7 Win=794 Len=0 TSval=1219610280 TSecr=346439454"
"337","2.708050","194.29.146.149","194.29.146.97","TCP","168","cvsup > 39746 [PSH, ACK] Seq=1 Ack=7 Win=794 Len=102 TSval=1219610284 TSecr=346439454"
"339","2.748546","194.29.146.149","194.29.146.97","TCP","66","cvsup > 39746 [ACK] Seq=103 Ack=17 Win=794 Len=0 TSval=1219610325 TSecr=346439458"
"341","2.748802","194.29.146.149","194.29.146.97","TCP","66","cvsup > 39746 [ACK] Seq=103 Ack=47 Win=794 Len=0 TSval=1219610325 TSecr=346439499"
"343","2.751971","194.29.146.149","194.29.146.97","TCP","66","cvsup > 39746 [ACK] Seq=103 Ack=53 Win=794 Len=0 TSval=1219610328 TSecr=346439502"
"345","2.760004","194.29.146.149","194.29.146.97","TCP","66","cvsup > 39746 [ACK] Seq=103 Ack=59 Win=794 Len=0 TSval=1219610336 TSecr=346439510"
"347","2.768046","194.29.146.149","194.29.146.97","TCP","66","cvsup > 39746 [ACK] Seq=103 Ack=65 Win=794 Len=0 TSval=1219610344 TSecr=346439518"
"349","2.775946","194.29.146.149","194.29.146.97","TCP","66","cvsup > 39746 [ACK] Seq=103 Ack=71 Win=794 Len=0 TSval=1219610352 TSecr=346439526"
"351","2.784012","194.29.146.149","194.29.146.97","TCP","66","cvsup > 39746 [ACK] Seq=103 Ack=77 Win=794 Len=0 TSval=1219610360 TSecr=346439534"
"353","2.791979","194.29.146.149","194.29.146.97","TCP","66","cvsup > 39746 [ACK] Seq=103 Ack=83 Win=794 Len=0 TSval=1219610368 TSecr=346439542"
"355","2.799997","194.29.146.149","194.29.146.97","TCP","66","cvsup > 39746 [ACK] Seq=103 Ack=89 Win=794 Len=0 TSval=1219610376 TSecr=346439550"
"357","2.807832","194.29.146.149","194.29.146.97","TCP","66","cvsup > 39746 [ACK] Seq=103 Ack=95 Win=794 Len=0 TSval=1219610384 TSecr=346439558"
"359","2.816147","194.29.146.149","194.29.146.97","TCP","66","cvsup > 39746 [ACK] Seq=103 Ack=101 Win=794 Len=0 TSval=1219610392 TSecr=346439566"
"361","2.824101","194.29.146.149","194.29.146.97","TCP","66","cvsup > 39746 [ACK] Seq=103 Ack=107 Win=794 Len=0 TSval=1219610400 TSecr=346439574"
"363","2.831833","194.29.146.149","194.29.146.97","TCP","66","cvsup > 39746 [ACK] Seq=103 Ack=113 Win=794 Len=0 TSval=1219610408 TSecr=346439581"
"365","2.839743","194.29.146.149","194.29.146.97","TCP","66","cvsup > 39746 [ACK] Seq=103 Ack=119 Win=794 Len=0 TSval=1219610416 TSecr=346439589"
"367","2.854311","194.29.146.149","194.29.146.97","TCP","66","cvsup > 39746 [ACK] Seq=103 Ack=125 Win=794 Len=0 TSval=1219610430 TSecr=346439597"
"369","2.874916","194.29.146.149","194.29.146.97","TCP","66","cvsup > 39746 [ACK] Seq=103 Ack=131 Win=794 Len=0 TSval=1219610451 TSecr=346439606"
"371","2.895367","194.29.146.149","194.29.146.97","TCP","66","cvsup > 39746 [ACK] Seq=103 Ack=143 Win=794 Len=0 TSval=1219610471 TSecr=346439625"
"373","2.896167","194.29.146.149","194.29.146.97","TCP","66","cvsup > 39746 [ACK] Seq=103 Ack=155 Win=794 Len=0 TSval=1219610472 TSecr=346439645"
"375","2.896183","194.29.146.149","194.29.146.97","TCP","196","cvsup > 39746 [PSH, ACK] Seq=103 Ack=155 Win=794 Len=130 TSval=1219610472 TSecr=346439645"
"378","2.936564","194.29.146.149","194.29.146.97","TCP","66","cvsup > 39746 [ACK] Seq=233 Ack=161 Win=794 Len=0 TSval=1219610513 TSecr=346439646"
"380","2.937088","194.29.146.149","194.29.146.97","TCP","66","cvsup > 39746 [ACK] Seq=233 Ack=201 Win=794 Len=0 TSval=1219610513 TSecr=346439687"
"381","2.937587","194.29.146.149","194.29.146.97","TCP","184","cvsup > 39746 [PSH, ACK] Seq=233 Ack=201 Win=794 Len=118 TSval=1219610514 TSecr=346439687"
"384","2.938275","194.29.146.149","194.29.146.97","TCP","168","cvsup > 39746 [PSH, ACK] Seq=351 Ack=211 Win=794 Len=102 TSval=1219610514 TSecr=346439688"
"386","2.948873","194.29.146.149","194.29.146.97","TCP","2962","cvsup > 39746 [ACK] Seq=453 Ack=221 Win=794 Len=2896 TSval=1219610525 TSecr=346439688"
"388","2.949107","194.29.146.149","194.29.146.97","TCP","2089","cvsup > 39746 [PSH, ACK] Seq=3349 Ack=221 Win=794 Len=2023 TSval=1219610525 TSecr=346439688"
"390","2.949625","194.29.146.149","194.29.146.97","TCP","1017","cvsup > 39746 [PSH, ACK] Seq=5372 Ack=237 Win=794 Len=951 TSval=1219610526 TSecr=346439699"
"392","2.990552","194.29.146.149","194.29.146.97","TCP","66","cvsup > 39746 [ACK] Seq=6323 Ack=277 Win=794 Len=0 TSval=1219610567 TSecr=346439701"
"394","2.991095","194.29.146.149","194.29.146.97","TCP","66","cvsup > 39746 [ACK] Seq=6323 Ack=317 Win=794 Len=0 TSval=1219610567 TSecr=346439741"
"396","2.993077","194.29.146.149","194.29.146.97","TCP","66","cvsup > 39746 [ACK] Seq=6323 Ack=323 Win=794 Len=0 TSval=1219610569 TSecr=346439743"
"402","3.005873","194.29.146.149","194.29.146.97","TCP","66","cvsup > 39746 [ACK] Seq=6323 Ack=329 Win=794 Len=0 TSval=1219610582 TSecr=346439754"
"421","3.019812","194.29.146.149","194.29.146.97","TCP","66","cvsup > 39746 [ACK] Seq=6323 Ack=335 Win=794 Len=0 TSval=1219610596 TSecr=346439758"
"423","3.020078","194.29.146.149","194.29.146.97","TCP","66","cvsup > 39746 [ACK] Seq=6323 Ack=341 Win=794 Len=0 TSval=1219610596 TSecr=346439770"
"434","3.024651","194.29.146.149","194.29.146.97","TCP","66","cvsup > 39746 [ACK] Seq=6323 Ack=347 Win=794 Len=0 TSval=1219610601 TSecr=346439774"
"447","3.034215","194.29.146.149","194.29.146.97","TCP","66","cvsup > 39746 [ACK] Seq=6323 Ack=353 Win=794 Len=0 TSval=1219610610 TSecr=346439781"
"487","3.058241","194.29.146.149","194.29.146.97","TCP","66","cvsup > 39746 [ACK] Seq=6323 Ack=359 Win=794 Len=0 TSval=1219610634 TSecr=346439789"
"494","3.078600","194.29.146.149","194.29.146.97","TCP","66","cvsup > 39746 [ACK] Seq=6323 Ack=371 Win=794 Len=0 TSval=1219610655 TSecr=346439808"
"496","3.098857","194.29.146.149","194.29.146.97","TCP","66","cvsup > 39746 [ACK] Seq=6323 Ack=383 Win=794 Len=0 TSval=1219610675 TSecr=346439829"
"499","3.119192","194.29.146.149","194.29.146.97","TCP","66","cvsup > 39746 [ACK] Seq=6323 Ack=401 Win=794 Len=0 TSval=1219610695 TSecr=346439849"
"503","3.139511","194.29.146.149","194.29.146.97","TCP","66","cvsup > 39746 [ACK] Seq=6323 Ack=413 Win=794 Len=0 TSval=1219610716 TSecr=346439869"
"506","3.159889","194.29.146.149","194.29.146.97","TCP","66","cvsup > 39746 [ACK] Seq=6323 Ack=419 Win=794 Len=0 TSval=1219610736 TSecr=346439889"
"508","3.180346","194.29.146.149","194.29.146.97","TCP","66","cvsup > 39746 [ACK] Seq=6323 Ack=431 Win=794 Len=0 TSval=1219610757 TSecr=346439910"
"510","3.200736","194.29.146.149","194.29.146.97","TCP","66","cvsup > 39746 [ACK] Seq=6323 Ack=443 Win=794 Len=0 TSval=1219610777 TSecr=346439930"
"512","3.221217","194.29.146.149","194.29.146.97","TCP","66","cvsup > 39746 [ACK] Seq=6323 Ack=461 Win=794 Len=0 TSval=1219610797 TSecr=346439951"
"515","3.249877","194.29.146.149","194.29.146.97","TCP","66","cvsup > 39746 [ACK] Seq=6323 Ack=467 Win=794 Len=0 TSval=1219610826 TSecr=346439998"
"517","3.256288","194.29.146.149","194.29.146.97","TCP","66","cvsup > 39746 [ACK] Seq=6323 Ack=473 Win=794 Len=0 TSval=1219610832 TSecr=346440006"
"519","3.263846","194.29.146.149","194.29.146.97","TCP","66","cvsup > 39746 [ACK] Seq=6323 Ack=479 Win=794 Len=0 TSval=1219610840 TSecr=346440013"
"521","3.272019","194.29.146.149","194.29.146.97","TCP","66","cvsup > 39746 [ACK] Seq=6323 Ack=485 Win=794 Len=0 TSval=1219610848 TSecr=346440022"
"523","3.280267","194.29.146.149","194.29.146.97","TCP","66","cvsup > 39746 [ACK] Seq=6323 Ack=491 Win=794 Len=0 TSval=1219610856 TSecr=346440030"
"525","3.287911","194.29.146.149","194.29.146.97","TCP","66","cvsup > 39746 [ACK] Seq=6323 Ack=497 Win=794 Len=0 TSval=1219610864 TSecr=346440038"
"528","3.360985","194.29.146.149","194.29.146.97","TCP","66","cvsup > 39746 [ACK] Seq=6323 Ack=503 Win=794 Len=0 TSval=1219610937 TSecr=346440110"
"530","3.441639","194.29.146.149","194.29.146.97","TCP","66","cvsup > 39746 [ACK] Seq=6323 Ack=509 Win=794 Len=0 TSval=1219611018 TSecr=346440190"
"533","3.468828","194.29.146.149","194.29.146.97","TCP","66","cvsup > 39746 [ACK] Seq=6323 Ack=515 Win=794 Len=0 TSval=1219611045 TSecr=346440206"
"536","3.489249","194.29.146.149","194.29.146.97","TCP","66","cvsup > 39746 [ACK] Seq=6323 Ack=521 Win=794 Len=0 TSval=1219611065 TSecr=346440219"
"538","3.509708","194.29.146.149","194.29.146.97","TCP","66","cvsup > 39746 [ACK] Seq=6323 Ack=533 Win=794 Len=0 TSval=1219611086 TSecr=346440239"
"540","3.519549","194.29.146.149","194.29.146.97","TCP","66","cvsup > 39746 [ACK] Seq=6323 Ack=539 Win=794 Len=0 TSval=1219611096 TSecr=346440260"
"541","3.520111","194.29.146.149","194.29.146.97","TCP","122","cvsup > 39746 [PSH, ACK] Seq=6323 Ack=539 Win=794 Len=56 TSval=1219611096 TSecr=346440260"
"543","3.535435","194.29.146.149","194.29.146.97","TCP","341","cvsup > 39746 [PSH, ACK] Seq=6379 Ack=549 Win=794 Len=275 TSval=1219611112 TSecr=346440270"
"545","3.575555","194.29.146.149","194.29.146.97","TCP","66","cvsup > 39746 [ACK] Seq=6654 Ack=559 Win=794 Len=0 TSval=1219611152 TSecr=346440286"
"547","3.595436","194.29.146.149","194.29.146.97","TCP","66","cvsup > 39746 [ACK] Seq=6654 Ack=565 Win=794 Len=0 TSval=1219611171 TSecr=346440334"
"549","3.685139","194.29.146.149","194.29.146.97","TCP","66","cvsup > 39746 [ACK] Seq=6654 Ack=573 Win=794 Len=0 TSval=1219611261 TSecr=346440434"
"551","3.804371","194.29.146.149","194.29.146.97","TCP","66","cvsup > 39746 [ACK] Seq=6654 Ack=581 Win=794 Len=0 TSval=1219611381 TSecr=346440554"
"552","3.823796","194.29.146.149","194.29.146.97","TCP","2962","cvsup > 39746 [ACK] Seq=6654 Ack=581 Win=794 Len=2896 TSval=1219611400 TSecr=346440554"
"554","3.824041","194.29.146.149","194.29.146.97","TCP","2962","cvsup > 39746 [ACK] Seq=9550 Ack=581 Win=794 Len=2896 TSval=1219611400 TSecr=346440554"
"555","3.824283","194.29.146.149","194.29.146.97","TCP","1514","cvsup > 39746 [ACK] Seq=12446 Ack=581 Win=794 Len=1448 TSval=1219611400 TSecr=346440554"
"556","3.824292","194.29.146.149","194.29.146.97","TCP","523","cvsup > 39746 [PSH, ACK] Seq=13894 Ack=581 Win=794 Len=457 TSval=1219611400 TSecr=346440574"
"559","3.865071","194.29.146.149","194.29.146.97","TCP","66","cvsup > 39746 [ACK] Seq=14351 Ack=611 Win=794 Len=0 TSval=1219611441 TSecr=346440575"
"644","4.098158","194.29.146.149","194.29.146.97","TCP","518","cvsup > 39746 [PSH, ACK] Seq=14351 Ack=611 Win=794 Len=452 TSval=1219611674 TSecr=346440575"
"646","4.098632","194.29.146.149","194.29.146.97","TCP","66","cvsup > 39746 [ACK] Seq=14803 Ack=621 Win=794 Len=0 TSval=1219611675 TSecr=346440848"
"650","4.375635","194.29.146.149","194.29.146.97","TCP","476","cvsup > 39746 [PSH, ACK] Seq=14803 Ack=621 Win=794 Len=410 TSval=1219611952 TSecr=346440848"
"652","4.376220","194.29.146.149","194.29.146.97","TCP","66","cvsup > 39746 [ACK] Seq=15213 Ack=631 Win=794 Len=0 TSval=1219611952 TSecr=346441126"
"653","4.526785","194.29.146.149","194.29.146.97","TCP","4283","cvsup > 39746 [PSH, ACK] Seq=15213 Ack=631 Win=794 Len=4217 TSval=1219612103 TSecr=346441126"
"656","4.533987","194.29.146.149","194.29.146.97","TCP","66","cvsup > 39746 [ACK] Seq=19430 Ack=891 Win=803 Len=0 TSval=1219612110 TSecr=346441283"
"905","6.613755","194.29.146.149","194.29.146.97","TCP","1514","cvsup > 39746 [ACK] Seq=19430 Ack=891 Win=803 Len=1448 TSval=1219614189 TSecr=346441283"
"906","6.614004","194.29.146.149","194.29.146.97","TCP","2962","cvsup > 39746 [ACK] Seq=20878 Ack=891 Win=803 Len=2896 TSval=1219614189 TSecr=346441283"
"908","6.614253","194.29.146.149","194.29.146.97","TCP","2962","cvsup > 39746 [ACK] Seq=23774 Ack=891 Win=803 Len=2896 TSval=1219614189 TSecr=346441283"
"910","6.614696","194.29.146.149","194.29.146.97","TCP","1514","cvsup > 39746 [ACK] Seq=26670 Ack=891 Win=803 Len=1448 TSval=1219614191 TSecr=346443364"
"911","6.614925","194.29.146.149","194.29.146.97","TCP","1514","cvsup > 39746 [ACK] Seq=28118 Ack=891 Win=803 Len=1448 TSval=1219614191 TSecr=346443364"
"912","6.615198","194.29.146.149","194.29.146.97","TCP","1413","cvsup > 39746 [PSH, ACK] Seq=29566 Ack=891 Win=803 Len=1347 TSval=1219614191 TSecr=346443365"
"915","6.617375","194.29.146.149","194.29.146.97","TCP","66","cvsup > 39746 [ACK] Seq=30913 Ack=1001 Win=803 Len=0 TSval=1219614194 TSecr=346443367"
"917","6.680222","194.29.146.149","194.29.146.97","TCP","66","cvsup > 39746 [ACK] Seq=30913 Ack=1007 Win=803 Len=0 TSval=1219614256 TSecr=346443430"
"919","6.688124","194.29.146.149","194.29.146.97","TCP","66","cvsup > 39746 [ACK] Seq=30913 Ack=1013 Win=803 Len=0 TSval=1219614264 TSecr=346443438"
"921","6.704202","194.29.146.149","194.29.146.97","TCP","66","cvsup > 39746 [ACK] Seq=30913 Ack=1019 Win=803 Len=0 TSval=1219614280 TSecr=346443454"
"923","6.720306","194.29.146.149","194.29.146.97","TCP","66","cvsup > 39746 [ACK] Seq=30913 Ack=1025 Win=803 Len=0 TSval=1219614297 TSecr=346443470"
"925","6.848522","194.29.146.149","194.29.146.97","TCP","66","cvsup > 39746 [ACK] Seq=30913 Ack=1031 Win=803 Len=0 TSval=1219614424 TSecr=346443598"
"927","6.880215","194.29.146.149","194.29.146.97","TCP","66","cvsup > 39746 [ACK] Seq=30913 Ack=1037 Win=803 Len=0 TSval=1219614456 TSecr=346443630"
"929","6.912275","194.29.146.149","194.29.146.97","TCP","66","cvsup > 39746 [ACK] Seq=30913 Ack=1043 Win=803 Len=0 TSval=1219614489 TSecr=346443662"
"931","6.920374","194.29.146.149","194.29.146.97","TCP","66","cvsup > 39746 [ACK] Seq=30913 Ack=1049 Win=803 Len=0 TSval=1219614497 TSecr=346443670"
"933","6.936283","194.29.146.149","194.29.146.97","TCP","66","cvsup > 39746 [ACK] Seq=30913 Ack=1055 Win=803 Len=0 TSval=1219614513 TSecr=346443686"
"935","6.944410","194.29.146.149","194.29.146.97","TCP","66","cvsup > 39746 [ACK] Seq=30913 Ack=1061 Win=803 Len=0 TSval=1219614521 TSecr=346443694"
"937","6.952449","194.29.146.149","194.29.146.97","TCP","66","cvsup > 39746 [ACK] Seq=30913 Ack=1067 Win=803 Len=0 TSval=1219614529 TSecr=346443702"
"939","6.960350","194.29.146.149","194.29.146.97","TCP","66","cvsup > 39746 [ACK] Seq=30913 Ack=1073 Win=803 Len=0 TSval=1219614537 TSecr=346443710"
"941","6.976688","194.29.146.149","194.29.146.97","TCP","66","cvsup > 39746 [ACK] Seq=30913 Ack=1079 Win=803 Len=0 TSval=1219614553 TSecr=346443726"
"943","6.984229","194.29.146.149","194.29.146.97","TCP","66","cvsup > 39746 [ACK] Seq=30913 Ack=1085 Win=803 Len=0 TSval=1219614560 TSecr=346443734"
"945","6.992170","194.29.146.149","194.29.146.97","TCP","66","cvsup > 39746 [ACK] Seq=30913 Ack=1091 Win=803 Len=0 TSval=1219614568 TSecr=346443742"
"947","7.001536","194.29.146.149","194.29.146.97","TCP","66","cvsup > 39746 [ACK] Seq=30913 Ack=1097 Win=803 Len=0 TSval=1219614577 TSecr=346443750"
"950","7.008425","194.29.146.149","194.29.146.97","TCP","66","cvsup > 39746 [ACK] Seq=30913 Ack=1103 Win=803 Len=0 TSval=1219614585 TSecr=346443758"
"967","7.016398","194.29.146.149","194.29.146.97","TCP","66","cvsup > 39746 [ACK] Seq=30913 Ack=1109 Win=803 Len=0 TSval=1219614593 TSecr=346443766"
"980","7.024621","194.29.146.149","194.29.146.97","TCP","66","cvsup > 39746 [ACK] Seq=30913 Ack=1115 Win=803 Len=0 TSval=1219614601 TSecr=346443774"
"996","7.032382","194.29.146.149","194.29.146.97","TCP","66","cvsup > 39746 [ACK] Seq=30913 Ack=1121 Win=803 Len=0 TSval=1219614609 TSecr=346443782"
"1014","7.040372","194.29.146.149","194.29.146.97","TCP","66","cvsup > 39746 [ACK] Seq=30913 Ack=1127 Win=803 Len=0 TSval=1219614616 TSecr=346443790"
"1033","7.050937","194.29.146.149","194.29.146.97","TCP","66","cvsup > 39746 [ACK] Seq=30913 Ack=1133 Win=803 Len=0 TSval=1219614627 TSecr=346443801"
"1045","7.058217","194.29.146.149","194.29.146.97","TCP","66","cvsup > 39746 [ACK] Seq=30913 Ack=1139 Win=803 Len=0 TSval=1219614634 TSecr=346443806"
"1051","7.069684","194.29.146.149","194.29.146.97","TCP","66","cvsup > 39746 [ACK] Seq=30913 Ack=1145 Win=803 Len=0 TSval=1219614646 TSecr=346443814"
"1053","7.072192","194.29.146.149","194.29.146.97","TCP","66","cvsup > 39746 [ACK] Seq=30913 Ack=1151 Win=803 Len=0 TSval=1219614648 TSecr=346443822"
"1055","7.080585","194.29.146.149","194.29.146.97","TCP","66","cvsup > 39746 [ACK] Seq=30913 Ack=1157 Win=803 Len=0 TSval=1219614657 TSecr=346443830"
"1057","7.088213","194.29.146.149","194.29.146.97","TCP","66","cvsup > 39746 [ACK] Seq=30913 Ack=1163 Win=803 Len=0 TSval=1219614665 TSecr=346443838"
"1059","7.098942","194.29.146.149","194.29.146.97","TCP","66","cvsup > 39746 [ACK] Seq=30913 Ack=1169 Win=803 Len=0 TSval=1219614675 TSecr=346443846"
"1061","7.105447","194.29.146.149","194.29.146.97","TCP","66","cvsup > 39746 [ACK] Seq=30913 Ack=1175 Win=803 Len=0 TSval=1219614682 TSecr=346443854"
"1064","7.112864","194.29.146.149","194.29.146.97","TCP","66","cvsup > 39746 [ACK] Seq=30913 Ack=1181 Win=803 Len=0 TSval=1219614689 TSecr=346443862"
"1066","7.120490","194.29.146.149","194.29.146.97","TCP","66","cvsup > 39746 [ACK] Seq=30913 Ack=1187 Win=803 Len=0 TSval=1219614696 TSecr=346443870"
"1068","7.128206","194.29.146.149","194.29.146.97","TCP","66","cvsup > 39746 [ACK] Seq=30913 Ack=1193 Win=803 Len=0 TSval=1219614705 TSecr=346443878"
"1069","7.128761","194.29.146.149","194.29.146.97","TCP","168","cvsup > 39746 [PSH, ACK] Seq=30913 Ack=1193 Win=803 Len=102 TSval=1219614705 TSecr=346443878"
"1072","7.145456","194.29.146.149","194.29.146.97","TCP","2448","cvsup > 39746 [PSH, ACK] Seq=31015 Ack=1203 Win=803 Len=2382 TSval=1219614721 TSecr=346443879"
"1074","7.186653","194.29.146.149","194.29.146.97","TCP","66","cvsup > 39746 [ACK] Seq=33397 Ack=1215 Win=803 Len=0 TSval=1219614762 TSecr=346443895"
"1076","7.187198","194.29.146.149","194.29.146.97","TCP","66","cvsup > 39746 [ACK] Seq=33397 Ack=1255 Win=803 Len=0 TSval=1219614763 TSecr=346443937"
"1078","7.193425","194.29.146.149","194.29.146.97","TCP","66","cvsup > 39746 [ACK] Seq=33397 Ack=1261 Win=803 Len=0 TSval=1219614769 TSecr=346443942"
"1080","7.201229","194.29.146.149","194.29.146.97","TCP","66","cvsup > 39746 [ACK] Seq=33397 Ack=1267 Win=803 Len=0 TSval=1219614777 TSecr=346443950"
"1082","7.208915","194.29.146.149","194.29.146.97","TCP","66","cvsup > 39746 [ACK] Seq=33397 Ack=1273 Win=803 Len=0 TSval=1219614785 TSecr=346443958"
"1084","7.216335","194.29.146.149","194.29.146.97","TCP","66","cvsup > 39746 [ACK] Seq=33397 Ack=1279 Win=803 Len=0 TSval=1219614793 TSecr=346443966"
"1086","7.224373","194.29.146.149","194.29.146.97","TCP","66","cvsup > 39746 [ACK] Seq=33397 Ack=1285 Win=803 Len=0 TSval=1219614801 TSecr=346443974"
"1088","7.234871","194.29.146.149","194.29.146.97","TCP","66","cvsup > 39746 [ACK] Seq=33397 Ack=1291 Win=803 Len=0 TSval=1219614811 TSecr=346443982"
"1091","7.248804","194.29.146.149","194.29.146.97","TCP","66","cvsup > 39746 [ACK] Seq=33397 Ack=1297 Win=803 Len=0 TSval=1219614825 TSecr=346443998"
"1093","7.256205","194.29.146.149","194.29.146.97","TCP","66","cvsup > 39746 [ACK] Seq=33397 Ack=1303 Win=803 Len=0 TSval=1219614832 TSecr=346444006"
"1095","7.264186","194.29.146.149","194.29.146.97","TCP","66","cvsup > 39746 [ACK] Seq=33397 Ack=1309 Win=803 Len=0 TSval=1219614840 TSecr=346444014"
"1097","7.275330","194.29.146.149","194.29.146.97","TCP","66","cvsup > 39746 [ACK] Seq=33397 Ack=1315 Win=803 Len=0 TSval=1219614851 TSecr=346444022"
"1099","7.281103","194.29.146.149","194.29.146.97","TCP","66","cvsup > 39746 [ACK] Seq=33397 Ack=1321 Win=803 Len=0 TSval=1219614857 TSecr=346444030"
"1101","7.288432","194.29.146.149","194.29.146.97","TCP","66","cvsup > 39746 [ACK] Seq=33397 Ack=1327 Win=803 Len=0 TSval=1219614865 TSecr=346444038"
"1103","7.296457","194.29.146.149","194.29.146.97","TCP","66","cvsup > 39746 [ACK] Seq=33397 Ack=1333 Win=803 Len=0 TSval=1219614873 TSecr=346444046"
"1105","7.313317","194.29.146.149","194.29.146.97","TCP","66","cvsup > 39746 [ACK] Seq=33397 Ack=1339 Win=803 Len=0 TSval=1219614889 TSecr=346444062"
"1107","7.320762","194.29.146.149","194.29.146.97","TCP","66","cvsup > 39746 [ACK] Seq=33397 Ack=1345 Win=803 Len=0 TSval=1219614897 TSecr=346444070"
"1109","7.328366","194.29.146.149","194.29.146.97","TCP","66","cvsup > 39746 [ACK] Seq=33397 Ack=1351 Win=803 Len=0 TSval=1219614905 TSecr=346444078"
"1111","7.336408","194.29.146.149","194.29.146.97","TCP","66","cvsup > 39746 [ACK] Seq=33397 Ack=1357 Win=803 Len=0 TSval=1219614913 TSecr=346444086"
"1113","7.346214","194.29.146.149","194.29.146.97","TCP","66","cvsup > 39746 [ACK] Seq=33397 Ack=1363 Win=803 Len=0 TSval=1219614922 TSecr=346444094"
"1115","7.354749","194.29.146.149","194.29.146.97","TCP","66","cvsup > 39746 [ACK] Seq=33397 Ack=1369 Win=803 Len=0 TSval=1219614930 TSecr=346444102"
"1117","7.361845","194.29.146.149","194.29.146.97","TCP","66","cvsup > 39746 [ACK] Seq=33397 Ack=1375 Win=803 Len=0 TSval=1219614938 TSecr=346444111"
"1119","7.376246","194.29.146.149","194.29.146.97","TCP","66","cvsup > 39746 [ACK] Seq=33397 Ack=1381 Win=803 Len=0 TSval=1219614952 TSecr=346444126"
"1121","7.394229","194.29.146.149","194.29.146.97","TCP","66","cvsup > 39746 [ACK] Seq=33397 Ack=1387 Win=803 Len=0 TSval=1219614970 TSecr=346444142"
"1123","7.409551","194.29.146.149","194.29.146.97","TCP","66","cvsup > 39746 [ACK] Seq=33397 Ack=1393 Win=803 Len=0 TSval=1219614986 TSecr=346444158"
"1124","7.415969","194.29.146.149","194.29.146.97","TCP","2232","cvsup > 39746 [PSH, ACK] Seq=33397 Ack=1393 Win=803 Len=2166 TSval=1219614992 TSecr=346444158"
"1127","7.457291","194.29.146.149","194.29.146.97","TCP","66","cvsup > 39746 [ACK] Seq=35563 Ack=1409 Win=803 Len=0 TSval=1219615033 TSecr=346444166"
"1129","7.457571","194.29.146.149","194.29.146.97","TCP","66","cvsup > 39746 [ACK] Seq=35563 Ack=1439 Win=803 Len=0 TSval=1219615034 TSecr=346444207"
"1133","7.464790","194.29.146.149","194.29.146.97","TCP","66","cvsup > 39746 [ACK] Seq=35563 Ack=1445 Win=803 Len=0 TSval=1219615041 TSecr=346444214"
"1135","7.473266","194.29.146.149","194.29.146.97","TCP","66","cvsup > 39746 [ACK] Seq=35563 Ack=1451 Win=803 Len=0 TSval=1219615049 TSecr=346444222"
"1137","7.480370","194.29.146.149","194.29.146.97","TCP","66","cvsup > 39746 [ACK] Seq=35563 Ack=1457 Win=803 Len=0 TSval=1219615057 TSecr=346444230"
"1139","7.488304","194.29.146.149","194.29.146.97","TCP","66","cvsup > 39746 [ACK] Seq=35563 Ack=1463 Win=803 Len=0 TSval=1219615065 TSecr=346444238"
"1141","7.498758","194.29.146.149","194.29.146.97","TCP","66","cvsup > 39746 [ACK] Seq=35563 Ack=1469 Win=803 Len=0 TSval=1219615075 TSecr=346444246"
"1144","7.506191","194.29.146.149","194.29.146.97","TCP","66","cvsup > 39746 [ACK] Seq=35563 Ack=1475 Win=803 Len=0 TSval=1219615082 TSecr=346444254"
"1146","7.512647","194.29.146.149","194.29.146.97","TCP","66","cvsup > 39746 [ACK] Seq=35563 Ack=1481 Win=803 Len=0 TSval=1219615089 TSecr=346444262"
"1148","7.528344","194.29.146.149","194.29.146.97","TCP","66","cvsup > 39746 [ACK] Seq=35563 Ack=1487 Win=803 Len=0 TSval=1219615105 TSecr=346444278"
"1149","7.535829","194.29.146.149","194.29.146.97","TCP","122","cvsup > 39746 [PSH, ACK] Seq=35563 Ack=1487 Win=803 Len=56 TSval=1219615112 TSecr=346444278"
"1151","7.576557","194.29.146.149","194.29.146.97","TCP","66","cvsup > 39746 [ACK] Seq=35619 Ack=1497 Win=803 Len=0 TSval=1219615153 TSecr=346444286"
"1153","7.577138","194.29.146.149","194.29.146.97","TCP","66","cvsup > 39746 [ACK] Seq=35619 Ack=1533 Win=803 Len=0 TSval=1219615153 TSecr=346444327"
"1155","7.584528","194.29.146.149","194.29.146.97","TCP","66","cvsup > 39746 [ACK] Seq=35619 Ack=1539 Win=803 Len=0 TSval=1219615161 TSecr=346444334"
"1157","7.592451","194.29.146.149","194.29.146.97","TCP","66","cvsup > 39746 [ACK] Seq=35619 Ack=1545 Win=803 Len=0 TSval=1219615169 TSecr=346444342"
"1159","7.602954","194.29.146.149","194.29.146.97","TCP","66","cvsup > 39746 [ACK] Seq=35619 Ack=1551 Win=803 Len=0 TSval=1219615179 TSecr=346444350"
"1161","7.610857","194.29.146.149","194.29.146.97","TCP","66","cvsup > 39746 [ACK] Seq=35619 Ack=1557 Win=803 Len=0 TSval=1219615187 TSecr=346444358"
"1163","7.618033","194.29.146.149","194.29.146.97","TCP","66","cvsup > 39746 [ACK] Seq=35619 Ack=1563 Win=803 Len=0 TSval=1219615194 TSecr=346444366"
"1165","7.625931","194.29.146.149","194.29.146.97","TCP","66","cvsup > 39746 [ACK] Seq=35619 Ack=1569 Win=803 Len=0 TSval=1219615202 TSecr=346444374"
"1167","7.633112","194.29.146.149","194.29.146.97","TCP","66","cvsup > 39746 [ACK] Seq=35619 Ack=1575 Win=803 Len=0 TSval=1219615209 TSecr=346444382"
"1169","7.640453","194.29.146.149","194.29.146.97","TCP","66","cvsup > 39746 [ACK] Seq=35619 Ack=1581 Win=803 Len=0 TSval=1219615217 TSecr=346444390"
"1171","7.658268","194.29.146.149","194.29.146.97","TCP","66","cvsup > 39746 [ACK] Seq=35619 Ack=1587 Win=803 Len=0 TSval=1219615234 TSecr=346444406"
"1173","7.665707","194.29.146.149","194.29.146.97","TCP","66","cvsup > 39746 [ACK] Seq=35619 Ack=1593 Win=803 Len=0 TSval=1219615242 TSecr=346444414"
"1175","7.684394","194.29.146.149","194.29.146.97","TCP","66","cvsup > 39746 [ACK] Seq=35619 Ack=1599 Win=803 Len=0 TSval=1219615260 TSecr=346444430"
"1177","7.696859","194.29.146.149","194.29.146.97","TCP","66","cvsup > 39746 [ACK] Seq=35619 Ack=1605 Win=803 Len=0 TSval=1219615273 TSecr=346444446"
"1179","7.705531","194.29.146.149","194.29.146.97","TCP","66","cvsup > 39746 [ACK] Seq=35619 Ack=1611 Win=803 Len=0 TSval=1219615282 TSecr=346444454"
"1181","7.720822","194.29.146.149","194.29.146.97","TCP","66","cvsup > 39746 [ACK] Seq=35619 Ack=1617 Win=803 Len=0 TSval=1219615297 TSecr=346444470"
"1183","7.746819","194.29.146.149","194.29.146.97","TCP","66","cvsup > 39746 [ACK] Seq=35619 Ack=1623 Win=803 Len=0 TSval=1219615323 TSecr=346444494"
"1185","7.754651","194.29.146.149","194.29.146.97","TCP","66","cvsup > 39746 [ACK] Seq=35619 Ack=1629 Win=803 Len=0 TSval=1219615331 TSecr=346444502"
"1187","7.761706","194.29.146.149","194.29.146.97","TCP","66","cvsup > 39746 [ACK] Seq=35619 Ack=1635 Win=803 Len=0 TSval=1219615338 TSecr=346444510"
"1189","7.786283","194.29.146.149","194.29.146.97","TCP","66","cvsup > 39746 [ACK] Seq=35619 Ack=1641 Win=803 Len=0 TSval=1219615362 TSecr=346444534"
"1191","7.808370","194.29.146.149","194.29.146.97","TCP","66","cvsup > 39746 [ACK] Seq=35619 Ack=1647 Win=803 Len=0 TSval=1219615385 TSecr=346444558"
"1193","7.840645","194.29.146.149","194.29.146.97","TCP","66","cvsup > 39746 [ACK] Seq=35619 Ack=1653 Win=803 Len=0 TSval=1219615417 TSecr=346444590"
"1195","7.857917","194.29.146.149","194.29.146.97","TCP","66","cvsup > 39746 [ACK] Seq=35619 Ack=1659 Win=803 Len=0 TSval=1219615434 TSecr=346444606"
"1197","7.873156","194.29.146.149","194.29.146.97","TCP","66","cvsup > 39746 [ACK] Seq=35619 Ack=1665 Win=803 Len=0 TSval=1219615449 TSecr=346444622"
"1199","7.917092","194.29.146.149","194.29.146.97","TCP","66","cvsup > 39746 [ACK] Seq=35619 Ack=1671 Win=803 Len=0 TSval=1219615493 TSecr=346444654"
"1201","7.925894","194.29.146.149","194.29.146.97","TCP","66","cvsup > 39746 [ACK] Seq=35619 Ack=1677 Win=803 Len=0 TSval=1219615502 TSecr=346444667"
"1203","7.928287","194.29.146.149","194.29.146.97","TCP","66","cvsup > 39746 [ACK] Seq=35619 Ack=1683 Win=803 Len=0 TSval=1219615504 TSecr=346444676"
"1205","7.928579","194.29.146.149","194.29.146.97","TCP","66","cvsup > 39746 [ACK] Seq=35619 Ack=1689 Win=803 Len=0 TSval=1219615505 TSecr=346444678"
"1207","7.936512","194.29.146.149","194.29.146.97","TCP","66","cvsup > 39746 [ACK] Seq=35619 Ack=1695 Win=803 Len=0 TSval=1219615513 TSecr=346444686"
"1209","7.944752","194.29.146.149","194.29.146.97","TCP","66","cvsup > 39746 [ACK] Seq=35619 Ack=1701 Win=803 Len=0 TSval=1219615521 TSecr=346444694"
"1210","7.948057","194.29.146.149","194.29.146.97","TCP","168","cvsup > 39746 [PSH, ACK] Seq=35619 Ack=1701 Win=803 Len=102 TSval=1219615524 TSecr=346444694"
"1212","7.988562","194.29.146.149","194.29.146.97","TCP","66","cvsup > 39746 [ACK] Seq=35721 Ack=1711 Win=803 Len=0 TSval=1219615565 TSecr=346444698"
"1214","7.989135","194.29.146.149","194.29.146.97","TCP","66","cvsup > 39746 [ACK] Seq=35721 Ack=1735 Win=803 Len=0 TSval=1219615565 TSecr=346444739"
"1216","8.000595","194.29.146.149","194.29.146.97","TCP","66","cvsup > 39746 [ACK] Seq=35721 Ack=1741 Win=803 Len=0 TSval=1219615577 TSecr=346444750"
"1222","8.010234","194.29.146.149","194.29.146.97","TCP","66","cvsup > 39746 [ACK] Seq=35721 Ack=1747 Win=803 Len=0 TSval=1219615586 TSecr=346444758"
"1236","8.018540","194.29.146.149","194.29.146.97","TCP","66","cvsup > 39746 [ACK] Seq=35721 Ack=1753 Win=803 Len=0 TSval=1219615594 TSecr=346444766"
"1261","8.034756","194.29.146.149","194.29.146.97","TCP","66","cvsup > 39746 [ACK] Seq=35721 Ack=1759 Win=803 Len=0 TSval=1219615611 TSecr=346444782"
"1277","8.042355","194.29.146.149","194.29.146.97","TCP","66","cvsup > 39746 [ACK] Seq=35721 Ack=1765 Win=803 Len=0 TSval=1219615618 TSecr=346444790"
"1303","8.057582","194.29.146.149","194.29.146.97","TCP","66","cvsup > 39746 [ACK] Seq=35721 Ack=1771 Win=803 Len=0 TSval=1219615634 TSecr=346444806"
"1312","8.064267","194.29.146.149","194.29.146.97","TCP","66","cvsup > 39746 [ACK] Seq=35721 Ack=1777 Win=803 Len=0 TSval=1219615641 TSecr=346444814"
"1316","8.080575","194.29.146.149","194.29.146.97","TCP","66","cvsup > 39746 [ACK] Seq=35721 Ack=1783 Win=803 Len=0 TSval=1219615657 TSecr=346444830"
"1318","8.101170","194.29.146.149","194.29.146.97","TCP","66","cvsup > 39746 [ACK] Seq=35721 Ack=1789 Win=803 Len=0 TSval=1219615677 TSecr=346444846"
"1320","8.104598","194.29.146.149","194.29.146.97","TCP","66","cvsup > 39746 [ACK] Seq=35721 Ack=1795 Win=803 Len=0 TSval=1219615681 TSecr=346444854"
"1323","8.112437","194.29.146.149","194.29.146.97","TCP","66","cvsup > 39746 [ACK] Seq=35721 Ack=1801 Win=803 Len=0 TSval=1219615689 TSecr=346444862"
"1346","8.121476","194.29.146.149","194.29.146.97","TCP","66","cvsup > 39746 [ACK] Seq=35721 Ack=1807 Win=803 Len=0 TSval=1219615697 TSecr=346444870"
"1390","8.136364","194.29.146.149","194.29.146.97","TCP","66","cvsup > 39746 [ACK] Seq=35721 Ack=1813 Win=803 Len=0 TSval=1219615713 TSecr=346444886"
"1392","8.144395","194.29.146.149","194.29.146.97","TCP","66","cvsup > 39746 [ACK] Seq=35721 Ack=1819 Win=803 Len=0 TSval=1219615721 TSecr=346444894"
"1394","8.162655","194.29.146.149","194.29.146.97","TCP","66","cvsup > 39746 [ACK] Seq=35721 Ack=1825 Win=803 Len=0 TSval=1219615739 TSecr=346444910"
"1396","8.170510","194.29.146.149","194.29.146.97","TCP","66","cvsup > 39746 [ACK] Seq=35721 Ack=1831 Win=803 Len=0 TSval=1219615746 TSecr=346444918"
"1399","8.184680","194.29.146.149","194.29.146.97","TCP","66","cvsup > 39746 [ACK] Seq=35721 Ack=1837 Win=803 Len=0 TSval=1219615761 TSecr=346444934"
"1401","8.202322","194.29.146.149","194.29.146.97","TCP","66","cvsup > 39746 [ACK] Seq=35721 Ack=1843 Win=803 Len=0 TSval=1219615778 TSecr=346444950"
"1403","8.209824","194.29.146.149","194.29.146.97","TCP","66","cvsup > 39746 [ACK] Seq=35721 Ack=1849 Win=803 Len=0 TSval=1219615786 TSecr=346444958"
"1405","8.218255","194.29.146.149","194.29.146.97","TCP","66","cvsup > 39746 [ACK] Seq=35721 Ack=1855 Win=803 Len=0 TSval=1219615794 TSecr=346444966"
"1407","8.224322","194.29.146.149","194.29.146.97","TCP","66","cvsup > 39746 [ACK] Seq=35721 Ack=1861 Win=803 Len=0 TSval=1219615801 TSecr=346444974"
"1409","8.235136","194.29.146.149","194.29.146.97","TCP","66","cvsup > 39746 [ACK] Seq=35721 Ack=1867 Win=803 Len=0 TSval=1219615811 TSecr=346444982"
"1410","8.235166","194.29.146.149","194.29.146.97","TCP","122","cvsup > 39746 [PSH, ACK] Seq=35721 Ack=1867 Win=803 Len=56 TSval=1219615811 TSecr=346444982"
"1412","8.275692","194.29.146.149","194.29.146.97","TCP","66","cvsup > 39746 [ACK] Seq=35777 Ack=1877 Win=803 Len=0 TSval=1219615852 TSecr=346444985"
"1414","8.276636","194.29.146.149","194.29.146.97","TCP","66","cvsup > 39746 [ACK] Seq=35777 Ack=1901 Win=803 Len=0 TSval=1219615853 TSecr=346445026"
"1416","8.280786","194.29.146.149","194.29.146.97","TCP","66","cvsup > 39746 [ACK] Seq=35777 Ack=1907 Win=803 Len=0 TSval=1219615857 TSecr=346445030"
"1418","8.299693","194.29.146.149","194.29.146.97","TCP","66","cvsup > 39746 [ACK] Seq=35777 Ack=1913 Win=803 Len=0 TSval=1219615876 TSecr=346445046"
"1420","8.306827","194.29.146.149","194.29.146.97","TCP","66","cvsup > 39746 [ACK] Seq=35777 Ack=1919 Win=803 Len=0 TSval=1219615883 TSecr=346445054"
"1422","8.314478","194.29.146.149","194.29.146.97","TCP","66","cvsup > 39746 [ACK] Seq=35777 Ack=1925 Win=803 Len=0 TSval=1219615890 TSecr=346445062"
"1424","8.321835","194.29.146.149","194.29.146.97","TCP","66","cvsup > 39746 [ACK] Seq=35777 Ack=1931 Win=803 Len=0 TSval=1219615898 TSecr=346445070"
"1426","8.328924","194.29.146.149","194.29.146.97","TCP","66","cvsup > 39746 [ACK] Seq=35777 Ack=1937 Win=803 Len=0 TSval=1219615905 TSecr=346445078"
"1428","8.336558","194.29.146.149","194.29.146.97","TCP","66","cvsup > 39746 [ACK] Seq=35777 Ack=1943 Win=803 Len=0 TSval=1219615913 TSecr=346445086"
"1430","8.344544","194.29.146.149","194.29.146.97","TCP","66","cvsup > 39746 [ACK] Seq=35777 Ack=1949 Win=803 Len=0 TSval=1219615921 TSecr=346445094"
"1432","8.352563","194.29.146.149","194.29.146.97","TCP","66","cvsup > 39746 [ACK] Seq=35777 Ack=1955 Win=803 Len=0 TSval=1219615929 TSecr=346445102"
"1434","8.360804","194.29.146.149","194.29.146.97","TCP","66","cvsup > 39746 [ACK] Seq=35777 Ack=1961 Win=803 Len=0 TSval=1219615937 TSecr=346445110"
"1436","8.385339","194.29.146.149","194.29.146.97","TCP","66","cvsup > 39746 [ACK] Seq=35777 Ack=1967 Win=803 Len=0 TSval=1219615962 TSecr=346445135"
"1438","8.385613","194.29.146.149","194.29.146.97","TCP","66","cvsup > 39746 [ACK] Seq=35777 Ack=1973 Win=803 Len=0 TSval=1219615962 TSecr=346445135"
"1440","8.392366","194.29.146.149","194.29.146.97","TCP","66","cvsup > 39746 [ACK] Seq=35777 Ack=1979 Win=803 Len=0 TSval=1219615969 TSecr=346445142"
"1442","8.400733","194.29.146.149","194.29.146.97","TCP","66","cvsup > 39746 [ACK] Seq=35777 Ack=1985 Win=803 Len=0 TSval=1219615977 TSecr=346445150"
"1445","8.408325","194.29.146.149","194.29.146.97","TCP","66","cvsup > 39746 [ACK] Seq=35777 Ack=1991 Win=803 Len=0 TSval=1219615985 TSecr=346445158"
"1447","8.416293","194.29.146.149","194.29.146.97","TCP","66","cvsup > 39746 [ACK] Seq=35777 Ack=1997 Win=803 Len=0 TSval=1219615993 TSecr=346445166"
"1449","8.425957","194.29.146.149","194.29.146.97","TCP","66","cvsup > 39746 [ACK] Seq=35777 Ack=2003 Win=803 Len=0 TSval=1219616002 TSecr=346445174"
"1451","8.434522","194.29.146.149","194.29.146.97","TCP","66","cvsup > 39746 [ACK] Seq=35777 Ack=2009 Win=803 Len=0 TSval=1219616010 TSecr=346445182"
"1453","8.441761","194.29.146.149","194.29.146.97","TCP","66","cvsup > 39746 [ACK] Seq=35777 Ack=2015 Win=803 Len=0 TSval=1219616018 TSecr=346445190"
"1455","8.449474","194.29.146.149","194.29.146.97","TCP","66","cvsup > 39746 [ACK] Seq=35777 Ack=2021 Win=803 Len=0 TSval=1219616025 TSecr=346445198"
"1457","8.456555","194.29.146.149","194.29.146.97","TCP","66","cvsup > 39746 [ACK] Seq=35777 Ack=2027 Win=803 Len=0 TSval=1219616033 TSecr=346445206"
"1459","8.464345","194.29.146.149","194.29.146.97","TCP","66","cvsup > 39746 [ACK] Seq=35777 Ack=2033 Win=803 Len=0 TSval=1219616041 TSecr=346445214"
"1461","8.474018","194.29.146.149","194.29.146.97","TCP","66","cvsup > 39746 [ACK] Seq=35777 Ack=2039 Win=803 Len=0 TSval=1219616050 TSecr=346445222"
"1463","8.481553","194.29.146.149","194.29.146.97","TCP","66","cvsup > 39746 [ACK] Seq=35777 Ack=2045 Win=803 Len=0 TSval=1219616058 TSecr=346445230"
"1465","8.489964","194.29.146.149","194.29.146.97","TCP","66","cvsup > 39746 [ACK] Seq=35777 Ack=2051 Win=803 Len=0 TSval=1219616066 TSecr=346445238"
"1466","8.497724","194.29.146.149","194.29.146.97","TCP","168","cvsup > 39746 [PSH, ACK] Seq=35777 Ack=2051 Win=803 Len=102 TSval=1219616074 TSecr=346445238"
"1468","8.538603","194.29.146.149","194.29.146.97","TCP","66","cvsup > 39746 [ACK] Seq=35879 Ack=2061 Win=803 Len=0 TSval=1219616114 TSecr=346445248"
"1470","8.539123","194.29.146.149","194.29.146.97","TCP","66","cvsup > 39746 [ACK] Seq=35879 Ack=2079 Win=803 Len=0 TSval=1219616115 TSecr=346445289"
"1472","8.546667","194.29.146.149","194.29.146.97","TCP","66","cvsup > 39746 [ACK] Seq=35879 Ack=2085 Win=803 Len=0 TSval=1219616122 TSecr=346445294"
"1474","8.568898","194.29.146.149","194.29.146.97","TCP","66","cvsup > 39746 [ACK] Seq=35879 Ack=2091 Win=803 Len=0 TSval=1219616145 TSecr=346445318"
"1477","8.594224","194.29.146.149","194.29.146.97","TCP","66","cvsup > 39746 [ACK] Seq=35879 Ack=2097 Win=803 Len=0 TSval=1219616170 TSecr=346445342"
"1483","8.601652","194.29.146.149","194.29.146.97","TCP","66","cvsup > 39746 [ACK] Seq=35879 Ack=2103 Win=803 Len=0 TSval=1219616178 TSecr=346445350"
"1485","8.608578","194.29.146.149","194.29.146.97","TCP","66","cvsup > 39746 [ACK] Seq=35879 Ack=2109 Win=803 Len=0 TSval=1219616185 TSecr=346445358"
"1487","8.616721","194.29.146.149","194.29.146.97","TCP","66","cvsup > 39746 [ACK] Seq=35879 Ack=2115 Win=803 Len=0 TSval=1219616193 TSecr=346445366"
"1488","8.632376","194.29.146.149","194.29.146.97","TCP","122","cvsup > 39746 [PSH, ACK] Seq=35879 Ack=2115 Win=803 Len=56 TSval=1219616208 TSecr=346445366"
"1490","8.672699","194.29.146.149","194.29.146.97","TCP","66","cvsup > 39746 [ACK] Seq=35935 Ack=2125 Win=803 Len=0 TSval=1219616249 TSecr=346445383"
"1492","8.674589","194.29.146.149","194.29.146.97","TCP","66","cvsup > 39746 [ACK] Seq=35935 Ack=2137 Win=803 Len=0 TSval=1219616251 TSecr=346445423"
"1494","8.688954","194.29.146.149","194.29.146.97","TCP","66","cvsup > 39746 [ACK] Seq=35935 Ack=2143 Win=803 Len=0 TSval=1219616265 TSecr=346445438"
"1496","8.712948","194.29.146.149","194.29.146.97","TCP","66","cvsup > 39746 [ACK] Seq=35935 Ack=2149 Win=803 Len=0 TSval=1219616289 TSecr=346445462"
"1498","8.734915","194.29.146.149","194.29.146.97","TCP","66","cvsup > 39746 [ACK] Seq=35935 Ack=2155 Win=803 Len=0 TSval=1219616311 TSecr=346445478"
"1500","8.738189","194.29.146.149","194.29.146.97","TCP","66","cvsup > 39746 [ACK] Seq=35935 Ack=2161 Win=803 Len=0 TSval=1219616314 TSecr=346445486"
"1502","8.744653","194.29.146.149","194.29.146.97","TCP","66","cvsup > 39746 [ACK] Seq=35935 Ack=2167 Win=803 Len=0 TSval=1219616321 TSecr=346445494"
"1504","8.752704","194.29.146.149","194.29.146.97","TCP","66","cvsup > 39746 [ACK] Seq=35935 Ack=2173 Win=803 Len=0 TSval=1219616329 TSecr=346445502"
"1506","8.768956","194.29.146.149","194.29.146.97","TCP","66","cvsup > 39746 [ACK] Seq=35935 Ack=2179 Win=803 Len=0 TSval=1219616345 TSecr=346445518"
"1508","8.792655","194.29.146.149","194.29.146.97","TCP","66","cvsup > 39746 [ACK] Seq=35935 Ack=2185 Win=803 Len=0 TSval=1219616369 TSecr=346445542"
"1510","8.808701","194.29.146.149","194.29.146.97","TCP","66","cvsup > 39746 [ACK] Seq=35935 Ack=2191 Win=803 Len=0 TSval=1219616385 TSecr=346445558"
"1512","8.816610","194.29.146.149","194.29.146.97","TCP","66","cvsup > 39746 [ACK] Seq=35935 Ack=2197 Win=803 Len=0 TSval=1219616393 TSecr=346445566"
"1514","8.833847","194.29.146.149","194.29.146.97","TCP","66","cvsup > 39746 [ACK] Seq=35935 Ack=2203 Win=803 Len=0 TSval=1219616410 TSecr=346445582"
"1516","8.858293","194.29.146.149","194.29.146.97","TCP","66","cvsup > 39746 [ACK] Seq=35935 Ack=2209 Win=803 Len=0 TSval=1219616434 TSecr=346445606"
"1518","8.880693","194.29.146.149","194.29.146.97","TCP","66","cvsup > 39746 [ACK] Seq=35935 Ack=2215 Win=803 Len=0 TSval=1219616457 TSecr=346445630"
"1520","8.890066","194.29.146.149","194.29.146.97","TCP","66","cvsup > 39746 [ACK] Seq=35935 Ack=2221 Win=803 Len=0 TSval=1219616466 TSecr=346445638"
"1521","8.910571","194.29.146.149","194.29.146.97","TCP","168","cvsup > 39746 [PSH, ACK] Seq=35935 Ack=2221 Win=803 Len=102 TSval=1219616487 TSecr=346445638"
"1523","8.951013","194.29.146.149","194.29.146.97","TCP","66","cvsup > 39746 [ACK] Seq=36037 Ack=2231 Win=803 Len=0 TSval=1219616527 TSecr=346445661"
"1525","8.951552","194.29.146.149","194.29.146.97","TCP","66","cvsup > 39746 [ACK] Seq=36037 Ack=2243 Win=803 Len=0 TSval=1219616528 TSecr=346445701"
"1527","8.969029","194.29.146.149","194.29.146.97","TCP","66","cvsup > 39746 [ACK] Seq=36037 Ack=2249 Win=803 Len=0 TSval=1219616545 TSecr=346445718"
"1551","9.024910","194.29.146.149","194.29.146.97","TCP","66","cvsup > 39746 [ACK] Seq=36037 Ack=2255 Win=803 Len=0 TSval=1219616601 TSecr=346445759"
