"No.","Time","Source","Destination","Protocol","Length","Info"
"417","3.277225","194.29.146.15","194.29.146.97","TCP","66","http > 36071 [ACK] Seq=1 Ack=457 Win=972 Len=0 TSval=262910217 TSecr=345600837"
"419","3.302960","194.29.146.15","194.29.146.97","TCP","66","http > 36072 [ACK] Seq=1 Ack=348 Win=972 Len=0 TSval=262910224 TSecr=345600863"
"420","3.306059","194.29.146.15","194.29.146.97","HTTP","572","HTTP/1.1 404 Not Found  (text/html)"
"422","3.386616","194.29.146.15","194.29.146.97","TCP","2962","[TCP segment of a reassembled PDU]"
"424","3.386848","194.29.146.15","194.29.146.97","TCP","2962","[TCP segment of a reassembled PDU]"
"426","3.387082","194.29.146.15","194.29.146.97","TCP","1514","[TCP segment of a reassembled PDU]"
"428","3.387336","194.29.146.15","194.29.146.97","TCP","1514","[TCP segment of a reassembled PDU]"
"430","3.387593","194.29.146.15","194.29.146.97","TCP","1514","[TCP segment of a reassembled PDU]"
"432","3.387854","194.29.146.15","194.29.146.97","TCP","1514","[TCP segment of a reassembled PDU]"
"434","3.388107","194.29.146.15","194.29.146.97","TCP","2962","[TCP segment of a reassembled PDU]"
"436","3.388359","194.29.146.15","194.29.146.97","TCP","1514","[TCP segment of a reassembled PDU]"
"438","3.388622","194.29.146.15","194.29.146.97","TCP","1514","[TCP segment of a reassembled PDU]"
"440","3.388869","194.29.146.15","194.29.146.97","TCP","2962","[TCP segment of a reassembled PDU]"
"442","3.389115","194.29.146.15","194.29.146.97","TCP","2962","[TCP segment of a reassembled PDU]"
"444","3.389373","194.29.146.15","194.29.146.97","TCP","1514","[TCP segment of a reassembled PDU]"
"446","3.389625","194.29.146.15","194.29.146.97","TCP","1514","[TCP segment of a reassembled PDU]"
"448","3.389634","194.29.146.15","194.29.146.97","TCP","1514","[TCP segment of a reassembled PDU]"
"450","3.389880","194.29.146.15","194.29.146.97","TCP","1514","[TCP segment of a reassembled PDU]"
"452","3.390132","194.29.146.15","194.29.146.97","TCP","2962","[TCP segment of a reassembled PDU]"
"454","3.390390","194.29.146.15","194.29.146.97","TCP","1514","[TCP segment of a reassembled PDU]"
"456","3.390639","194.29.146.15","194.29.146.97","HTTP","1279","HTTP/1.1 200 OK  (text/html)"
"459","3.503721","194.29.146.15","194.29.146.97","TCP","66","http > 36071 [ACK] Seq=34518 Ack=924 Win=1039 Len=0 TSval=262910274 TSecr=345601063"
"460","3.620430","194.29.146.15","194.29.146.97","HTTP","621","HTTP/1.1 200 OK  (text/html)"
"463","3.732773","194.29.146.15","194.29.146.97","TCP","66","http > 36071 [ACK] Seq=35073 Ack=1392 Win=1106 Len=0 TSval=262910331 TSecr=345601293"
"465","3.820916","194.29.146.15","194.29.146.97","HTTP","617","HTTP/1.1 200 OK  (text/html)"
"469","4.116117","194.29.146.15","194.29.146.97","TCP","66","http > 36071 [ACK] Seq=35624 Ack=1860 Win=1173 Len=0 TSval=262910427 TSecr=345601676"
"552","4.205746","194.29.146.15","194.29.146.97","HTTP","618","HTTP/1.1 200 OK  (text/html)"
"621","4.329556","194.29.146.15","194.29.146.97","TCP","66","http > 36071 [ACK] Seq=36176 Ack=2328 Win=1240 Len=0 TSval=262910480 TSecr=345601889"
"624","4.417815","194.29.146.15","194.29.146.97","HTTP","615","HTTP/1.1 200 OK  (text/html)"
"627","4.526098","194.29.146.15","194.29.146.97","TCP","66","http > 36071 [ACK] Seq=36725 Ack=2796 Win=1307 Len=0 TSval=262910530 TSecr=345602086"
"629","4.630159","194.29.146.15","194.29.146.97","HTTP","609","HTTP/1.1 200 OK  (text/html)"
"633","4.747675","194.29.146.15","194.29.146.97","TCP","66","http > 36071 [ACK] Seq=37268 Ack=3264 Win=1374 Len=0 TSval=262910585 TSecr=345602307"
"636","4.879243","194.29.146.15","194.29.146.97","HTTP","623","HTTP/1.1 200 OK  (text/html)"
"639","4.991362","194.29.146.15","194.29.146.97","TCP","66","http > 36071 [ACK] Seq=37825 Ack=3732 Win=1441 Len=0 TSval=262910646 TSecr=345602551"
"640","5.091342","194.29.146.15","194.29.146.97","HTTP","608","HTTP/1.1 200 OK  (text/html)"
"717","5.199783","194.29.146.15","194.29.146.97","TCP","66","http > 36071 [ACK] Seq=38367 Ack=4200 Win=1508 Len=0 TSval=262910698 TSecr=345602760"
"737","5.305684","194.29.146.15","194.29.146.97","HTTP","605","HTTP/1.1 200 OK  (text/html)"
"743","5.417319","194.29.146.15","194.29.146.97","TCP","66","http > 36071 [ACK] Seq=38906 Ack=4668 Win=1575 Len=0 TSval=262910752 TSecr=345602977"
"745","5.513078","194.29.146.15","194.29.146.97","HTTP","608","HTTP/1.1 200 OK  (text/html)"
"750","5.627989","194.29.146.15","194.29.146.97","TCP","66","http > 36071 [ACK] Seq=39448 Ack=5136 Win=1642 Len=0 TSval=262910805 TSecr=345603188"
"757","5.734595","194.29.146.15","194.29.146.97","HTTP","621","HTTP/1.1 200 OK  (text/html)"
"765","5.842512","194.29.146.15","194.29.146.97","TCP","66","http > 36071 [ACK] Seq=40003 Ack=5605 Win=1709 Len=0 TSval=262910859 TSecr=345603402"
"767","5.944884","194.29.146.15","194.29.146.97","HTTP","611","HTTP/1.1 200 OK  (text/html)"
"770","6.052871","194.29.146.15","194.29.146.97","TCP","66","http > 36071 [ACK] Seq=40548 Ack=6074 Win=1776 Len=0 TSval=262910911 TSecr=345603613"
"771","6.140554","194.29.146.15","194.29.146.97","HTTP","607","HTTP/1.1 200 OK  (text/html)"
"859","6.249212","194.29.146.15","194.29.146.97","TCP","66","http > 36071 [ACK] Seq=41089 Ack=6543 Win=1843 Len=0 TSval=262910960 TSecr=345603809"
"862","6.341103","194.29.146.15","194.29.146.97","HTTP","607","HTTP/1.1 200 OK  (text/html)"
"865","6.449677","194.29.146.15","194.29.146.97","TCP","66","http > 36071 [ACK] Seq=41630 Ack=7012 Win=1910 Len=0 TSval=262911011 TSecr=345604009"
"866","6.550731","194.29.146.15","194.29.146.97","HTTP","607","HTTP/1.1 200 OK  (text/html)"
"869","6.659923","194.29.146.15","194.29.146.97","TCP","66","http > 36071 [ACK] Seq=42171 Ack=7481 Win=1977 Len=0 TSval=262911063 TSecr=345604220"
"870","6.750641","194.29.146.15","194.29.146.97","HTTP","602","HTTP/1.1 200 OK  (text/html)"
"874","6.859763","194.29.146.15","194.29.146.97","TCP","66","http > 36071 [ACK] Seq=42707 Ack=7950 Win=2044 Len=0 TSval=262911113 TSecr=345604419"
"878","6.885931","194.29.146.15","194.29.146.97","TCP","66","http > 36073 [FIN, ACK] Seq=1 Ack=2 Win=905 Len=0 TSval=262911120 TSecr=345604446"
"880","6.885965","194.29.146.15","194.29.146.97","TCP","66","http > 36074 [FIN, ACK] Seq=1 Ack=2 Win=905 Len=0 TSval=262911120 TSecr=345604446"
"882","6.886208","194.29.146.15","194.29.146.97","TCP","66","http > 36075 [FIN, ACK] Seq=1 Ack=2 Win=905 Len=0 TSval=262911120 TSecr=345604446"
"884","6.953317","194.29.146.15","194.29.146.97","HTTP","614","HTTP/1.1 200 OK  (text/html)"
"887","7.066910","194.29.146.15","194.29.146.97","TCP","66","http > 36071 [ACK] Seq=43255 Ack=8419 Win=2111 Len=0 TSval=262911165 TSecr=345604627"
"898","7.161623","194.29.146.15","194.29.146.97","HTTP","626","HTTP/1.1 200 OK  (text/html)"
"976","7.269442","194.29.146.15","194.29.146.97","TCP","66","http > 36071 [ACK] Seq=43815 Ack=8888 Win=2178 Len=0 TSval=262911215 TSecr=345604829"
"1040","7.360280","194.29.146.15","194.29.146.97","HTTP","609","HTTP/1.1 200 OK  (text/html)"
"1044","7.468252","194.29.146.15","194.29.146.97","TCP","66","http > 36071 [ACK] Seq=44358 Ack=9357 Win=2245 Len=0 TSval=262911265 TSecr=345605028"
"1046","7.555254","194.29.146.15","194.29.146.97","HTTP","613","HTTP/1.1 200 OK  (text/html)"
"1050","7.666811","194.29.146.15","194.29.146.97","TCP","66","http > 36071 [ACK] Seq=44905 Ack=9826 Win=2312 Len=0 TSval=262911315 TSecr=345605227"
"1052","7.754575","194.29.146.15","194.29.146.97","HTTP","619","HTTP/1.1 200 OK  (text/html)"
"1055","7.866473","194.29.146.15","194.29.146.97","TCP","66","http > 36071 [ACK] Seq=45458 Ack=10295 Win=2379 Len=0 TSval=262911365 TSecr=345605426"
"1056","7.954353","194.29.146.15","194.29.146.97","HTTP","626","HTTP/1.1 200 OK  (text/html)"
"1060","8.075248","194.29.146.15","194.29.146.97","TCP","66","http > 36071 [ACK] Seq=46018 Ack=10764 Win=2446 Len=0 TSval=262911417 TSecr=345605635"
"1078","8.164907","194.29.146.15","194.29.146.97","HTTP","619","HTTP/1.1 200 OK  (text/html)"
"1152","8.278281","194.29.146.15","194.29.146.97","TCP","66","http > 36071 [ACK] Seq=46571 Ack=11233 Win=2513 Len=0 TSval=262911468 TSecr=345605838"
"1153","8.309494","194.29.146.15","194.29.146.97","TCP","66","http > 36072 [FIN, ACK] Seq=507 Ack=348 Win=972 Len=0 TSval=262911476 TSecr=345600867"
"1156","8.366792","194.29.146.15","194.29.146.97","HTTP","621","HTTP/1.1 200 OK  (text/html)"
"1160","8.474388","194.29.146.15","194.29.146.97","TCP","66","http > 36072 [ACK] Seq=508 Ack=349 Win=972 Len=0 TSval=262911517 TSecr=345606034"
"1161","8.474406","194.29.146.15","194.29.146.97","TCP","66","http > 36071 [ACK] Seq=47126 Ack=11702 Win=2580 Len=0 TSval=262911517 TSecr=345606035"
"1162","8.564140","194.29.146.15","194.29.146.97","HTTP","611","HTTP/1.1 200 OK  (text/html)"
"1166","8.680876","194.29.146.15","194.29.146.97","TCP","66","http > 36071 [ACK] Seq=47671 Ack=12171 Win=2647 Len=0 TSval=262911568 TSecr=345606241"
"1167","8.767817","194.29.146.15","194.29.146.97","HTTP","615","HTTP/1.1 200 OK  (text/html)"
"1171","8.878638","194.29.146.15","194.29.146.97","TCP","66","http > 36071 [ACK] Seq=48220 Ack=12640 Win=2714 Len=0 TSval=262911618 TSecr=345606439"
"1172","8.965694","194.29.146.15","194.29.146.97","HTTP","620","HTTP/1.1 200 OK  (text/html)"
"1176","9.079284","194.29.146.15","194.29.146.97","TCP","66","http > 36071 [ACK] Seq=48774 Ack=13109 Win=2781 Len=0 TSval=262911668 TSecr=345606639"
"1197","9.171306","194.29.146.15","194.29.146.97","HTTP","621","HTTP/1.1 200 OK  (text/html)"
"1266","9.285350","194.29.146.15","194.29.146.97","TCP","66","http > 36071 [ACK] Seq=49329 Ack=13578 Win=2848 Len=0 TSval=262911719 TSecr=345606845"
"1267","9.372221","194.29.146.15","194.29.146.97","HTTP","619","HTTP/1.1 200 OK  (text/html)"
"1270","9.485100","194.29.146.15","194.29.146.97","TCP","66","http > 36071 [ACK] Seq=49882 Ack=14047 Win=2915 Len=0 TSval=262911769 TSecr=345607045"
"1271","9.571500","194.29.146.15","194.29.146.97","HTTP","631","HTTP/1.1 200 OK  (text/html)"
"1275","9.687483","194.29.146.15","194.29.146.97","TCP","66","http > 36071 [ACK] Seq=50447 Ack=14516 Win=2982 Len=0 TSval=262911820 TSecr=345607247"
"1276","9.774833","194.29.146.15","194.29.146.97","HTTP","615","HTTP/1.1 200 OK  (text/html)"
"1279","9.896478","194.29.146.15","194.29.146.97","TCP","66","http > 36071 [ACK] Seq=50996 Ack=14985 Win=3049 Len=0 TSval=262911872 TSecr=345607456"
"1280","9.984240","194.29.146.15","194.29.146.97","HTTP","621","HTTP/1.1 200 OK  (text/html)"
"1284","10.098115","194.29.146.15","194.29.146.97","TCP","66","http > 36071 [ACK] Seq=51551 Ack=15454 Win=3116 Len=0 TSval=262911923 TSecr=345607658"
"1337","10.191767","194.29.146.15","194.29.146.97","HTTP","620","HTTP/1.1 200 OK  (text/html)"
"1375","10.299754","194.29.146.15","194.29.146.97","TCP","66","http > 36071 [ACK] Seq=52105 Ack=15923 Win=3183 Len=0 TSval=262911973 TSecr=345607860"
"1441","10.386719","194.29.146.15","194.29.146.97","HTTP","624","HTTP/1.1 200 OK  (text/html)"
"1444","10.513747","194.29.146.15","194.29.146.97","TCP","66","http > 36071 [ACK] Seq=52663 Ack=16392 Win=3250 Len=0 TSval=262912027 TSecr=345608074"
"1445","10.601512","194.29.146.15","194.29.146.97","HTTP","607","HTTP/1.1 200 OK  (text/html)"
"1448","10.715030","194.29.146.15","194.29.146.97","TCP","66","http > 36071 [ACK] Seq=53204 Ack=16861 Win=3317 Len=0 TSval=262912077 TSecr=345608275"
"1450","10.820159","194.29.146.15","194.29.146.97","HTTP","602","HTTP/1.1 200 OK  (text/html)"
"1453","10.947521","194.29.146.15","194.29.146.97","TCP","66","http > 36071 [ACK] Seq=53740 Ack=17330 Win=3384 Len=0 TSval=262912135 TSecr=345608507"
"1454","11.034588","194.29.146.15","194.29.146.97","HTTP","615","HTTP/1.1 200 OK  (text/html)"
"1459","11.147770","194.29.146.15","194.29.146.97","TCP","66","http > 36071 [ACK] Seq=54289 Ack=17799 Win=3451 Len=0 TSval=262912185 TSecr=345608708"
"1547","11.245910","194.29.146.15","194.29.146.97","HTTP","614","HTTP/1.1 200 OK  (text/html)"
"1551","11.370994","194.29.146.15","194.29.146.97","TCP","66","http > 36071 [ACK] Seq=54837 Ack=18268 Win=3518 Len=0 TSval=262912241 TSecr=345608931"
"1552","11.470552","194.29.146.15","194.29.146.97","HTTP","622","HTTP/1.1 200 OK  (text/html)"
"1556","11.587669","194.29.146.15","194.29.146.97","TCP","66","http > 36071 [ACK] Seq=55393 Ack=18737 Win=3585 Len=0 TSval=262912295 TSecr=345609147"
"1557","11.675749","194.29.146.15","194.29.146.97","HTTP","622","HTTP/1.1 200 OK  (text/html)"
"1560","11.806399","194.29.146.15","194.29.146.97","TCP","66","http > 36071 [ACK] Seq=55949 Ack=19206 Win=3652 Len=0 TSval=262912350 TSecr=345609366"
"1561","11.899853","194.29.146.15","194.29.146.97","HTTP","613","HTTP/1.1 200 OK  (text/html)"
"1565","12.015362","194.29.146.15","194.29.146.97","TCP","66","http > 36071 [ACK] Seq=56496 Ack=19675 Win=3719 Len=0 TSval=262912402 TSecr=345609575"
"1566","12.105478","194.29.146.15","194.29.146.97","HTTP","609","HTTP/1.1 200 OK  (text/html)"
"1656","12.243938","194.29.146.15","194.29.146.97","TCP","66","http > 36071 [ACK] Seq=57039 Ack=20144 Win=3786 Len=0 TSval=262912459 TSecr=345609804"
"1659","12.332261","194.29.146.15","194.29.146.97","HTTP","593","HTTP/1.1 200 OK  (text/html)"
"1663","12.449300","194.29.146.15","194.29.146.97","TCP","66","http > 36071 [ACK] Seq=57566 Ack=20613 Win=3853 Len=0 TSval=262912510 TSecr=345610009"
"1664","12.546335","194.29.146.15","194.29.146.97","HTTP","610","HTTP/1.1 200 OK  (text/html)"
"1667","12.668769","194.29.146.15","194.29.146.97","TCP","66","http > 36071 [ACK] Seq=58110 Ack=21082 Win=3920 Len=0 TSval=262912565 TSecr=345610229"
"1668","12.760931","194.29.146.15","194.29.146.97","HTTP","621","HTTP/1.1 200 OK  (text/html)"
"1672","12.872436","194.29.146.15","194.29.146.97","TCP","66","http > 36071 [ACK] Seq=58665 Ack=21551 Win=3987 Len=0 TSval=262912616 TSecr=345610432"
"1673","12.970766","194.29.146.15","194.29.146.97","HTTP","625","HTTP/1.1 200 OK  (text/html)"
"1677","13.094612","194.29.146.15","194.29.146.97","TCP","66","http > 36071 [ACK] Seq=59224 Ack=22020 Win=3988 Len=0 TSval=262912672 TSecr=345610654"
"1710","13.181785","194.29.146.15","194.29.146.97","HTTP","602","HTTP/1.1 200 OK  (text/html)"
"1779","13.308118","194.29.146.15","194.29.146.97","TCP","66","http > 36071 [ACK] Seq=59760 Ack=22489 Win=3988 Len=0 TSval=262912725 TSecr=345610868"
"1834","13.397164","194.29.146.15","194.29.146.97","HTTP","628","HTTP/1.1 200 OK  (text/html)"
"1837","13.513355","194.29.146.15","194.29.146.97","TCP","66","http > 36071 [ACK] Seq=60322 Ack=22958 Win=3988 Len=0 TSval=262912776 TSecr=345611073"
"1838","13.599859","194.29.146.15","194.29.146.97","HTTP","620","HTTP/1.1 200 OK  (text/html)"
"1841","13.713587","194.29.146.15","194.29.146.97","TCP","66","http > 36071 [ACK] Seq=60876 Ack=23427 Win=3988 Len=0 TSval=262912826 TSecr=345611273"
"1842","13.809870","194.29.146.15","194.29.146.97","HTTP","622","HTTP/1.1 200 OK  (text/html)"
"1845","13.933972","194.29.146.15","194.29.146.97","TCP","66","http > 36071 [ACK] Seq=61432 Ack=23896 Win=3988 Len=0 TSval=262912882 TSecr=345611494"
"1847","14.022386","194.29.146.15","194.29.146.97","HTTP","625","HTTP/1.1 200 OK  (text/html)"
"1850","14.146399","194.29.146.15","194.29.146.97","TCP","66","http > 36071 [ACK] Seq=61991 Ack=24365 Win=3988 Len=0 TSval=262912935 TSecr=345611706"
"1936","14.239562","194.29.146.15","194.29.146.97","HTTP","621","HTTP/1.1 200 OK  (text/html)"
"1942","14.353643","194.29.146.15","194.29.146.97","TCP","66","http > 36071 [ACK] Seq=62546 Ack=24834 Win=3988 Len=0 TSval=262912987 TSecr=345611913"
"1944","14.440590","194.29.146.15","194.29.146.97","HTTP","600","HTTP/1.1 200 OK  (text/html)"
"1948","14.556857","194.29.146.15","194.29.146.97","TCP","66","http > 36071 [ACK] Seq=63080 Ack=25303 Win=3988 Len=0 TSval=262913037 TSecr=345612117"
"1953","14.645213","194.29.146.15","194.29.146.97","HTTP","610","HTTP/1.1 200 OK  (text/html)"
"1956","14.758565","194.29.146.15","194.29.146.97","TCP","66","http > 36071 [ACK] Seq=63624 Ack=25772 Win=3988 Len=0 TSval=262913088 TSecr=345612318"
"1958","14.858080","194.29.146.15","194.29.146.97","HTTP","619","HTTP/1.1 200 OK  (text/html)"
"1961","14.985890","194.29.146.15","194.29.146.97","TCP","66","http > 36071 [ACK] Seq=64177 Ack=26241 Win=3988 Len=0 TSval=262913145 TSecr=345612546"
"1962","15.074258","194.29.146.15","194.29.146.97","HTTP","605","HTTP/1.1 200 OK  (text/html)"
"2034","15.202113","194.29.146.15","194.29.146.97","TCP","66","http > 36071 [ACK] Seq=64716 Ack=26710 Win=3988 Len=0 TSval=262913199 TSecr=345612762"
"2056","15.295504","194.29.146.15","194.29.146.97","HTTP","614","HTTP/1.1 200 OK  (text/html)"
"2062","15.414159","194.29.146.15","194.29.146.97","TCP","66","http > 36071 [ACK] Seq=65264 Ack=27179 Win=3988 Len=0 TSval=262913252 TSecr=345612974"
"2064","15.508523","194.29.146.15","194.29.146.97","HTTP","615","HTTP/1.1 200 OK  (text/html)"
"2069","15.620063","194.29.146.15","194.29.146.97","TCP","66","http > 36071 [ACK] Seq=65813 Ack=27648 Win=3988 Len=0 TSval=262913303 TSecr=345613180"
"2070","15.715437","194.29.146.15","194.29.146.97","HTTP","613","HTTP/1.1 200 OK  (text/html)"
"2073","15.835731","194.29.146.15","194.29.146.97","TCP","66","http > 36071 [ACK] Seq=66360 Ack=28117 Win=3988 Len=0 TSval=262913357 TSecr=345613396"
"2074","15.963421","194.29.146.15","194.29.146.97","HTTP","611","HTTP/1.1 200 OK  (text/html)"
"2077","16.085475","194.29.146.15","194.29.146.97","TCP","66","http > 36071 [ACK] Seq=66905 Ack=28586 Win=3988 Len=0 TSval=262913419 TSecr=345613645"
"2115","16.188557","194.29.146.15","194.29.146.97","HTTP","623","HTTP/1.1 200 OK  (text/html)"
"2227","16.334520","194.29.146.15","194.29.146.97","TCP","66","http > 36071 [ACK] Seq=67462 Ack=29055 Win=3988 Len=0 TSval=262913482 TSecr=345613894"
"2229","16.421094","194.29.146.15","194.29.146.97","HTTP","615","HTTP/1.1 200 OK  (text/html)"
"2233","16.545505","194.29.146.15","194.29.146.97","TCP","66","http > 36071 [ACK] Seq=68011 Ack=29524 Win=3988 Len=0 TSval=262913534 TSecr=345614105"
"2234","16.631381","194.29.146.15","194.29.146.97","HTTP","612","HTTP/1.1 200 OK  (text/html)"
"2237","16.758268","194.29.146.15","194.29.146.97","TCP","66","http > 36071 [ACK] Seq=68557 Ack=29993 Win=3988 Len=0 TSval=262913588 TSecr=345614318"
"2239","16.844328","194.29.146.15","194.29.146.97","HTTP","610","HTTP/1.1 200 OK  (text/html)"
"2243","16.955126","194.29.146.15","194.29.146.97","TCP","66","http > 36071 [ACK] Seq=69101 Ack=30462 Win=3988 Len=0 TSval=262913637 TSecr=345614515"
"2244","17.042175","194.29.146.15","194.29.146.97","HTTP","604","HTTP/1.1 200 OK  (text/html)"
"2254","17.169592","194.29.146.15","194.29.146.97","TCP","66","http > 36071 [ACK] Seq=69639 Ack=30931 Win=3988 Len=0 TSval=262913690 TSecr=345614729"
"2334","17.265440","194.29.146.15","194.29.146.97","HTTP","624","HTTP/1.1 200 OK  (text/html)"
"2338","17.396163","194.29.146.15","194.29.146.97","TCP","66","http > 36071 [ACK] Seq=70197 Ack=31400 Win=3988 Len=0 TSval=262913747 TSecr=345614956"
"2339","17.483391","194.29.146.15","194.29.146.97","HTTP","613","HTTP/1.1 200 OK  (text/html)"
"2343","17.597357","194.29.146.15","194.29.146.97","TCP","66","http > 36071 [ACK] Seq=70744 Ack=31869 Win=3988 Len=0 TSval=262913797 TSecr=345615157"
"2345","17.685034","194.29.146.15","194.29.146.97","HTTP","609","HTTP/1.1 200 OK  (text/html)"
"2348","17.834821","194.29.146.15","194.29.146.97","TCP","66","http > 36071 [ACK] Seq=71287 Ack=32338 Win=3988 Len=0 TSval=262913857 TSecr=345615395"
"2349","17.926042","194.29.146.15","194.29.146.97","HTTP","615","HTTP/1.1 200 OK  (text/html)"
"2353","18.048918","194.29.146.15","194.29.146.97","TCP","66","http > 36071 [ACK] Seq=71836 Ack=32807 Win=3988 Len=0 TSval=262913910 TSecr=345615609"
"2355","18.148794","194.29.146.15","194.29.146.97","HTTP","613","HTTP/1.1 200 OK  (text/html)"
"2445","18.276321","194.29.146.15","194.29.146.97","TCP","66","http > 36071 [ACK] Seq=72383 Ack=33276 Win=3988 Len=0 TSval=262913967 TSecr=345615836"
"2449","18.370743","194.29.146.15","194.29.146.97","HTTP","618","HTTP/1.1 200 OK  (text/html)"
"2454","18.513497","194.29.146.15","194.29.146.97","TCP","66","http > 36071 [ACK] Seq=72935 Ack=33745 Win=3988 Len=0 TSval=262914026 TSecr=345616073"
"2455","18.608759","194.29.146.15","194.29.146.97","HTTP","619","HTTP/1.1 200 OK  (text/html)"
"2461","18.726723","194.29.146.15","194.29.146.97","TCP","66","http > 36071 [ACK] Seq=73488 Ack=34214 Win=3988 Len=0 TSval=262914080 TSecr=345616287"
"2462","18.823593","194.29.146.15","194.29.146.97","HTTP","629","HTTP/1.1 200 OK  (text/html)"
"2466","18.946453","194.29.146.15","194.29.146.97","TCP","66","http > 36071 [ACK] Seq=74051 Ack=34683 Win=3988 Len=0 TSval=262914135 TSecr=345616506"
"2467","19.035011","194.29.146.15","194.29.146.97","HTTP","625","HTTP/1.1 200 OK  (text/html)"
"2479","19.147884","194.29.146.15","194.29.146.97","TCP","66","http > 36071 [ACK] Seq=74610 Ack=35152 Win=3988 Len=0 TSval=262914185 TSecr=345616708"
"2566","19.241896","194.29.146.15","194.29.146.97","HTTP","604","HTTP/1.1 200 OK  (text/html)"
"2634","19.374921","194.29.146.15","194.29.146.97","TCP","66","http > 36071 [ACK] Seq=75148 Ack=35621 Win=3988 Len=0 TSval=262914242 TSecr=345616935"
"2635","19.469223","194.29.146.15","194.29.146.97","HTTP","617","HTTP/1.1 200 OK  (text/html)"
"2638","19.610808","194.29.146.15","194.29.146.97","TCP","66","http > 36071 [ACK] Seq=75699 Ack=36090 Win=3988 Len=0 TSval=262914301 TSecr=345617171"
"2647","19.717664","194.29.146.15","194.29.146.97","HTTP","620","HTTP/1.1 200 OK  (text/html)"
"2650","19.856857","194.29.146.15","194.29.146.97","TCP","66","http > 36071 [ACK] Seq=76253 Ack=36559 Win=3988 Len=0 TSval=262914362 TSecr=345617417"
"2651","19.961462","194.29.146.15","194.29.146.97","HTTP","618","HTTP/1.1 200 OK  (text/html)"
"2655","20.079793","194.29.146.15","194.29.146.97","TCP","66","http > 36071 [ACK] Seq=76805 Ack=37028 Win=3988 Len=0 TSval=262914418 TSecr=345617640"
"2712","20.199622","194.29.146.15","194.29.146.97","HTTP","627","HTTP/1.1 200 OK  (text/html)"
"2751","20.343249","194.29.146.15","194.29.146.97","TCP","66","http > 36071 [ACK] Seq=77366 Ack=37497 Win=3988 Len=0 TSval=262914484 TSecr=345617903"
"2752","20.431459","194.29.146.15","194.29.146.97","HTTP","614","HTTP/1.1 200 OK  (text/html)"
"2755","20.626369","194.29.146.15","194.29.146.97","TCP","66","http > 36071 [ACK] Seq=77914 Ack=37966 Win=3988 Len=0 TSval=262914555 TSecr=345618186"
"2756","20.717053","194.29.146.15","194.29.146.97","HTTP","599","HTTP/1.1 200 OK  (text/html)"
"2760","20.865208","194.29.146.15","194.29.146.97","TCP","66","http > 36071 [ACK] Seq=78447 Ack=38435 Win=3988 Len=0 TSval=262914614 TSecr=345618425"
"2763","20.969074","194.29.146.15","194.29.146.97","HTTP","602","HTTP/1.1 200 OK  (text/html)"
"2767","21.112822","194.29.146.15","194.29.146.97","TCP","66","http > 36071 [ACK] Seq=78983 Ack=38904 Win=3988 Len=0 TSval=262914676 TSecr=345618673"
"2836","21.221173","194.29.146.15","194.29.146.97","HTTP","594","HTTP/1.1 200 OK  (text/html)"
"2860","21.349417","194.29.146.15","194.29.146.97","TCP","66","http > 36071 [ACK] Seq=79511 Ack=39373 Win=3988 Len=0 TSval=262914735 TSecr=345618909"
"2862","21.439127","194.29.146.15","194.29.146.97","HTTP","597","HTTP/1.1 200 OK  (text/html)"
"2869","21.585635","194.29.146.15","194.29.146.97","TCP","66","http > 36071 [ACK] Seq=80042 Ack=39842 Win=3988 Len=0 TSval=262914794 TSecr=345619145"
"2870","21.674053","194.29.146.15","194.29.146.97","HTTP","613","HTTP/1.1 200 OK  (text/html)"
"2873","21.821994","194.29.146.15","194.29.146.97","TCP","66","http > 36071 [ACK] Seq=80589 Ack=40311 Win=3988 Len=0 TSval=262914854 TSecr=345619382"
"2874","21.909396","194.29.146.15","194.29.146.97","HTTP","598","HTTP/1.1 200 OK  (text/html)"
"2877","22.090806","194.29.146.15","194.29.146.97","TCP","66","http > 36071 [ACK] Seq=81121 Ack=40780 Win=3988 Len=0 TSval=262914921 TSecr=345619651"
"2892","22.178190","194.29.146.15","194.29.146.97","HTTP","586","HTTP/1.1 200 OK  (text/html)"
"3031","22.335515","194.29.146.15","194.29.146.97","TCP","66","http > 36071 [ACK] Seq=81641 Ack=41249 Win=3988 Len=0 TSval=262914982 TSecr=345619895"
"3035","22.422498","194.29.146.15","194.29.146.97","HTTP","599","HTTP/1.1 200 OK  (text/html)"
"3038","22.556297","194.29.146.15","194.29.146.97","TCP","66","http > 36071 [ACK] Seq=82174 Ack=41718 Win=3988 Len=0 TSval=262915037 TSecr=345620116"
"3039","22.642278","194.29.146.15","194.29.146.97","HTTP","588","HTTP/1.1 200 OK  (text/html)"
"3042","22.797725","194.29.146.15","194.29.146.97","TCP","66","http > 36071 [ACK] Seq=82696 Ack=42187 Win=3988 Len=0 TSval=262915097 TSecr=345620358"
"3045","22.907102","194.29.146.15","194.29.146.97","HTTP","595","HTTP/1.1 200 OK  (text/html)"
"3048","23.075373","194.29.146.15","194.29.146.97","TCP","66","http > 36071 [ACK] Seq=83225 Ack=42656 Win=3988 Len=0 TSval=262915167 TSecr=345620635"
"3049","23.164124","194.29.146.15","194.29.146.97","HTTP","609","HTTP/1.1 200 OK  (text/html)"
"3135","23.334807","194.29.146.15","194.29.146.97","TCP","66","http > 36071 [ACK] Seq=83768 Ack=43125 Win=3988 Len=0 TSval=262915232 TSecr=345620895"
"3136","23.429067","194.29.146.15","194.29.146.97","HTTP","598","HTTP/1.1 200 OK  (text/html)"
"3139","23.590191","194.29.146.15","194.29.146.97","TCP","66","http > 36071 [ACK] Seq=84300 Ack=43594 Win=3988 Len=0 TSval=262915296 TSecr=345621150"
"3140","23.686532","194.29.146.15","194.29.146.97","HTTP","586","HTTP/1.1 200 OK  (text/html)"
"3143","23.842524","194.29.146.15","194.29.146.97","TCP","66","http > 36071 [ACK] Seq=84820 Ack=44063 Win=3988 Len=0 TSval=262915359 TSecr=345621402"
"3144","23.934843","194.29.146.15","194.29.146.97","HTTP","584","HTTP/1.1 200 OK  (text/html)"
"3147","24.094489","194.29.146.15","194.29.146.97","TCP","66","http > 36071 [ACK] Seq=85338 Ack=44532 Win=3988 Len=0 TSval=262915422 TSecr=345621654"
"3225","24.223946","194.29.146.15","194.29.146.97","HTTP","593","HTTP/1.1 200 OK  (text/html)"
"3239","24.391621","194.29.146.15","194.29.146.97","TCP","66","http > 36071 [ACK] Seq=85865 Ack=45001 Win=3988 Len=0 TSval=262915496 TSecr=345621951"
"3240","24.489187","194.29.146.15","194.29.146.97","HTTP","584","HTTP/1.1 200 OK  (text/html)"
"3244","24.661168","194.29.146.15","194.29.146.97","TCP","66","http > 36071 [ACK] Seq=86383 Ack=45470 Win=3988 Len=0 TSval=262915563 TSecr=345622221"
"3245","24.749114","194.29.146.15","194.29.146.97","HTTP","589","HTTP/1.1 200 OK  (text/html)"
"3251","24.884072","194.29.146.15","194.29.146.97","TCP","66","http > 36071 [ACK] Seq=86906 Ack=45939 Win=3988 Len=0 TSval=262915619 TSecr=345622444"
"3252","24.982636","194.29.146.15","194.29.146.97","HTTP","597","HTTP/1.1 200 OK  (text/html)"
"3255","25.145792","194.29.146.15","194.29.146.97","TCP","66","http > 36071 [ACK] Seq=87437 Ack=46408 Win=3988 Len=0 TSval=262915684 TSecr=345622706"
"3338","25.233141","194.29.146.15","194.29.146.97","HTTP","590","HTTP/1.1 200 OK  (text/html)"
"3408","25.368752","194.29.146.15","194.29.146.97","TCP","66","http > 36071 [ACK] Seq=87961 Ack=46877 Win=3988 Len=0 TSval=262915740 TSecr=345622929"
"3412","25.466763","194.29.146.15","194.29.146.97","HTTP","604","HTTP/1.1 200 OK  (text/html)"
"3417","25.628455","194.29.146.15","194.29.146.97","TCP","66","http > 36071 [ACK] Seq=88499 Ack=47346 Win=3988 Len=0 TSval=262915805 TSecr=345623188"
"3419","25.717218","194.29.146.15","194.29.146.97","HTTP","566","HTTP/1.1 200 OK  (text/html)"
"3421","25.717266","194.29.146.15","194.29.146.97","TCP","66","http > 36071 [FIN, ACK] Seq=88999 Ack=47346 Win=4006 Len=0 TSval=262915827 TSecr=345623188"
"3423","25.718352","194.29.146.15","194.29.146.97","TCP","66","http > 36071 [ACK] Seq=89000 Ack=47347 Win=4006 Len=0 TSval=262915828 TSecr=345623278"
"3428","25.905041","194.29.146.15","194.29.146.97","TCP","74","http > 36076 [SYN, ACK] Seq=0 Ack=1 Win=14480 Len=0 MSS=1460 SACK_PERM=1 TSval=262915874 TSecr=345623465 WS=16"
"3431","25.905927","194.29.146.15","194.29.146.97","TCP","66","http > 36076 [ACK] Seq=1 Ack=471 Win=15552 Len=0 TSval=262915875 TSecr=345623466"
"3432","26.005590","194.29.146.15","194.29.146.97","HTTP","602","HTTP/1.1 200 OK  (text/html)"
"3461","26.193154","194.29.146.15","194.29.146.97","TCP","66","http > 36076 [ACK] Seq=537 Ack=941 Win=16624 Len=0 TSval=262915946 TSecr=345623753"
"3522","26.291938","194.29.146.15","194.29.146.97","HTTP","597","HTTP/1.1 200 OK  (text/html)"
"3526","26.453202","194.29.146.15","194.29.146.97","TCP","66","http > 36076 [ACK] Seq=1068 Ack=1411 Win=17696 Len=0 TSval=262916011 TSecr=345624013"
"3527","26.544199","194.29.146.15","194.29.146.97","HTTP","592","HTTP/1.1 200 OK  (text/html)"
"3530","26.728819","194.29.146.15","194.29.146.97","TCP","66","http > 36076 [ACK] Seq=1594 Ack=1881 Win=18768 Len=0 TSval=262916080 TSecr=345624289"
"3531","26.819121","194.29.146.15","194.29.146.97","HTTP","589","HTTP/1.1 200 OK  (text/html)"
"3536","26.988941","194.29.146.15","194.29.146.97","TCP","66","http > 36076 [ACK] Seq=2117 Ack=2351 Win=19840 Len=0 TSval=262916145 TSecr=345624549"
"3537","27.078880","194.29.146.15","194.29.146.97","HTTP","600","HTTP/1.1 200 OK  (text/html)"
"3622","27.230194","194.29.146.15","194.29.146.97","TCP","66","http > 36076 [ACK] Seq=2651 Ack=2821 Win=20912 Len=0 TSval=262916206 TSecr=345624790"
"3626","27.331663","194.29.146.15","194.29.146.97","HTTP","594","HTTP/1.1 200 OK  (text/html)"
"3629","27.488211","194.29.146.15","194.29.146.97","TCP","66","http > 36076 [ACK] Seq=3179 Ack=3291 Win=21984 Len=0 TSval=262916270 TSecr=345625048"
"3631","27.586207","194.29.146.15","194.29.146.97","HTTP","598","HTTP/1.1 200 OK  (text/html)"
"3635","27.758200","194.29.146.15","194.29.146.97","TCP","66","http > 36076 [ACK] Seq=3711 Ack=3761 Win=23056 Len=0 TSval=262916338 TSecr=345625318"
"3658","27.857368","194.29.146.15","194.29.146.97","HTTP","591","HTTP/1.1 200 OK  (text/html)"
"3673","28.045924","194.29.146.15","194.29.146.97","TCP","66","http > 36076 [ACK] Seq=4236 Ack=4231 Win=24128 Len=0 TSval=262916409 TSecr=345625606"
"3674","28.136577","194.29.146.15","194.29.146.97","HTTP","597","HTTP/1.1 200 OK  (text/html)"
"3769","28.265336","194.29.146.15","194.29.146.97","TCP","66","http > 36076 [ACK] Seq=4767 Ack=4701 Win=25200 Len=0 TSval=262916464 TSecr=345625825"
"3839","28.357375","194.29.146.15","194.29.146.97","HTTP","590","HTTP/1.1 200 OK  (text/html)"
"3855","28.605012","194.29.146.15","194.29.146.97","TCP","66","http > 36076 [ACK] Seq=5291 Ack=5171 Win=26272 Len=0 TSval=262916549 TSecr=345626165"
"3857","28.705488","194.29.146.15","194.29.146.97","HTTP","609","HTTP/1.1 200 OK  (text/html)"
"3862","28.882285","194.29.146.15","194.29.146.97","TCP","66","http > 36076 [ACK] Seq=5834 Ack=5641 Win=27344 Len=0 TSval=262916619 TSecr=345626442"
"3863","28.981275","194.29.146.15","194.29.146.97","HTTP","625","HTTP/1.1 200 OK  (text/html)"
"3867","29.128077","194.29.146.15","194.29.146.97","TCP","66","http > 36076 [ACK] Seq=6393 Ack=6111 Win=28416 Len=0 TSval=262916680 TSecr=345626688"
"3945","29.233099","194.29.146.15","194.29.146.97","HTTP","589","HTTP/1.1 200 OK  (text/html)"
"3954","29.393313","194.29.146.15","194.29.146.97","TCP","66","http > 36076 [ACK] Seq=6916 Ack=6581 Win=29488 Len=0 TSval=262916746 TSecr=345626953"
"3955","29.490708","194.29.146.15","194.29.146.97","HTTP","599","HTTP/1.1 200 OK  (text/html)"
"3960","29.698892","194.29.146.15","194.29.146.97","TCP","66","http > 36076 [ACK] Seq=7449 Ack=7051 Win=30560 Len=0 TSval=262916823 TSecr=345627259"
"3961","29.787861","194.29.146.15","194.29.146.97","HTTP","590","HTTP/1.1 200 OK  (text/html)"
"3964","29.979322","194.29.146.15","194.29.146.97","TCP","66","http > 36076 [ACK] Seq=7973 Ack=7521 Win=31632 Len=0 TSval=262916893 TSecr=345627539"
"3965","30.075276","194.29.146.15","194.29.146.97","HTTP","602","HTTP/1.1 200 OK  (text/html)"
"4055","30.253723","194.29.146.15","194.29.146.97","TCP","66","http > 36076 [ACK] Seq=8509 Ack=7991 Win=32704 Len=0 TSval=262916961 TSecr=345627814"
"4058","30.347939","194.29.146.15","194.29.146.97","HTTP","590","HTTP/1.1 200 OK  (text/html)"
"4061","30.518792","194.29.146.15","194.29.146.97","TCP","66","http > 36076 [ACK] Seq=9033 Ack=8461 Win=33776 Len=0 TSval=262917028 TSecr=345628079"
"4062","30.611091","194.29.146.15","194.29.146.97","HTTP","613","HTTP/1.1 200 OK  (text/html)"
"4065","30.780015","194.29.146.15","194.29.146.97","TCP","66","http > 36076 [ACK] Seq=9580 Ack=8931 Win=34848 Len=0 TSval=262917093 TSecr=345628340"
"4067","30.870716","194.29.146.15","194.29.146.97","HTTP","596","HTTP/1.1 200 OK  (text/html)"
"4073","31.070845","194.29.146.15","194.29.146.97","TCP","66","http > 36076 [ACK] Seq=10110 Ack=9401 Win=35920 Len=0 TSval=262917166 TSecr=345628631"
"4075","31.161263","194.29.146.15","194.29.146.97","HTTP","575","HTTP/1.1 200 OK  (text/html)"
"4198","31.315447","194.29.146.15","194.29.146.97","TCP","66","http > 36076 [ACK] Seq=10619 Ack=9871 Win=36992 Len=0 TSval=262917227 TSecr=345628875"
"4228","31.405809","194.29.146.15","194.29.146.97","HTTP","569","HTTP/1.1 200 OK  (text/html)"
"4233","31.627642","194.29.146.15","194.29.146.97","TCP","66","http > 36076 [ACK] Seq=11122 Ack=10341 Win=38064 Len=0 TSval=262917305 TSecr=345629187"
"4234","31.717906","194.29.146.15","194.29.146.97","HTTP","571","HTTP/1.1 200 OK  (text/html)"
"4238","31.957582","194.29.146.15","194.29.146.97","TCP","66","http > 36076 [ACK] Seq=11627 Ack=10811 Win=39136 Len=0 TSval=262917387 TSecr=345629517"
"4239","32.047775","194.29.146.15","194.29.146.97","HTTP","592","HTTP/1.1 200 OK  (text/html)"
"4327","32.261795","194.29.146.15","194.29.146.97","TCP","66","http > 36076 [ACK] Seq=12153 Ack=11281 Win=40208 Len=0 TSval=262917463 TSecr=345629822"
"4332","32.353771","194.29.146.15","194.29.146.97","HTTP","605","HTTP/1.1 200 OK  (text/html)"
"4336","32.536151","194.29.146.15","194.29.146.97","TCP","66","http > 36076 [ACK] Seq=12692 Ack=11751 Win=41280 Len=0 TSval=262917532 TSecr=345630096"
"4338","32.628836","194.29.146.15","194.29.146.97","HTTP","596","HTTP/1.1 200 OK  (text/html)"
"4342","32.866820","194.29.146.15","194.29.146.97","TCP","66","http > 36076 [ACK] Seq=13222 Ack=12221 Win=42352 Len=0 TSval=262917615 TSecr=345630427"
"4345","33.005909","194.29.146.15","194.29.146.97","HTTP","604","HTTP/1.1 200 OK  (text/html)"
"4363","33.193777","194.29.146.15","194.29.146.97","TCP","66","http > 36076 [ACK] Seq=13760 Ack=12691 Win=43424 Len=0 TSval=262917696 TSecr=345630753"
"4434","33.296543","194.29.146.15","194.29.146.97","HTTP","599","HTTP/1.1 200 OK  (text/html)"
"4437","33.467408","194.29.146.15","194.29.146.97","TCP","66","http > 36076 [ACK] Seq=14293 Ack=13161 Win=44496 Len=0 TSval=262917765 TSecr=345631027"
"4438","33.571858","194.29.146.15","194.29.146.97","HTTP","591","HTTP/1.1 200 OK  (text/html)"
"4441","33.747250","194.29.146.15","194.29.146.97","TCP","66","http > 36076 [ACK] Seq=14818 Ack=13631 Win=45568 Len=0 TSval=262917835 TSecr=345631307"
"4442","33.838240","194.29.146.15","194.29.146.97","HTTP","603","HTTP/1.1 200 OK  (text/html)"
"4446","34.085805","194.29.146.15","194.29.146.97","TCP","66","http > 36076 [ACK] Seq=15355 Ack=14101 Win=46640 Len=0 TSval=262917919 TSecr=345631646"
"4447","34.176665","194.29.146.15","194.29.146.97","HTTP","597","HTTP/1.1 200 OK  (text/html)"
"4601","34.378956","194.29.146.15","194.29.146.97","TCP","66","http > 36076 [ACK] Seq=15886 Ack=14571 Win=47712 Len=0 TSval=262917993 TSecr=345631939"
"4602","34.481334","194.29.146.15","194.29.146.97","HTTP","598","HTTP/1.1 200 OK  (text/html)"
"4607","34.755256","194.29.146.15","194.29.146.97","TCP","66","http > 36076 [ACK] Seq=16418 Ack=15041 Win=48784 Len=0 TSval=262918087 TSecr=345632315"
"4609","34.858251","194.29.146.15","194.29.146.97","HTTP","604","HTTP/1.1 200 OK  (text/html)"
"4613","35.000689","194.29.146.15","194.29.146.97","TCP","66","http > 36076 [ACK] Seq=16956 Ack=15511 Win=49856 Len=0 TSval=262918148 TSecr=345632561"
"4614","35.104733","194.29.146.15","194.29.146.97","HTTP","598","HTTP/1.1 200 OK  (text/html)"
"4702","35.307473","194.29.146.15","194.29.146.97","TCP","66","http > 36076 [ACK] Seq=17488 Ack=15981 Win=50928 Len=0 TSval=262918225 TSecr=345632867"
"4704","35.397517","194.29.146.15","194.29.146.97","HTTP","588","HTTP/1.1 200 OK  (text/html)"
"4711","35.635909","194.29.146.15","194.29.146.97","TCP","66","http > 36076 [ACK] Seq=18010 Ack=16451 Win=52000 Len=0 TSval=262918307 TSecr=345633196"
"4714","35.762090","194.29.146.15","194.29.146.97","HTTP","619","HTTP/1.1 200 OK  (text/html)"
"4723","35.981753","194.29.146.15","194.29.146.97","TCP","66","http > 36076 [ACK] Seq=18563 Ack=16921 Win=53072 Len=0 TSval=262918393 TSecr=345633542"
"4725","36.078350","194.29.146.15","194.29.146.97","HTTP","616","HTTP/1.1 200 OK  (text/html)"
"4789","36.226628","194.29.146.15","194.29.146.97","TCP","66","http > 36076 [ACK] Seq=19113 Ack=17391 Win=54144 Len=0 TSval=262918455 TSecr=345633787"
"4816","36.338292","194.29.146.15","194.29.146.97","HTTP","614","HTTP/1.1 200 OK  (text/html)"
"4819","36.542278","194.29.146.15","194.29.146.97","TCP","66","http > 36076 [ACK] Seq=19661 Ack=17861 Win=55216 Len=0 TSval=262918534 TSecr=345634102"
"4821","36.632432","194.29.146.15","194.29.146.97","HTTP","623","HTTP/1.1 200 OK  (text/html)"
"4825","36.837185","194.29.146.15","194.29.146.97","TCP","66","http > 36076 [ACK] Seq=20218 Ack=18331 Win=56288 Len=0 TSval=262918607 TSecr=345634397"
"4827","36.928298","194.29.146.15","194.29.146.97","HTTP","630","HTTP/1.1 200 OK  (text/html)"
"4831","37.087400","194.29.146.15","194.29.146.97","TCP","66","http > 36076 [ACK] Seq=20782 Ack=18801 Win=57360 Len=0 TSval=262918670 TSecr=345634647"
"4832","37.179652","194.29.146.15","194.29.146.97","HTTP","625","HTTP/1.1 200 OK  (text/html)"
"4933","37.308317","194.29.146.15","194.29.146.97","TCP","66","http > 36076 [ACK] Seq=21341 Ack=19271 Win=58432 Len=0 TSval=262918725 TSecr=345634868"
"4985","37.399494","194.29.146.15","194.29.146.97","HTTP","617","HTTP/1.1 200 OK  (text/html)"
"4988","37.551511","194.29.146.15","194.29.146.97","TCP","66","http > 36076 [ACK] Seq=21892 Ack=19741 Win=59504 Len=0 TSval=262918786 TSecr=345635111"
"4990","37.641125","194.29.146.15","194.29.146.97","HTTP","622","HTTP/1.1 200 OK  (text/html)"
"4995","37.816467","194.29.146.15","194.29.146.97","TCP","66","http > 36076 [ACK] Seq=22448 Ack=20211 Win=60576 Len=0 TSval=262918852 TSecr=345635376"
"4996","37.906501","194.29.146.15","194.29.146.97","HTTP","584","HTTP/1.1 200 OK  (text/html)"
"5000","38.060952","194.29.146.15","194.29.146.97","TCP","66","http > 36076 [ACK] Seq=22966 Ack=20681 Win=61648 Len=0 TSval=262918913 TSecr=345635621"
"5001","38.150993","194.29.146.15","194.29.146.97","HTTP","629","HTTP/1.1 200 OK  (text/html)"
"5091","38.334647","194.29.146.15","194.29.146.97","TCP","66","http > 36076 [ACK] Seq=23529 Ack=21151 Win=62720 Len=0 TSval=262918982 TSecr=345635894"
"5092","38.424513","194.29.146.15","194.29.146.97","HTTP","600","HTTP/1.1 200 OK  (text/html)"
"5095","38.561223","194.29.146.15","194.29.146.97","TCP","66","http > 36076 [ACK] Seq=24063 Ack=21621 Win=63792 Len=0 TSval=262919038 TSecr=345636121"
"5096","38.708153","194.29.146.15","194.29.146.97","HTTP","604","HTTP/1.1 200 OK  (text/html)"
"5100","38.864807","194.29.146.15","194.29.146.97","TCP","66","http > 36076 [ACK] Seq=24601 Ack=22091 Win=63808 Len=0 TSval=262919114 TSecr=345636425"
"5101","38.955046","194.29.146.15","194.29.146.97","HTTP","623","HTTP/1.1 200 OK  (text/html)"
"5104","39.130508","194.29.146.15","194.29.146.97","TCP","66","http > 36076 [ACK] Seq=25158 Ack=22561 Win=63808 Len=0 TSval=262919181 TSecr=345636690"
"5188","39.269021","194.29.146.15","194.29.146.97","HTTP","636","HTTP/1.1 200 OK  (text/html)"
"5192","39.469551","194.29.146.15","194.29.146.97","TCP","66","http > 36076 [ACK] Seq=25728 Ack=23031 Win=63808 Len=0 TSval=262919265 TSecr=345637029"
"5193","39.562332","194.29.146.15","194.29.146.97","HTTP","603","HTTP/1.1 200 OK  (text/html)"
"5197","39.723054","194.29.146.15","194.29.146.97","TCP","66","http > 36076 [ACK] Seq=26265 Ack=23501 Win=63808 Len=0 TSval=262919329 TSecr=345637283"
