"No.","Time","Source","Destination","Protocol","Length","Info"
"151","0.472606","194.29.146.149","194.29.146.97","TCP","66","cvsup > 39835 [ACK] Seq=1 Ack=7 Win=1088 Len=0 TSval=1220863750 TSecr=347692953"
"152","0.474383","194.29.146.149","194.29.146.97","TCP","86","cvsup > 39835 [PSH, ACK] Seq=1 Ack=7 Win=1088 Len=20 TSval=1220863752 TSecr=347692953"
"154","0.481437","194.29.146.149","194.29.146.97","TCP","1514","cvsup > 39835 [ACK] Seq=21 Ack=17 Win=1088 Len=1448 TSval=1220863759 TSecr=347692956"
"156","0.481692","194.29.146.149","194.29.146.97","TCP","4410","cvsup > 39835 [ACK] Seq=1469 Ack=17 Win=1088 Len=4344 TSval=1220863759 TSecr=347692956"
"157","0.481929","194.29.146.149","194.29.146.97","TCP","235","cvsup > 39835 [PSH, ACK] Seq=5813 Ack=23 Win=1088 Len=169 TSval=1220863759 TSecr=347692963"
"160","0.528202","194.29.146.149","194.29.146.97","TCP","66","cvsup > 39835 [ACK] Seq=5982 Ack=53 Win=1088 Len=0 TSval=1220863806 TSecr=347692969"
"162","0.528483","194.29.146.149","194.29.146.97","TCP","66","cvsup > 39835 [ACK] Seq=5982 Ack=77 Win=1088 Len=0 TSval=1220863806 TSecr=347693009"
"164","0.536477","194.29.146.149","194.29.146.97","TCP","66","cvsup > 39835 [ACK] Seq=5982 Ack=83 Win=1088 Len=0 TSval=1220863814 TSecr=347693017"
"166","0.552632","194.29.146.149","194.29.146.97","TCP","66","cvsup > 39835 [ACK] Seq=5982 Ack=89 Win=1088 Len=0 TSval=1220863830 TSecr=347693034"
"168","0.568609","194.29.146.149","194.29.146.97","TCP","66","cvsup > 39835 [ACK] Seq=5982 Ack=95 Win=1088 Len=0 TSval=1220863846 TSecr=347693049"
"170","0.696855","194.29.146.149","194.29.146.97","TCP","66","cvsup > 39835 [ACK] Seq=5982 Ack=101 Win=1088 Len=0 TSval=1220863974 TSecr=347693178"
"172","0.704690","194.29.146.149","194.29.146.97","TCP","66","cvsup > 39835 [ACK] Seq=5982 Ack=107 Win=1088 Len=0 TSval=1220863982 TSecr=347693186"
"174","0.712601","194.29.146.149","194.29.146.97","TCP","66","cvsup > 39835 [ACK] Seq=5982 Ack=113 Win=1088 Len=0 TSval=1220863990 TSecr=347693194"
"176","0.720627","194.29.146.149","194.29.146.97","TCP","66","cvsup > 39835 [ACK] Seq=5982 Ack=119 Win=1088 Len=0 TSval=1220863998 TSecr=347693202"
"178","0.728600","194.29.146.149","194.29.146.97","TCP","66","cvsup > 39835 [ACK] Seq=5982 Ack=125 Win=1088 Len=0 TSval=1220864006 TSecr=347693209"
"180","0.736589","194.29.146.149","194.29.146.97","TCP","66","cvsup > 39835 [ACK] Seq=5982 Ack=131 Win=1088 Len=0 TSval=1220864014 TSecr=347693217"
"182","0.744635","194.29.146.149","194.29.146.97","TCP","66","cvsup > 39835 [ACK] Seq=5982 Ack=137 Win=1088 Len=0 TSval=1220864022 TSecr=347693226"
"184","0.752615","194.29.146.149","194.29.146.97","TCP","66","cvsup > 39835 [ACK] Seq=5982 Ack=143 Win=1088 Len=0 TSval=1220864030 TSecr=347693233"
"185","0.756629","194.29.146.149","194.29.146.97","TCP","916","cvsup > 39835 [PSH, ACK] Seq=5982 Ack=143 Win=1088 Len=850 TSval=1220864034 TSecr=347693233"
"187","0.797126","194.29.146.149","194.29.146.97","TCP","66","cvsup > 39835 [ACK] Seq=6832 Ack=153 Win=1088 Len=0 TSval=1220864075 TSecr=347693239"
"189","0.797638","194.29.146.149","194.29.146.97","TCP","66","cvsup > 39835 [ACK] Seq=6832 Ack=183 Win=1088 Len=0 TSval=1220864075 TSecr=347693278"
"191","0.800653","194.29.146.149","194.29.146.97","TCP","66","cvsup > 39835 [ACK] Seq=6832 Ack=189 Win=1088 Len=0 TSval=1220864078 TSecr=347693282"
"193","0.808592","194.29.146.149","194.29.146.97","TCP","66","cvsup > 39835 [ACK] Seq=6832 Ack=195 Win=1088 Len=0 TSval=1220864086 TSecr=347693290"
"195","0.816710","194.29.146.149","194.29.146.97","TCP","66","cvsup > 39835 [ACK] Seq=6832 Ack=201 Win=1088 Len=0 TSval=1220864094 TSecr=347693298"
"197","0.824883","194.29.146.149","194.29.146.97","TCP","66","cvsup > 39835 [ACK] Seq=6832 Ack=207 Win=1088 Len=0 TSval=1220864102 TSecr=347693306"
"199","0.832617","194.29.146.149","194.29.146.97","TCP","66","cvsup > 39835 [ACK] Seq=6832 Ack=213 Win=1088 Len=0 TSval=1220864110 TSecr=347693314"
"201","0.840637","194.29.146.149","194.29.146.97","TCP","66","cvsup > 39835 [ACK] Seq=6832 Ack=219 Win=1088 Len=0 TSval=1220864118 TSecr=347693322"
"203","0.848672","194.29.146.149","194.29.146.97","TCP","66","cvsup > 39835 [ACK] Seq=6832 Ack=225 Win=1088 Len=0 TSval=1220864126 TSecr=347693330"
"205","0.856887","194.29.146.149","194.29.146.97","TCP","66","cvsup > 39835 [ACK] Seq=6832 Ack=231 Win=1088 Len=0 TSval=1220864134 TSecr=347693338"
"207","0.864889","194.29.146.149","194.29.146.97","TCP","66","cvsup > 39835 [ACK] Seq=6832 Ack=237 Win=1088 Len=0 TSval=1220864142 TSecr=347693346"
"209","0.872902","194.29.146.149","194.29.146.97","TCP","66","cvsup > 39835 [ACK] Seq=6832 Ack=243 Win=1088 Len=0 TSval=1220864150 TSecr=347693354"
"211","0.880554","194.29.146.149","194.29.146.97","TCP","66","cvsup > 39835 [ACK] Seq=6832 Ack=249 Win=1088 Len=0 TSval=1220864158 TSecr=347693361"
"213","0.912589","194.29.146.149","194.29.146.97","TCP","66","cvsup > 39835 [ACK] Seq=6832 Ack=255 Win=1088 Len=0 TSval=1220864190 TSecr=347693393"
"255","1.033502","194.29.146.149","194.29.146.97","TCP","66","cvsup > 39835 [ACK] Seq=6832 Ack=261 Win=1088 Len=0 TSval=1220864311 TSecr=347693514"
"257","1.034471","194.29.146.149","194.29.146.97","TCP","168","cvsup > 39835 [PSH, ACK] Seq=6832 Ack=261 Win=1088 Len=102 TSval=1220864312 TSecr=347693514"
"260","1.035304","194.29.146.149","194.29.146.97","TCP","86","cvsup > 39835 [PSH, ACK] Seq=6934 Ack=271 Win=1088 Len=20 TSval=1220864313 TSecr=347693516"
"262","1.036247","194.29.146.149","194.29.146.97","TCP","122","cvsup > 39835 [PSH, ACK] Seq=6954 Ack=281 Win=1088 Len=56 TSval=1220864314 TSecr=347693517"
"280","1.045185","194.29.146.149","194.29.146.97","TCP","1514","cvsup > 39835 [ACK] Seq=7010 Ack=291 Win=1088 Len=1448 TSval=1220864322 TSecr=347693523"
"281","1.045438","194.29.146.149","194.29.146.97","TCP","1582","cvsup > 39835 [PSH, ACK] Seq=8458 Ack=291 Win=1088 Len=1516 TSval=1220864322 TSecr=347693523"
"311","1.089237","194.29.146.149","194.29.146.97","TCP","66","cvsup > 39835 [ACK] Seq=9974 Ack=321 Win=1088 Len=0 TSval=1220864367 TSecr=347693530"
"313","1.112741","194.29.146.149","194.29.146.97","TCP","66","cvsup > 39835 [ACK] Seq=9974 Ack=327 Win=1088 Len=0 TSval=1220864390 TSecr=347693594"
"317","1.148473","194.29.146.149","194.29.146.97","TCP","66","cvsup > 39835 [ACK] Seq=9974 Ack=335 Win=1088 Len=0 TSval=1220864426 TSecr=347693629"
"318","1.163109","194.29.146.149","194.29.146.97","TCP","1514","cvsup > 39835 [ACK] Seq=9974 Ack=335 Win=1088 Len=1448 TSval=1220864440 TSecr=347693629"
"319","1.163363","194.29.146.149","194.29.146.97","TCP","3490","cvsup > 39835 [PSH, ACK] Seq=11422 Ack=335 Win=1088 Len=3424 TSval=1220864440 TSecr=347693629"
"322","1.205379","194.29.146.149","194.29.146.97","TCP","66","cvsup > 39835 [ACK] Seq=14846 Ack=375 Win=1088 Len=0 TSval=1220864483 TSecr=347693647"
"323","1.272550","194.29.146.149","194.29.146.97","TCP","2727","cvsup > 39835 [PSH, ACK] Seq=14846 Ack=375 Win=1088 Len=2661 TSval=1220864549 TSecr=347693647"
"326","1.275894","194.29.146.149","194.29.146.97","TCP","66","cvsup > 39835 [ACK] Seq=17507 Ack=395 Win=1088 Len=0 TSval=1220864553 TSecr=347693757"
"327","1.306357","194.29.146.149","194.29.146.97","TCP","2962","cvsup > 39835 [ACK] Seq=17507 Ack=395 Win=1088 Len=2896 TSval=1220864583 TSecr=347693757"
"329","1.306567","194.29.146.149","194.29.146.97","TCP","2962","cvsup > 39835 [ACK] Seq=20403 Ack=395 Win=1088 Len=2896 TSval=1220864583 TSecr=347693757"
"330","1.306815","194.29.146.149","194.29.146.97","TCP","2962","cvsup > 39835 [ACK] Seq=23299 Ack=395 Win=1088 Len=2896 TSval=1220864583 TSecr=347693757"
"331","1.307062","194.29.146.149","194.29.146.97","TCP","1514","cvsup > 39835 [ACK] Seq=26195 Ack=395 Win=1088 Len=1448 TSval=1220864583 TSecr=347693757"
"332","1.307317","194.29.146.149","194.29.146.97","TCP","4410","cvsup > 39835 [ACK] Seq=27643 Ack=395 Win=1088 Len=4344 TSval=1220864584 TSecr=347693788"
"334","1.308759","194.29.146.149","194.29.146.97","TCP","1787","cvsup > 39835 [PSH, ACK] Seq=31987 Ack=395 Win=1088 Len=1721 TSval=1220864586 TSecr=347693789"
"337","1.392684","194.29.146.149","194.29.146.97","TCP","66","cvsup > 39835 [ACK] Seq=33708 Ack=623 Win=1088 Len=0 TSval=1220864670 TSecr=347693833"
"427","2.081053","194.29.146.149","194.29.146.97","TCP","66","cvsup > 39835 [ACK] Seq=33708 Ack=629 Win=1088 Len=0 TSval=1220865358 TSecr=347694562"
"429","2.089508","194.29.146.149","194.29.146.97","TCP","66","cvsup > 39835 [ACK] Seq=33708 Ack=635 Win=1088 Len=0 TSval=1220865367 TSecr=347694570"
"431","2.097276","194.29.146.149","194.29.146.97","TCP","66","cvsup > 39835 [ACK] Seq=33708 Ack=641 Win=1088 Len=0 TSval=1220865375 TSecr=347694578"
"433","2.105466","194.29.146.149","194.29.146.97","TCP","66","cvsup > 39835 [ACK] Seq=33708 Ack=647 Win=1088 Len=0 TSval=1220865383 TSecr=347694586"
"436","2.112659","194.29.146.149","194.29.146.97","TCP","66","cvsup > 39835 [ACK] Seq=33708 Ack=653 Win=1088 Len=0 TSval=1220865390 TSecr=347694594"
"438","2.120687","194.29.146.149","194.29.146.97","TCP","66","cvsup > 39835 [ACK] Seq=33708 Ack=659 Win=1088 Len=0 TSval=1220865398 TSecr=347694602"
"440","2.128706","194.29.146.149","194.29.146.97","TCP","66","cvsup > 39835 [ACK] Seq=33708 Ack=665 Win=1088 Len=0 TSval=1220865406 TSecr=347694610"
"442","2.136951","194.29.146.149","194.29.146.97","TCP","66","cvsup > 39835 [ACK] Seq=33708 Ack=671 Win=1088 Len=0 TSval=1220865414 TSecr=347694618"
"445","2.145030","194.29.146.149","194.29.146.97","TCP","66","cvsup > 39835 [ACK] Seq=33708 Ack=677 Win=1088 Len=0 TSval=1220865423 TSecr=347694626"
"447","2.153067","194.29.146.149","194.29.146.97","TCP","66","cvsup > 39835 [ACK] Seq=33708 Ack=683 Win=1088 Len=0 TSval=1220865430 TSecr=347694634"
"449","2.161018","194.29.146.149","194.29.146.97","TCP","66","cvsup > 39835 [ACK] Seq=33708 Ack=689 Win=1088 Len=0 TSval=1220865438 TSecr=347694642"
"451","2.169130","194.29.146.149","194.29.146.97","TCP","66","cvsup > 39835 [ACK] Seq=33708 Ack=695 Win=1088 Len=0 TSval=1220865446 TSecr=347694650"
"453","2.177066","194.29.146.149","194.29.146.97","TCP","66","cvsup > 39835 [ACK] Seq=33708 Ack=701 Win=1088 Len=0 TSval=1220865454 TSecr=347694658"
"455","2.185106","194.29.146.149","194.29.146.97","TCP","66","cvsup > 39835 [ACK] Seq=33708 Ack=707 Win=1088 Len=0 TSval=1220865463 TSecr=347694666"
"457","2.193042","194.29.146.149","194.29.146.97","TCP","66","cvsup > 39835 [ACK] Seq=33708 Ack=713 Win=1088 Len=0 TSval=1220865471 TSecr=347694674"
"458","2.199131","194.29.146.149","194.29.146.97","TCP","168","cvsup > 39835 [PSH, ACK] Seq=33708 Ack=713 Win=1088 Len=102 TSval=1220865476 TSecr=347694674"
"460","2.239534","194.29.146.149","194.29.146.97","TCP","66","cvsup > 39835 [ACK] Seq=33810 Ack=723 Win=1088 Len=0 TSval=1220865517 TSecr=347694681"
"462","2.240079","194.29.146.149","194.29.146.97","TCP","66","cvsup > 39835 [ACK] Seq=33810 Ack=753 Win=1088 Len=0 TSval=1220865517 TSecr=347694721"
"464","2.242665","194.29.146.149","194.29.146.97","TCP","66","cvsup > 39835 [ACK] Seq=33810 Ack=759 Win=1088 Len=0 TSval=1220865520 TSecr=347694722"
"466","2.249529","194.29.146.149","194.29.146.97","TCP","66","cvsup > 39835 [ACK] Seq=33810 Ack=765 Win=1088 Len=0 TSval=1220865527 TSecr=347694730"
"468","2.257110","194.29.146.149","194.29.146.97","TCP","66","cvsup > 39835 [ACK] Seq=33810 Ack=771 Win=1088 Len=0 TSval=1220865535 TSecr=347694738"
"470","2.267840","194.29.146.149","194.29.146.97","TCP","66","cvsup > 39835 [ACK] Seq=33810 Ack=777 Win=1088 Len=0 TSval=1220865545 TSecr=347694746"
"472","2.274070","194.29.146.149","194.29.146.97","TCP","66","cvsup > 39835 [ACK] Seq=33810 Ack=783 Win=1088 Len=0 TSval=1220865551 TSecr=347694754"
"474","2.282620","194.29.146.149","194.29.146.97","TCP","66","cvsup > 39835 [ACK] Seq=33810 Ack=789 Win=1088 Len=0 TSval=1220865560 TSecr=347694762"
"476","2.289316","194.29.146.149","194.29.146.97","TCP","66","cvsup > 39835 [ACK] Seq=33810 Ack=795 Win=1088 Len=0 TSval=1220865567 TSecr=347694770"
"478","2.297140","194.29.146.149","194.29.146.97","TCP","66","cvsup > 39835 [ACK] Seq=33810 Ack=801 Win=1088 Len=0 TSval=1220865575 TSecr=347694778"
"480","2.306948","194.29.146.149","194.29.146.97","TCP","66","cvsup > 39835 [ACK] Seq=33810 Ack=807 Win=1088 Len=0 TSval=1220865584 TSecr=347694786"
"482","2.314597","194.29.146.149","194.29.146.97","TCP","66","cvsup > 39835 [ACK] Seq=33810 Ack=813 Win=1088 Len=0 TSval=1220865592 TSecr=347694794"
"484","2.322242","194.29.146.149","194.29.146.97","TCP","66","cvsup > 39835 [ACK] Seq=33810 Ack=819 Win=1088 Len=0 TSval=1220865600 TSecr=347694802"
"486","2.329980","194.29.146.149","194.29.146.97","TCP","66","cvsup > 39835 [ACK] Seq=33810 Ack=825 Win=1088 Len=0 TSval=1220865607 TSecr=347694810"
"488","2.337484","194.29.146.149","194.29.146.97","TCP","66","cvsup > 39835 [ACK] Seq=33810 Ack=831 Win=1088 Len=0 TSval=1220865615 TSecr=347694818"
"490","2.345450","194.29.146.149","194.29.146.97","TCP","66","cvsup > 39835 [ACK] Seq=33810 Ack=837 Win=1088 Len=0 TSval=1220865623 TSecr=347694826"
"492","2.353322","194.29.146.149","194.29.146.97","TCP","66","cvsup > 39835 [ACK] Seq=33810 Ack=843 Win=1088 Len=0 TSval=1220865631 TSecr=347694834"
"494","2.361496","194.29.146.149","194.29.146.97","TCP","66","cvsup > 39835 [ACK] Seq=33810 Ack=849 Win=1088 Len=0 TSval=1220865639 TSecr=347694842"
"496","2.369354","194.29.146.149","194.29.146.97","TCP","66","cvsup > 39835 [ACK] Seq=33810 Ack=855 Win=1088 Len=0 TSval=1220865647 TSecr=347694850"
"499","2.441665","194.29.146.149","194.29.146.97","TCP","66","cvsup > 39835 [ACK] Seq=33810 Ack=861 Win=1088 Len=0 TSval=1220865719 TSecr=347694922"
"501","2.441947","194.29.146.149","194.29.146.97","TCP","66","cvsup > 39835 [ACK] Seq=33810 Ack=867 Win=1088 Len=0 TSval=1220865720 TSecr=347694923"
"503","2.529595","194.29.146.149","194.29.146.97","TCP","66","cvsup > 39835 [ACK] Seq=33810 Ack=873 Win=1088 Len=0 TSval=1220865807 TSecr=347695010"
"505","2.533742","194.29.146.149","194.29.146.97","TCP","66","cvsup > 39835 [ACK] Seq=33810 Ack=879 Win=1088 Len=0 TSval=1220865811 TSecr=347695011"
"507","2.689392","194.29.146.149","194.29.146.97","TCP","66","cvsup > 39835 [ACK] Seq=33810 Ack=885 Win=1088 Len=0 TSval=1220865967 TSecr=347695170"
"509","2.697388","194.29.146.149","194.29.146.97","TCP","66","cvsup > 39835 [ACK] Seq=33810 Ack=891 Win=1088 Len=0 TSval=1220865975 TSecr=347695178"
"511","2.707135","194.29.146.149","194.29.146.97","TCP","66","cvsup > 39835 [ACK] Seq=33810 Ack=897 Win=1088 Len=0 TSval=1220865984 TSecr=347695186"
"513","2.713448","194.29.146.149","194.29.146.97","TCP","66","cvsup > 39835 [ACK] Seq=33810 Ack=903 Win=1088 Len=0 TSval=1220865991 TSecr=347695194"
"515","2.721473","194.29.146.149","194.29.146.97","TCP","66","cvsup > 39835 [ACK] Seq=33810 Ack=909 Win=1088 Len=0 TSval=1220865999 TSecr=347695202"
"517","2.729406","194.29.146.149","194.29.146.97","TCP","66","cvsup > 39835 [ACK] Seq=33810 Ack=915 Win=1088 Len=0 TSval=1220866007 TSecr=347695210"
"519","2.738037","194.29.146.149","194.29.146.97","TCP","66","cvsup > 39835 [ACK] Seq=33810 Ack=921 Win=1088 Len=0 TSval=1220866015 TSecr=347695218"
"521","2.745453","194.29.146.149","194.29.146.97","TCP","66","cvsup > 39835 [ACK] Seq=33810 Ack=927 Win=1088 Len=0 TSval=1220866023 TSecr=347695226"
"523","2.753049","194.29.146.149","194.29.146.97","TCP","66","cvsup > 39835 [ACK] Seq=33810 Ack=933 Win=1088 Len=0 TSval=1220866031 TSecr=347695234"
"525","2.761102","194.29.146.149","194.29.146.97","TCP","66","cvsup > 39835 [ACK] Seq=33810 Ack=939 Win=1088 Len=0 TSval=1220866039 TSecr=347695242"
"527","2.769143","194.29.146.149","194.29.146.97","TCP","66","cvsup > 39835 [ACK] Seq=33810 Ack=945 Win=1088 Len=0 TSval=1220866047 TSecr=347695250"
"529","2.779377","194.29.146.149","194.29.146.97","TCP","66","cvsup > 39835 [ACK] Seq=33810 Ack=951 Win=1088 Len=0 TSval=1220866057 TSecr=347695258"
"531","2.786624","194.29.146.149","194.29.146.97","TCP","66","cvsup > 39835 [ACK] Seq=33810 Ack=957 Win=1088 Len=0 TSval=1220866064 TSecr=347695266"
"533","2.793780","194.29.146.149","194.29.146.97","TCP","66","cvsup > 39835 [ACK] Seq=33810 Ack=963 Win=1088 Len=0 TSval=1220866071 TSecr=347695274"
"535","2.801409","194.29.146.149","194.29.146.97","TCP","66","cvsup > 39835 [ACK] Seq=33810 Ack=969 Win=1088 Len=0 TSval=1220866079 TSecr=347695282"
"537","2.809103","194.29.146.149","194.29.146.97","TCP","66","cvsup > 39835 [ACK] Seq=33810 Ack=975 Win=1088 Len=0 TSval=1220866087 TSecr=347695290"
"539","2.817178","194.29.146.149","194.29.146.97","TCP","66","cvsup > 39835 [ACK] Seq=33810 Ack=981 Win=1088 Len=0 TSval=1220866095 TSecr=347695298"
"541","2.825102","194.29.146.149","194.29.146.97","TCP","66","cvsup > 39835 [ACK] Seq=33810 Ack=987 Win=1088 Len=0 TSval=1220866103 TSecr=347695306"
"543","2.833149","194.29.146.149","194.29.146.97","TCP","66","cvsup > 39835 [ACK] Seq=33810 Ack=993 Win=1088 Len=0 TSval=1220866111 TSecr=347695314"
"545","2.841053","194.29.146.149","194.29.146.97","TCP","66","cvsup > 39835 [ACK] Seq=33810 Ack=999 Win=1088 Len=0 TSval=1220866119 TSecr=347695322"
"547","2.849119","194.29.146.149","194.29.146.97","TCP","66","cvsup > 39835 [ACK] Seq=33810 Ack=1005 Win=1088 Len=0 TSval=1220866127 TSecr=347695330"
"549","2.857102","194.29.146.149","194.29.146.97","TCP","66","cvsup > 39835 [ACK] Seq=33810 Ack=1011 Win=1088 Len=0 TSval=1220866135 TSecr=347695338"
"551","2.865039","194.29.146.149","194.29.146.97","TCP","66","cvsup > 39835 [ACK] Seq=33810 Ack=1017 Win=1088 Len=0 TSval=1220866143 TSecr=347695346"
"553","2.873086","194.29.146.149","194.29.146.97","TCP","66","cvsup > 39835 [ACK] Seq=33810 Ack=1023 Win=1088 Len=0 TSval=1220866151 TSecr=347695354"
"555","2.881075","194.29.146.149","194.29.146.97","TCP","66","cvsup > 39835 [ACK] Seq=33810 Ack=1029 Win=1088 Len=0 TSval=1220866159 TSecr=347695362"
"557","2.889484","194.29.146.149","194.29.146.97","TCP","66","cvsup > 39835 [ACK] Seq=33810 Ack=1035 Win=1088 Len=0 TSval=1220866167 TSecr=347695370"
"559","2.897462","194.29.146.149","194.29.146.97","TCP","66","cvsup > 39835 [ACK] Seq=33810 Ack=1041 Win=1088 Len=0 TSval=1220866175 TSecr=347695378"
"561","2.905475","194.29.146.149","194.29.146.97","TCP","66","cvsup > 39835 [ACK] Seq=33810 Ack=1047 Win=1088 Len=0 TSval=1220866183 TSecr=347695386"
"563","2.921472","194.29.146.149","194.29.146.97","TCP","66","cvsup > 39835 [ACK] Seq=33810 Ack=1053 Win=1088 Len=0 TSval=1220866199 TSecr=347695402"
"565","2.929407","194.29.146.149","194.29.146.97","TCP","66","cvsup > 39835 [ACK] Seq=33810 Ack=1059 Win=1088 Len=0 TSval=1220866207 TSecr=347695410"
"567","2.937327","194.29.146.149","194.29.146.97","TCP","66","cvsup > 39835 [ACK] Seq=33810 Ack=1065 Win=1088 Len=0 TSval=1220866215 TSecr=347695418"
"569","2.945337","194.29.146.149","194.29.146.97","TCP","66","cvsup > 39835 [ACK] Seq=33810 Ack=1071 Win=1088 Len=0 TSval=1220866223 TSecr=347695426"
"571","2.955084","194.29.146.149","194.29.146.97","TCP","66","cvsup > 39835 [ACK] Seq=33810 Ack=1077 Win=1088 Len=0 TSval=1220866232 TSecr=347695434"
"573","2.963181","194.29.146.149","194.29.146.97","TCP","66","cvsup > 39835 [ACK] Seq=33810 Ack=1083 Win=1088 Len=0 TSval=1220866241 TSecr=347695442"
"575","2.978361","194.29.146.149","194.29.146.97","TCP","66","cvsup > 39835 [ACK] Seq=33810 Ack=1089 Win=1088 Len=0 TSval=1220866256 TSecr=347695458"
"577","2.985762","194.29.146.149","194.29.146.97","TCP","66","cvsup > 39835 [ACK] Seq=33810 Ack=1095 Win=1088 Len=0 TSval=1220866263 TSecr=347695466"
"579","2.993094","194.29.146.149","194.29.146.97","TCP","66","cvsup > 39835 [ACK] Seq=33810 Ack=1101 Win=1088 Len=0 TSval=1220866271 TSecr=347695474"
"581","3.001132","194.29.146.149","194.29.146.97","TCP","66","cvsup > 39835 [ACK] Seq=33810 Ack=1107 Win=1088 Len=0 TSval=1220866279 TSecr=347695482"
"593","3.011909","194.29.146.149","194.29.146.97","TCP","66","cvsup > 39835 [ACK] Seq=33810 Ack=1113 Win=1088 Len=0 TSval=1220866289 TSecr=347695490"
"603","3.019948","194.29.146.149","194.29.146.97","TCP","66","cvsup > 39835 [ACK] Seq=33810 Ack=1119 Win=1088 Len=0 TSval=1220866297 TSecr=347695498"
"622","3.033564","194.29.146.149","194.29.146.97","TCP","66","cvsup > 39835 [ACK] Seq=33810 Ack=1125 Win=1088 Len=0 TSval=1220866311 TSecr=347695514"
"650","3.048766","194.29.146.149","194.29.146.97","TCP","66","cvsup > 39835 [ACK] Seq=33810 Ack=1131 Win=1088 Len=0 TSval=1220866326 TSecr=347695530"
"669","3.064840","194.29.146.149","194.29.146.97","TCP","66","cvsup > 39835 [ACK] Seq=33810 Ack=1137 Win=1088 Len=0 TSval=1220866342 TSecr=347695546"
"679","3.082816","194.29.146.149","194.29.146.97","TCP","66","cvsup > 39835 [ACK] Seq=33810 Ack=1143 Win=1088 Len=0 TSval=1220866360 TSecr=347695562"
"681","3.089809","194.29.146.149","194.29.146.97","TCP","66","cvsup > 39835 [ACK] Seq=33810 Ack=1149 Win=1088 Len=0 TSval=1220866367 TSecr=347695570"
"683","3.105511","194.29.146.149","194.29.146.97","TCP","66","cvsup > 39835 [ACK] Seq=33810 Ack=1155 Win=1088 Len=0 TSval=1220866383 TSecr=347695586"
"686","3.123040","194.29.146.149","194.29.146.97","TCP","66","cvsup > 39835 [ACK] Seq=33810 Ack=1161 Win=1088 Len=0 TSval=1220866400 TSecr=347695602"
"688","3.138015","194.29.146.149","194.29.146.97","TCP","66","cvsup > 39835 [ACK] Seq=33810 Ack=1167 Win=1088 Len=0 TSval=1220866415 TSecr=347695618"
"691","3.163241","194.29.146.149","194.29.146.97","TCP","66","cvsup > 39835 [ACK] Seq=33810 Ack=1173 Win=1088 Len=0 TSval=1220866441 TSecr=347695642"
"693","3.323515","194.29.146.149","194.29.146.97","TCP","2962","cvsup > 39835 [ACK] Seq=33810 Ack=1179 Win=1088 Len=2896 TSval=1220866601 TSecr=347695802"
"695","3.323744","194.29.146.149","194.29.146.97","TCP","1514","cvsup > 39835 [ACK] Seq=36706 Ack=1179 Win=1088 Len=1448 TSval=1220866601 TSecr=347695802"
"696","3.323994","194.29.146.149","194.29.146.97","TCP","1514","cvsup > 39835 [ACK] Seq=38154 Ack=1179 Win=1088 Len=1448 TSval=1220866601 TSecr=347695802"
"697","3.324283","194.29.146.149","194.29.146.97","TCP","1514","cvsup > 39835 [ACK] Seq=39602 Ack=1179 Win=1088 Len=1448 TSval=1220866601 TSecr=347695805"
"698","3.324561","194.29.146.149","194.29.146.97","TCP","1514","cvsup > 39835 [ACK] Seq=41050 Ack=1179 Win=1088 Len=1448 TSval=1220866601 TSecr=347695805"
"700","3.325663","194.29.146.149","194.29.146.97","TCP","886","cvsup > 39835 [PSH, ACK] Seq=42498 Ack=1179 Win=1088 Len=820 TSval=1220866603 TSecr=347695806"
"703","3.371362","194.29.146.149","194.29.146.97","TCP","66","cvsup > 39835 [ACK] Seq=43318 Ack=1199 Win=1088 Len=0 TSval=1220866649 TSecr=347695812"
"771","3.473386","194.29.146.149","194.29.146.97","TCP","66","cvsup > 39835 [ACK] Seq=43318 Ack=1205 Win=1088 Len=0 TSval=1220866751 TSecr=347695954"
"773","3.480916","194.29.146.149","194.29.146.97","TCP","66","cvsup > 39835 [ACK] Seq=43318 Ack=1211 Win=1088 Len=0 TSval=1220866758 TSecr=347695962"
"775","3.488829","194.29.146.149","194.29.146.97","TCP","66","cvsup > 39835 [ACK] Seq=43318 Ack=1217 Win=1088 Len=0 TSval=1220866766 TSecr=347695970"
"777","3.498281","194.29.146.149","194.29.146.97","TCP","66","cvsup > 39835 [ACK] Seq=43318 Ack=1223 Win=1088 Len=0 TSval=1220866775 TSecr=347695978"
"779","3.505442","194.29.146.149","194.29.146.97","TCP","66","cvsup > 39835 [ACK] Seq=43318 Ack=1229 Win=1088 Len=0 TSval=1220866783 TSecr=347695986"
"781","3.513079","194.29.146.149","194.29.146.97","TCP","66","cvsup > 39835 [ACK] Seq=43318 Ack=1235 Win=1088 Len=0 TSval=1220866791 TSecr=347695994"
"784","3.521684","194.29.146.149","194.29.146.97","TCP","66","cvsup > 39835 [ACK] Seq=43318 Ack=1241 Win=1088 Len=0 TSval=1220866799 TSecr=347696002"
"786","3.532134","194.29.146.149","194.29.146.97","TCP","66","cvsup > 39835 [ACK] Seq=43318 Ack=1247 Win=1088 Len=0 TSval=1220866809 TSecr=347696010"
"788","3.553893","194.29.146.149","194.29.146.97","TCP","66","cvsup > 39835 [ACK] Seq=43318 Ack=1253 Win=1088 Len=0 TSval=1220866831 TSecr=347696034"
"791","3.585442","194.29.146.149","194.29.146.97","TCP","66","cvsup > 39835 [ACK] Seq=43318 Ack=1259 Win=1088 Len=0 TSval=1220866863 TSecr=347696066"
"792","3.602254","194.29.146.149","194.29.146.97","TCP","1514","cvsup > 39835 [ACK] Seq=43318 Ack=1259 Win=1088 Len=1448 TSval=1220866879 TSecr=347696066"
"793","3.602491","194.29.146.149","194.29.146.97","TCP","2962","cvsup > 39835 [ACK] Seq=44766 Ack=1259 Win=1088 Len=2896 TSval=1220866879 TSecr=347696066"
"795","3.602742","194.29.146.149","194.29.146.97","TCP","2962","cvsup > 39835 [ACK] Seq=47662 Ack=1259 Win=1088 Len=2896 TSval=1220866879 TSecr=347696066"
"797","3.603330","194.29.146.149","194.29.146.97","TCP","2962","cvsup > 39835 [ACK] Seq=50558 Ack=1259 Win=1088 Len=2896 TSval=1220866880 TSecr=347696084"
"798","3.603581","194.29.146.149","194.29.146.97","TCP","2962","cvsup > 39835 [ACK] Seq=53454 Ack=1259 Win=1088 Len=2896 TSval=1220866881 TSecr=347696084"
"799","3.603826","194.29.146.149","194.29.146.97","TCP","1514","cvsup > 39835 [ACK] Seq=56350 Ack=1259 Win=1088 Len=1448 TSval=1220866881 TSecr=347696084"
"801","3.614198","194.29.146.149","194.29.146.97","TCP","1514","cvsup > 39835 [ACK] Seq=57798 Ack=1259 Win=1088 Len=1448 TSval=1220866891 TSecr=347696095"
"802","3.614440","194.29.146.149","194.29.146.97","TCP","2962","cvsup > 39835 [ACK] Seq=59246 Ack=1259 Win=1088 Len=2896 TSval=1220866891 TSecr=347696095"
"803","3.614704","194.29.146.149","194.29.146.97","TCP","2962","cvsup > 39835 [ACK] Seq=62142 Ack=1259 Win=1088 Len=2896 TSval=1220866891 TSecr=347696095"
"804","3.614957","194.29.146.149","194.29.146.97","TCP","1514","cvsup > 39835 [ACK] Seq=65038 Ack=1259 Win=1088 Len=1448 TSval=1220866891 TSecr=347696095"
"806","3.619592","194.29.146.149","194.29.146.97","TCP","2014","cvsup > 39835 [PSH, ACK] Seq=66486 Ack=1259 Win=1088 Len=1948 TSval=1220866897 TSecr=347696100"
"809","3.636556","194.29.146.149","194.29.146.97","TCP","2962","cvsup > 39835 [ACK] Seq=68434 Ack=1471 Win=1088 Len=2896 TSval=1220866913 TSecr=347696107"
"811","3.636800","194.29.146.149","194.29.146.97","TCP","2962","cvsup > 39835 [ACK] Seq=71330 Ack=1471 Win=1088 Len=2896 TSval=1220866913 TSecr=347696107"
"813","3.637051","194.29.146.149","194.29.146.97","TCP","2962","cvsup > 39835 [ACK] Seq=74226 Ack=1471 Win=1088 Len=2896 TSval=1220866913 TSecr=347696107"
"815","3.637298","194.29.146.149","194.29.146.97","TCP","1514","cvsup > 39835 [ACK] Seq=77122 Ack=1471 Win=1088 Len=1448 TSval=1220866913 TSecr=347696107"
"816","3.637548","194.29.146.149","194.29.146.97","TCP","2962","cvsup > 39835 [ACK] Seq=78570 Ack=1477 Win=1088 Len=2896 TSval=1220866914 TSecr=347696118"
"817","3.637797","194.29.146.149","194.29.146.97","TCP","2962","cvsup > 39835 [ACK] Seq=81466 Ack=1477 Win=1088 Len=2896 TSval=1220866914 TSecr=347696118"
"818","3.638049","194.29.146.149","194.29.146.97","TCP","2962","cvsup > 39835 [ACK] Seq=84362 Ack=1477 Win=1088 Len=2896 TSval=1220866914 TSecr=347696118"
"820","3.640114","194.29.146.149","194.29.146.97","TCP","1514","cvsup > 39835 [ACK] Seq=87258 Ack=1477 Win=1088 Len=1448 TSval=1220866917 TSecr=347696121"
"821","3.640415","194.29.146.149","194.29.146.97","TCP","3290","cvsup > 39835 [PSH, ACK] Seq=88706 Ack=1477 Win=1088 Len=3224 TSval=1220866917 TSecr=347696121"
"824","3.692420","194.29.146.149","194.29.146.97","TCP","66","cvsup > 39835 [ACK] Seq=91930 Ack=1703 Win=1088 Len=0 TSval=1220866970 TSecr=347696134"
"826","3.693313","194.29.146.149","194.29.146.97","TCP","66","cvsup > 39835 [ACK] Seq=91930 Ack=1727 Win=1088 Len=0 TSval=1220866971 TSecr=347696174"
"828","3.696713","194.29.146.149","194.29.146.97","TCP","66","cvsup > 39835 [ACK] Seq=91930 Ack=1733 Win=1088 Len=0 TSval=1220866974 TSecr=347696178"
"830","3.712980","194.29.146.149","194.29.146.97","TCP","66","cvsup > 39835 [ACK] Seq=91930 Ack=1739 Win=1088 Len=0 TSval=1220866990 TSecr=347696194"
"832","3.722723","194.29.146.149","194.29.146.97","TCP","66","cvsup > 39835 [ACK] Seq=91930 Ack=1745 Win=1088 Len=0 TSval=1220867000 TSecr=347696202"
"834","3.730118","194.29.146.149","194.29.146.97","TCP","66","cvsup > 39835 [ACK] Seq=91930 Ack=1751 Win=1088 Len=0 TSval=1220867007 TSecr=347696210"
"836","3.745350","194.29.146.149","194.29.146.97","TCP","66","cvsup > 39835 [ACK] Seq=91930 Ack=1757 Win=1088 Len=0 TSval=1220867023 TSecr=347696226"
"837","3.755646","194.29.146.149","194.29.146.97","TCP","1514","cvsup > 39835 [ACK] Seq=91930 Ack=1757 Win=1088 Len=1448 TSval=1220867033 TSecr=347696226"
"838","3.755899","194.29.146.149","194.29.146.97","TCP","2962","cvsup > 39835 [ACK] Seq=93378 Ack=1757 Win=1088 Len=2896 TSval=1220867033 TSecr=347696226"
"839","3.756131","194.29.146.149","194.29.146.97","TCP","2962","cvsup > 39835 [ACK] Seq=96274 Ack=1757 Win=1088 Len=2896 TSval=1220867033 TSecr=347696226"
"840","3.756399","194.29.146.149","194.29.146.97","TCP","4410","cvsup > 39835 [ACK] Seq=99170 Ack=1757 Win=1088 Len=4344 TSval=1220867033 TSecr=347696226"
"842","3.756641","194.29.146.149","194.29.146.97","TCP","2962","cvsup > 39835 [ACK] Seq=103514 Ack=1757 Win=1088 Len=2896 TSval=1220867033 TSecr=347696226"
"843","3.756871","194.29.146.149","194.29.146.97","RELOAD Frame","1514","ACK"
"844","3.757384","194.29.146.149","194.29.146.97","TCP","1514","cvsup > 39835 [ACK] Seq=107858 Ack=1757 Win=1088 Len=1448 TSval=1220867034 TSecr=347696238"
"845","3.757659","194.29.146.149","194.29.146.97","TCP","4410","cvsup > 39835 [ACK] Seq=109306 Ack=1757 Win=1088 Len=4344 TSval=1220867034 TSecr=347696238"
"846","3.757906","194.29.146.149","194.29.146.97","TCP","1560","cvsup > 39835 [PSH, ACK] Seq=113650 Ack=1757 Win=1088 Len=1494 TSval=1220867034 TSecr=347696238"
"849","3.812448","194.29.146.149","194.29.146.97","TCP","66","cvsup > 39835 [ACK] Seq=115144 Ack=2033 Win=1088 Len=0 TSval=1220867090 TSecr=347696253"
"851","3.814766","194.29.146.149","194.29.146.97","TCP","66","cvsup > 39835 [ACK] Seq=115144 Ack=2057 Win=1088 Len=0 TSval=1220867092 TSecr=347696294"
"853","3.823425","194.29.146.149","194.29.146.97","TCP","66","cvsup > 39835 [ACK] Seq=115144 Ack=2063 Win=1088 Len=0 TSval=1220867101 TSecr=347696298"
"855","3.843483","194.29.146.149","194.29.146.97","TCP","66","cvsup > 39835 [ACK] Seq=115144 Ack=2069 Win=1088 Len=0 TSval=1220867121 TSecr=347696314"
"857","3.848727","194.29.146.149","194.29.146.97","TCP","66","cvsup > 39835 [ACK] Seq=115144 Ack=2075 Win=1088 Len=0 TSval=1220867126 TSecr=347696330"
"859","3.856728","194.29.146.149","194.29.146.97","TCP","66","cvsup > 39835 [ACK] Seq=115144 Ack=2081 Win=1088 Len=0 TSval=1220867134 TSecr=347696338"
"861","3.873908","194.29.146.149","194.29.146.97","TCP","66","cvsup > 39835 [ACK] Seq=115144 Ack=2087 Win=1088 Len=0 TSval=1220867151 TSecr=347696354"
"863","3.880730","194.29.146.149","194.29.146.97","TCP","66","cvsup > 39835 [ACK] Seq=115144 Ack=2093 Win=1088 Len=0 TSval=1220867158 TSecr=347696362"
"865","3.894278","194.29.146.149","194.29.146.97","TCP","1514","cvsup > 39835 [ACK] Seq=115144 Ack=2099 Win=1088 Len=1448 TSval=1220867171 TSecr=347696370"
"866","3.894528","194.29.146.149","194.29.146.97","TCP","2962","cvsup > 39835 [ACK] Seq=116592 Ack=2099 Win=1088 Len=2896 TSval=1220867171 TSecr=347696370"
"867","3.894779","194.29.146.149","194.29.146.97","TCP","4410","cvsup > 39835 [ACK] Seq=119488 Ack=2099 Win=1088 Len=4344 TSval=1220867171 TSecr=347696370"
"869","3.895011","194.29.146.149","194.29.146.97","TCP","1514","cvsup > 39835 [ACK] Seq=123832 Ack=2099 Win=1088 Len=1448 TSval=1220867171 TSecr=347696370"
"870","3.895255","194.29.146.149","194.29.146.97","TCP","2962","cvsup > 39835 [ACK] Seq=125280 Ack=2099 Win=1088 Len=2896 TSval=1220867171 TSecr=347696370"
"871","3.895526","194.29.146.149","194.29.146.97","TCP","3418","cvsup > 39835 [PSH, ACK] Seq=128176 Ack=2099 Win=1088 Len=3352 TSval=1220867171 TSecr=347696370"
"872","3.895754","194.29.146.149","194.29.146.97","TCP","2962","cvsup > 39835 [ACK] Seq=131528 Ack=2099 Win=1088 Len=2896 TSval=1220867173 TSecr=347696376"
"873","3.896029","194.29.146.149","194.29.146.97","TCP","2962","cvsup > 39835 [ACK] Seq=134424 Ack=2099 Win=1088 Len=2896 TSval=1220867173 TSecr=347696376"
"874","3.896276","194.29.146.149","194.29.146.97","TCP","698","cvsup > 39835 [PSH, ACK] Seq=137320 Ack=2099 Win=1088 Len=632 TSval=1220867173 TSecr=347696376"
"877","3.919551","194.29.146.149","194.29.146.97","TCP","2962","cvsup > 39835 [ACK] Seq=137952 Ack=2401 Win=1088 Len=2896 TSval=1220867196 TSecr=347696390"
"879","3.919803","194.29.146.149","194.29.146.97","TCP","2962","cvsup > 39835 [ACK] Seq=140848 Ack=2401 Win=1088 Len=2896 TSval=1220867196 TSecr=347696390"
"881","3.920051","194.29.146.149","194.29.146.97","TCP","2962","cvsup > 39835 [ACK] Seq=143744 Ack=2401 Win=1088 Len=2896 TSval=1220867196 TSecr=347696390"
"882","3.920300","194.29.146.149","194.29.146.97","TCP","2962","cvsup > 39835 [ACK] Seq=146640 Ack=2401 Win=1088 Len=2896 TSval=1220867196 TSecr=347696390"
"883","3.920552","194.29.146.149","194.29.146.97","TCP","2962","cvsup > 39835 [ACK] Seq=149536 Ack=2401 Win=1088 Len=2896 TSval=1220867196 TSecr=347696390"
"884","3.920800","194.29.146.149","194.29.146.97","TCP","1970","cvsup > 39835 [PSH, ACK] Seq=152432 Ack=2401 Win=1088 Len=1904 TSval=1220867196 TSecr=347696390"
"885","3.921408","194.29.146.149","194.29.146.97","TCP","1514","cvsup > 39835 [ACK] Seq=154336 Ack=2407 Win=1088 Len=1448 TSval=1220867198 TSecr=347696401"
"886","3.921659","194.29.146.149","194.29.146.97","TCP","2962","cvsup > 39835 [ACK] Seq=155784 Ack=2407 Win=1088 Len=2896 TSval=1220867198 TSecr=347696401"
"887","3.921897","194.29.146.149","194.29.146.97","TCP","2022","cvsup > 39835 [PSH, ACK] Seq=158680 Ack=2407 Win=1088 Len=1956 TSval=1220867198 TSecr=347696401"
"890","3.972450","194.29.146.149","194.29.146.97","TCP","66","cvsup > 39835 [ACK] Seq=160636 Ack=2599 Win=1088 Len=0 TSval=1220867250 TSecr=347696414"
"892","3.974470","194.29.146.149","194.29.146.97","TCP","66","cvsup > 39835 [ACK] Seq=160636 Ack=2623 Win=1088 Len=0 TSval=1220867252 TSecr=347696454"
"894","3.992908","194.29.146.149","194.29.146.97","TCP","66","cvsup > 39835 [ACK] Seq=160636 Ack=2629 Win=1088 Len=0 TSval=1220867270 TSecr=347696474"
"902","4.008976","194.29.146.149","194.29.146.97","TCP","66","cvsup > 39835 [ACK] Seq=160636 Ack=2635 Win=1088 Len=0 TSval=1220867286 TSecr=347696490"
"916","4.016716","194.29.146.149","194.29.146.97","TCP","66","cvsup > 39835 [ACK] Seq=160636 Ack=2641 Win=1088 Len=0 TSval=1220867294 TSecr=347696498"
"939","4.033047","194.29.146.149","194.29.146.97","TCP","66","cvsup > 39835 [ACK] Seq=160636 Ack=2647 Win=1088 Len=0 TSval=1220867310 TSecr=347696514"
"956","4.041044","194.29.146.149","194.29.146.97","TCP","66","cvsup > 39835 [ACK] Seq=160636 Ack=2653 Win=1088 Len=0 TSval=1220867318 TSecr=347696522"
"976","4.050590","194.29.146.149","194.29.146.97","TCP","1514","cvsup > 39835 [ACK] Seq=160636 Ack=2659 Win=1088 Len=1448 TSval=1220867328 TSecr=347696530"
"977","4.050827","194.29.146.149","194.29.146.97","TCP","2962","cvsup > 39835 [ACK] Seq=162084 Ack=2659 Win=1088 Len=2896 TSval=1220867328 TSecr=347696530"
"979","4.051093","194.29.146.149","194.29.146.97","TCP","4410","cvsup > 39835 [ACK] Seq=164980 Ack=2659 Win=1088 Len=4344 TSval=1220867328 TSecr=347696530"
"980","4.051342","194.29.146.149","194.29.146.97","TCP","2962","cvsup > 39835 [ACK] Seq=169324 Ack=2659 Win=1088 Len=2896 TSval=1220867328 TSecr=347696530"
"982","4.051576","194.29.146.149","194.29.146.97","TCP","1514","cvsup > 39835 [ACK] Seq=172220 Ack=2659 Win=1088 Len=1448 TSval=1220867328 TSecr=347696530"
"983","4.051825","194.29.146.149","194.29.146.97","TCP","3418","cvsup > 39835 [PSH, ACK] Seq=173668 Ack=2659 Win=1088 Len=3352 TSval=1220867328 TSecr=347696530"
"985","4.052284","194.29.146.149","194.29.146.97","TCP","1514","cvsup > 39835 [ACK] Seq=177020 Ack=2659 Win=1088 Len=1448 TSval=1220867329 TSecr=347696533"
"987","4.052536","194.29.146.149","194.29.146.97","TCP","2409","cvsup > 39835 [PSH, ACK] Seq=178468 Ack=2659 Win=1088 Len=2343 TSval=1220867329 TSecr=347696533"
"999","4.075507","194.29.146.149","194.29.146.97","TCP","1514","cvsup > 39835 [ACK] Seq=180811 Ack=2891 Win=1088 Len=1448 TSval=1220867352 TSecr=347696547"
"1000","4.075756","194.29.146.149","194.29.146.97","TCP","2962","cvsup > 39835 [ACK] Seq=182259 Ack=2891 Win=1088 Len=2896 TSval=1220867352 TSecr=347696547"
"1002","4.076007","194.29.146.149","194.29.146.97","TCP","2962","cvsup > 39835 [ACK] Seq=185155 Ack=2891 Win=1088 Len=2896 TSval=1220867352 TSecr=347696547"
"1003","4.076255","194.29.146.149","194.29.146.97","TCP","2962","cvsup > 39835 [ACK] Seq=188051 Ack=2891 Win=1088 Len=2896 TSval=1220867352 TSecr=347696547"
"1004","4.076505","194.29.146.149","194.29.146.97","TCP","2962","cvsup > 39835 [ACK] Seq=190947 Ack=2891 Win=1088 Len=2896 TSval=1220867352 TSecr=347696547"
"1005","4.076754","194.29.146.149","194.29.146.97","TCP","2962","cvsup > 39835 [ACK] Seq=193843 Ack=2891 Win=1088 Len=2896 TSval=1220867352 TSecr=347696547"
"1006","4.076759","194.29.146.149","194.29.146.97","TCP","522","cvsup > 39835 [PSH, ACK] Seq=196739 Ack=2891 Win=1088 Len=456 TSval=1220867353 TSecr=347696547"
"1007","4.077004","194.29.146.149","194.29.146.97","TCP","2962","cvsup > 39835 [ACK] Seq=197195 Ack=2891 Win=1088 Len=2896 TSval=1220867354 TSecr=347696547"
"1008","4.077253","194.29.146.149","194.29.146.97","TCP","2581","cvsup > 39835 [PSH, ACK] Seq=200091 Ack=2891 Win=1088 Len=2515 TSval=1220867354 TSecr=347696547"
"1012","4.128315","194.29.146.149","194.29.146.97","TCP","66","cvsup > 39835 [ACK] Seq=202606 Ack=3127 Win=1088 Len=0 TSval=1220867406 TSecr=347696570"
"1014","4.131062","194.29.146.149","194.29.146.97","TCP","66","cvsup > 39835 [ACK] Seq=202606 Ack=3151 Win=1088 Len=0 TSval=1220867408 TSecr=347696609"
"1016","4.131325","194.29.146.149","194.29.146.97","TCP","66","cvsup > 39835 [ACK] Seq=202606 Ack=3157 Win=1088 Len=0 TSval=1220867409 TSecr=347696612"
"1018","4.138618","194.29.146.149","194.29.146.97","TCP","66","cvsup > 39835 [ACK] Seq=202606 Ack=3163 Win=1088 Len=0 TSval=1220867416 TSecr=347696618"
"1020","4.145735","194.29.146.149","194.29.146.97","TCP","66","cvsup > 39835 [ACK] Seq=202606 Ack=3169 Win=1088 Len=0 TSval=1220867423 TSecr=347696626"
"1022","4.153007","194.29.146.149","194.29.146.97","TCP","66","cvsup > 39835 [ACK] Seq=202606 Ack=3175 Win=1088 Len=0 TSval=1220867430 TSecr=347696634"
"1024","4.160761","194.29.146.149","194.29.146.97","TCP","66","cvsup > 39835 [ACK] Seq=202606 Ack=3181 Win=1088 Len=0 TSval=1220867438 TSecr=347696642"
"1026","4.168760","194.29.146.149","194.29.146.97","TCP","66","cvsup > 39835 [ACK] Seq=202606 Ack=3187 Win=1088 Len=0 TSval=1220867446 TSecr=347696650"
"1028","4.178387","194.29.146.149","194.29.146.97","TCP","66","cvsup > 39835 [ACK] Seq=202606 Ack=3193 Win=1088 Len=0 TSval=1220867456 TSecr=347696658"
"1030","4.186548","194.29.146.149","194.29.146.97","TCP","66","cvsup > 39835 [ACK] Seq=202606 Ack=3199 Win=1088 Len=0 TSval=1220867464 TSecr=347696666"
"1032","4.194038","194.29.146.149","194.29.146.97","TCP","66","cvsup > 39835 [ACK] Seq=202606 Ack=3205 Win=1088 Len=0 TSval=1220867471 TSecr=347696674"
"1034","4.203193","194.29.146.149","194.29.146.97","TCP","1514","cvsup > 39835 [ACK] Seq=202606 Ack=3211 Win=1088 Len=1448 TSval=1220867480 TSecr=347696682"
"1035","4.203452","194.29.146.149","194.29.146.97","TCP","4410","cvsup > 39835 [ACK] Seq=204054 Ack=3211 Win=1088 Len=4344 TSval=1220867480 TSecr=347696682"
"1037","4.203689","194.29.146.149","194.29.146.97","TCP","1514","cvsup > 39835 [ACK] Seq=208398 Ack=3211 Win=1088 Len=1448 TSval=1220867480 TSecr=347696682"
"1038","4.203940","194.29.146.149","194.29.146.97","TCP","4410","cvsup > 39835 [ACK] Seq=209846 Ack=3211 Win=1088 Len=4344 TSval=1220867480 TSecr=347696682"
"1039","4.204190","194.29.146.149","194.29.146.97","TCP","2962","cvsup > 39835 [ACK] Seq=214190 Ack=3211 Win=1088 Len=2896 TSval=1220867480 TSecr=347696682"
"1040","4.204418","194.29.146.149","194.29.146.97","TCP","1970","cvsup > 39835 [PSH, ACK] Seq=217086 Ack=3211 Win=1088 Len=1904 TSval=1220867480 TSecr=347696682"
"1041","4.204704","194.29.146.149","194.29.146.97","TCP","1411","cvsup > 39835 [PSH, ACK] Seq=218990 Ack=3211 Win=1088 Len=1345 TSval=1220867480 TSecr=347696682"
