"No.","Time","Source","Destination","Protocol","Length","Info"
"1","0.000000","194.29.146.149","194.29.146.97","TCP","224","cvsup > 39745 [PSH, ACK] Seq=1 Ack=1 Win=129 Len=158 TSval=1219039156 TSecr=345864037"
"3","0.000700","194.29.146.149","194.29.146.97","TCP","66","cvsup > 39745 [ACK] Seq=159 Ack=11 Win=129 Len=0 TSval=1219039156 TSecr=345868316"
"351","3.154365","194.29.146.149","194.29.146.97","TCP","66","cvsup > 39745 [ACK] Seq=159 Ack=17 Win=129 Len=0 TSval=1219042310 TSecr=345871470"
"353","3.162069","194.29.146.149","194.29.146.97","TCP","66","cvsup > 39745 [ACK] Seq=159 Ack=23 Win=129 Len=0 TSval=1219042318 TSecr=345871478"
"355","3.169822","194.29.146.149","194.29.146.97","TCP","66","cvsup > 39745 [ACK] Seq=159 Ack=29 Win=129 Len=0 TSval=1219042326 TSecr=345871485"
"357","3.178041","194.29.146.149","194.29.146.97","TCP","66","cvsup > 39745 [ACK] Seq=159 Ack=35 Win=129 Len=0 TSval=1219042334 TSecr=345871494"
"359","3.186075","194.29.146.149","194.29.146.97","TCP","66","cvsup > 39745 [ACK] Seq=159 Ack=41 Win=129 Len=0 TSval=1219042342 TSecr=345871502"
"361","3.194046","194.29.146.149","194.29.146.97","TCP","66","cvsup > 39745 [ACK] Seq=159 Ack=47 Win=129 Len=0 TSval=1219042350 TSecr=345871510"
"363","3.201997","194.29.146.149","194.29.146.97","TCP","66","cvsup > 39745 [ACK] Seq=159 Ack=53 Win=129 Len=0 TSval=1219042358 TSecr=345871518"
"365","3.209960","194.29.146.149","194.29.146.97","TCP","66","cvsup > 39745 [ACK] Seq=159 Ack=59 Win=129 Len=0 TSval=1219042366 TSecr=345871525"
"367","3.217835","194.29.146.149","194.29.146.97","TCP","66","cvsup > 39745 [ACK] Seq=159 Ack=65 Win=129 Len=0 TSval=1219042374 TSecr=345871533"
"369","3.225762","194.29.146.149","194.29.146.97","TCP","66","cvsup > 39745 [ACK] Seq=159 Ack=71 Win=129 Len=0 TSval=1219042382 TSecr=345871541"
"371","3.233843","194.29.146.149","194.29.146.97","TCP","66","cvsup > 39745 [ACK] Seq=159 Ack=77 Win=129 Len=0 TSval=1219042390 TSecr=345871549"
"373","3.241823","194.29.146.149","194.29.146.97","TCP","66","cvsup > 39745 [ACK] Seq=159 Ack=83 Win=129 Len=0 TSval=1219042398 TSecr=345871557"
"375","3.249832","194.29.146.149","194.29.146.97","TCP","66","cvsup > 39745 [ACK] Seq=159 Ack=89 Win=129 Len=0 TSval=1219042406 TSecr=345871565"
"377","3.259170","194.29.146.149","194.29.146.97","TCP","66","cvsup > 39745 [ACK] Seq=159 Ack=95 Win=129 Len=0 TSval=1219042415 TSecr=345871575"
"379","3.265854","194.29.146.149","194.29.146.97","TCP","66","cvsup > 39745 [ACK] Seq=159 Ack=101 Win=129 Len=0 TSval=1219042422 TSecr=345871581"
"381","3.274154","194.29.146.149","194.29.146.97","TCP","66","cvsup > 39745 [ACK] Seq=159 Ack=107 Win=129 Len=0 TSval=1219042430 TSecr=345871589"
"383","3.292422","194.29.146.149","194.29.146.97","TCP","66","cvsup > 39745 [ACK] Seq=159 Ack=113 Win=129 Len=0 TSval=1219042448 TSecr=345871597"
"385","3.294742","194.29.146.149","194.29.146.97","TCP","66","cvsup > 39745 [ACK] Seq=159 Ack=119 Win=129 Len=0 TSval=1219042450 TSecr=345871608"
"387","3.298222","194.29.146.149","194.29.146.97","TCP","66","cvsup > 39745 [ACK] Seq=159 Ack=125 Win=129 Len=0 TSval=1219042454 TSecr=345871613"
"389","3.308209","194.29.146.149","194.29.146.97","TCP","66","cvsup > 39745 [ACK] Seq=159 Ack=131 Win=129 Len=0 TSval=1219042464 TSecr=345871621"
"391","3.315460","194.29.146.149","194.29.146.97","TCP","66","cvsup > 39745 [ACK] Seq=159 Ack=137 Win=129 Len=0 TSval=1219042471 TSecr=345871630"
"393","3.322889","194.29.146.149","194.29.146.97","TCP","66","cvsup > 39745 [ACK] Seq=159 Ack=143 Win=129 Len=0 TSval=1219042479 TSecr=345871637"
"395","3.334259","194.29.146.149","194.29.146.97","TCP","66","cvsup > 39745 [ACK] Seq=159 Ack=149 Win=129 Len=0 TSval=1219042490 TSecr=345871645"
"397","3.339712","194.29.146.149","194.29.146.97","TCP","66","cvsup > 39745 [ACK] Seq=159 Ack=155 Win=129 Len=0 TSval=1219042495 TSecr=345871653"
"399","3.345953","194.29.146.149","194.29.146.97","TCP","66","cvsup > 39745 [ACK] Seq=159 Ack=161 Win=129 Len=0 TSval=1219042502 TSecr=345871662"
"401","3.353809","194.29.146.149","194.29.146.97","TCP","66","cvsup > 39745 [ACK] Seq=159 Ack=167 Win=129 Len=0 TSval=1219042510 TSecr=345871669"
"403","3.361851","194.29.146.149","194.29.146.97","TCP","66","cvsup > 39745 [ACK] Seq=159 Ack=173 Win=129 Len=0 TSval=1219042518 TSecr=345871677"
"405","3.369776","194.29.146.149","194.29.146.97","TCP","66","cvsup > 39745 [ACK] Seq=159 Ack=179 Win=129 Len=0 TSval=1219042526 TSecr=345871685"
"407","3.434089","194.29.146.149","194.29.146.97","TCP","66","cvsup > 39745 [ACK] Seq=159 Ack=185 Win=129 Len=0 TSval=1219042590 TSecr=345871710"
"409","3.474193","194.29.146.149","194.29.146.97","TCP","66","cvsup > 39745 [ACK] Seq=159 Ack=191 Win=129 Len=0 TSval=1219042630 TSecr=345871750"
"476","3.598263","194.29.146.149","194.29.146.97","TCP","66","cvsup > 39745 [ACK] Seq=159 Ack=197 Win=129 Len=0 TSval=1219042754 TSecr=345871910"
"478","3.603657","194.29.146.149","194.29.146.97","TCP","66","cvsup > 39745 [ACK] Seq=159 Ack=203 Win=129 Len=0 TSval=1219042759 TSecr=345871917"
"481","3.609845","194.29.146.149","194.29.146.97","TCP","66","cvsup > 39745 [ACK] Seq=159 Ack=209 Win=129 Len=0 TSval=1219042766 TSecr=345871925"
"483","3.617875","194.29.146.149","194.29.146.97","TCP","66","cvsup > 39745 [ACK] Seq=159 Ack=215 Win=129 Len=0 TSval=1219042774 TSecr=345871933"
"485","3.626088","194.29.146.149","194.29.146.97","TCP","66","cvsup > 39745 [ACK] Seq=159 Ack=221 Win=129 Len=0 TSval=1219042782 TSecr=345871942"
"487","3.634114","194.29.146.149","194.29.146.97","TCP","66","cvsup > 39745 [ACK] Seq=159 Ack=227 Win=129 Len=0 TSval=1219042790 TSecr=345871950"
"489","3.642110","194.29.146.149","194.29.146.97","TCP","66","cvsup > 39745 [ACK] Seq=159 Ack=233 Win=129 Len=0 TSval=1219042798 TSecr=345871958"
"491","3.650072","194.29.146.149","194.29.146.97","TCP","66","cvsup > 39745 [ACK] Seq=159 Ack=239 Win=129 Len=0 TSval=1219042806 TSecr=345871966"
"493","3.698076","194.29.146.149","194.29.146.97","TCP","66","cvsup > 39745 [ACK] Seq=159 Ack=245 Win=129 Len=0 TSval=1219042854 TSecr=345871974"
"501","3.738063","194.29.146.149","194.29.146.97","TCP","66","cvsup > 39745 [ACK] Seq=159 Ack=275 Win=129 Len=0 TSval=1219042894 TSecr=345872014"
"567","3.779069","194.29.146.149","194.29.146.97","TCP","66","cvsup > 39745 [ACK] Seq=159 Ack=305 Win=129 Len=0 TSval=1219042934 TSecr=345872054"
"584","3.819341","194.29.146.149","194.29.146.97","TCP","66","cvsup > 39745 [ACK] Seq=159 Ack=335 Win=129 Len=0 TSval=1219042975 TSecr=345872095"
"586","3.826383","194.29.146.149","194.29.146.97","TCP","66","cvsup > 39745 [ACK] Seq=159 Ack=347 Win=129 Len=0 TSval=1219042982 TSecr=345872135"
"588","3.835546","194.29.146.149","194.29.146.97","TCP","66","cvsup > 39745 [ACK] Seq=159 Ack=353 Win=129 Len=0 TSval=1219042991 TSecr=345872150"
"591","3.842169","194.29.146.149","194.29.146.97","TCP","66","cvsup > 39745 [ACK] Seq=159 Ack=359 Win=129 Len=0 TSval=1219042998 TSecr=345872158"
"593","3.850100","194.29.146.149","194.29.146.97","TCP","66","cvsup > 39745 [ACK] Seq=159 Ack=365 Win=129 Len=0 TSval=1219043006 TSecr=345872166"
"595","3.860225","194.29.146.149","194.29.146.97","TCP","66","cvsup > 39745 [ACK] Seq=159 Ack=371 Win=129 Len=0 TSval=1219043016 TSecr=345872174"
"597","3.867870","194.29.146.149","194.29.146.97","TCP","66","cvsup > 39745 [ACK] Seq=159 Ack=377 Win=129 Len=0 TSval=1219043023 TSecr=345872181"
"599","3.874120","194.29.146.149","194.29.146.97","TCP","66","cvsup > 39745 [ACK] Seq=159 Ack=383 Win=129 Len=0 TSval=1219043030 TSecr=345872189"
"601","3.885848","194.29.146.149","194.29.146.97","TCP","66","cvsup > 39745 [ACK] Seq=159 Ack=389 Win=129 Len=0 TSval=1219043041 TSecr=345872197"
"603","3.889923","194.29.146.149","194.29.146.97","TCP","66","cvsup > 39745 [ACK] Seq=159 Ack=395 Win=129 Len=0 TSval=1219043046 TSecr=345872206"
"605","3.897868","194.29.146.149","194.29.146.97","TCP","66","cvsup > 39745 [ACK] Seq=159 Ack=401 Win=129 Len=0 TSval=1219043054 TSecr=345872213"
"607","3.905877","194.29.146.149","194.29.146.97","TCP","66","cvsup > 39745 [ACK] Seq=159 Ack=407 Win=129 Len=0 TSval=1219043062 TSecr=345872221"
"609","3.929985","194.29.146.149","194.29.146.97","TCP","66","cvsup > 39745 [ACK] Seq=159 Ack=413 Win=129 Len=0 TSval=1219043086 TSecr=345872246"
"611","3.938935","194.29.146.149","194.29.146.97","TCP","66","cvsup > 39745 [ACK] Seq=159 Ack=419 Win=129 Len=0 TSval=1219043095 TSecr=345872253"
"613","3.987075","194.29.146.149","194.29.146.97","TCP","66","cvsup > 39745 [ACK] Seq=159 Ack=425 Win=129 Len=0 TSval=1219043142 TSecr=345872262"
"615","4.026205","194.29.146.149","194.29.146.97","TCP","66","cvsup > 39745 [ACK] Seq=159 Ack=461 Win=129 Len=0 TSval=1219043182 TSecr=345872303"
"617","4.026808","194.29.146.149","194.29.146.97","TCP","66","cvsup > 39745 [ACK] Seq=159 Ack=491 Win=129 Len=0 TSval=1219043182 TSecr=345872342"
"620","4.036230","194.29.146.149","194.29.146.97","TCP","66","cvsup > 39745 [ACK] Seq=159 Ack=497 Win=129 Len=0 TSval=1219043192 TSecr=345872350"
"623","4.050462","194.29.146.149","194.29.146.97","TCP","66","cvsup > 39745 [ACK] Seq=159 Ack=503 Win=129 Len=0 TSval=1219043206 TSecr=345872366"
"625","4.059508","194.29.146.149","194.29.146.97","TCP","66","cvsup > 39745 [ACK] Seq=159 Ack=509 Win=129 Len=0 TSval=1219043215 TSecr=345872374"
"627","4.066392","194.29.146.149","194.29.146.97","TCP","66","cvsup > 39745 [ACK] Seq=159 Ack=515 Win=129 Len=0 TSval=1219043222 TSecr=345872382"
"629","4.114099","194.29.146.149","194.29.146.97","TCP","66","cvsup > 39745 [ACK] Seq=159 Ack=521 Win=129 Len=0 TSval=1219043270 TSecr=345872390"
"631","4.123817","194.29.146.149","194.29.146.97","TCP","66","cvsup > 39745 [ACK] Seq=159 Ack=545 Win=129 Len=0 TSval=1219043279 TSecr=345872430"
"633","4.126711","194.29.146.149","194.29.146.97","TCP","66","cvsup > 39745 [ACK] Seq=159 Ack=551 Win=129 Len=0 TSval=1219043282 TSecr=345872440"
"635","4.129912","194.29.146.149","194.29.146.97","TCP","66","cvsup > 39745 [ACK] Seq=159 Ack=557 Win=129 Len=0 TSval=1219043286 TSecr=345872446"
"637","4.137918","194.29.146.149","194.29.146.97","TCP","66","cvsup > 39745 [ACK] Seq=159 Ack=563 Win=129 Len=0 TSval=1219043294 TSecr=345872453"
"639","4.150627","194.29.146.149","194.29.146.97","TCP","66","cvsup > 39745 [ACK] Seq=159 Ack=569 Win=129 Len=0 TSval=1219043306 TSecr=345872461"
"641","4.158831","194.29.146.149","194.29.146.97","TCP","1514","cvsup > 39745 [ACK] Seq=159 Ack=575 Win=129 Len=1448 TSval=1219043314 TSecr=345872470"
"642","4.159086","194.29.146.149","194.29.146.97","TCP","2962","cvsup > 39745 [ACK] Seq=1607 Ack=575 Win=129 Len=2896 TSval=1219043314 TSecr=345872470"
"644","4.159728","194.29.146.149","194.29.146.97","TCP","1146","cvsup > 39745 [PSH, ACK] Seq=4503 Ack=575 Win=129 Len=1080 TSval=1219043315 TSecr=345872475"
"646","4.202984","194.29.146.149","194.29.146.97","TCP","66","cvsup > 39745 [ACK] Seq=5583 Ack=601 Win=129 Len=0 TSval=1219043359 TSecr=345872479"
"648","4.203551","194.29.146.149","194.29.146.97","TCP","66","cvsup > 39745 [ACK] Seq=5583 Ack=631 Win=129 Len=0 TSval=1219043359 TSecr=345872519"
"650","4.210566","194.29.146.149","194.29.146.97","TCP","66","cvsup > 39745 [ACK] Seq=5583 Ack=637 Win=129 Len=0 TSval=1219043366 TSecr=345872526"
"652","4.218571","194.29.146.149","194.29.146.97","TCP","66","cvsup > 39745 [ACK] Seq=5583 Ack=643 Win=129 Len=0 TSval=1219043374 TSecr=345872534"
"654","4.227157","194.29.146.149","194.29.146.97","TCP","66","cvsup > 39745 [ACK] Seq=5583 Ack=649 Win=129 Len=0 TSval=1219043383 TSecr=345872542"
"656","4.234682","194.29.146.149","194.29.146.97","TCP","66","cvsup > 39745 [ACK] Seq=5583 Ack=655 Win=129 Len=0 TSval=1219043390 TSecr=345872550"
"658","4.242566","194.29.146.149","194.29.146.97","TCP","66","cvsup > 39745 [ACK] Seq=5583 Ack=661 Win=129 Len=0 TSval=1219043398 TSecr=345872558"
"660","4.249994","194.29.146.149","194.29.146.97","TCP","66","cvsup > 39745 [ACK] Seq=5583 Ack=667 Win=129 Len=0 TSval=1219043406 TSecr=345872566"
"662","4.263354","194.29.146.149","194.29.146.97","TCP","66","cvsup > 39745 [ACK] Seq=5583 Ack=673 Win=129 Len=0 TSval=1219043419 TSecr=345872578"
"664","4.266056","194.29.146.149","194.29.146.97","TCP","66","cvsup > 39745 [ACK] Seq=5583 Ack=679 Win=129 Len=0 TSval=1219043422 TSecr=345872582"
"666","4.273952","194.29.146.149","194.29.146.97","TCP","66","cvsup > 39745 [ACK] Seq=5583 Ack=685 Win=129 Len=0 TSval=1219043430 TSecr=345872590"
"668","4.282639","194.29.146.149","194.29.146.97","TCP","66","cvsup > 39745 [ACK] Seq=5583 Ack=691 Win=129 Len=0 TSval=1219043438 TSecr=345872597"
"670","4.289914","194.29.146.149","194.29.146.97","TCP","66","cvsup > 39745 [ACK] Seq=5583 Ack=697 Win=129 Len=0 TSval=1219043446 TSecr=345872605"
"672","4.298843","194.29.146.149","194.29.146.97","TCP","66","cvsup > 39745 [ACK] Seq=5583 Ack=703 Win=129 Len=0 TSval=1219043455 TSecr=345872614"
"674","4.306518","194.29.146.149","194.29.146.97","TCP","66","cvsup > 39745 [ACK] Seq=5583 Ack=709 Win=129 Len=0 TSval=1219043462 TSecr=345872622"
"676","4.314360","194.29.146.149","194.29.146.97","TCP","66","cvsup > 39745 [ACK] Seq=5583 Ack=715 Win=129 Len=0 TSval=1219043470 TSecr=345872630"
"678","4.323201","194.29.146.149","194.29.146.97","TCP","66","cvsup > 39745 [ACK] Seq=5583 Ack=721 Win=129 Len=0 TSval=1219043479 TSecr=345872638"
"680","4.330712","194.29.146.149","194.29.146.97","TCP","66","cvsup > 39745 [ACK] Seq=5583 Ack=727 Win=129 Len=0 TSval=1219043486 TSecr=345872646"
"682","4.338368","194.29.146.149","194.29.146.97","TCP","66","cvsup > 39745 [ACK] Seq=5583 Ack=733 Win=129 Len=0 TSval=1219043494 TSecr=345872653"
"684","4.345985","194.29.146.149","194.29.146.97","TCP","66","cvsup > 39745 [ACK] Seq=5583 Ack=739 Win=129 Len=0 TSval=1219043502 TSecr=345872662"
"686","4.354654","194.29.146.149","194.29.146.97","TCP","66","cvsup > 39745 [ACK] Seq=5583 Ack=745 Win=129 Len=0 TSval=1219043510 TSecr=345872670"
"688","4.362015","194.29.146.149","194.29.146.97","TCP","66","cvsup > 39745 [ACK] Seq=5583 Ack=751 Win=129 Len=0 TSval=1219043518 TSecr=345872678"
"690","4.370659","194.29.146.149","194.29.146.97","TCP","66","cvsup > 39745 [ACK] Seq=5583 Ack=757 Win=129 Len=0 TSval=1219043526 TSecr=345872686"
"692","4.377888","194.29.146.149","194.29.146.97","TCP","66","cvsup > 39745 [ACK] Seq=5583 Ack=763 Win=129 Len=0 TSval=1219043534 TSecr=345872693"
"694","4.395636","194.29.146.149","194.29.146.97","TCP","1514","cvsup > 39745 [ACK] Seq=5583 Ack=769 Win=129 Len=1448 TSval=1219043551 TSecr=345872702"
"696","4.395885","194.29.146.149","194.29.146.97","TCP","2962","cvsup > 39745 [ACK] Seq=7031 Ack=769 Win=129 Len=2896 TSval=1219043551 TSecr=345872702"
"698","4.396136","194.29.146.149","194.29.146.97","TCP","2962","cvsup > 39745 [ACK] Seq=9927 Ack=769 Win=129 Len=2896 TSval=1219043551 TSecr=345872702"
"700","4.396651","194.29.146.149","194.29.146.97","TCP","2962","cvsup > 39745 [ACK] Seq=12823 Ack=775 Win=129 Len=2896 TSval=1219043552 TSecr=345872711"
"702","4.396900","194.29.146.149","194.29.146.97","TCP","1514","cvsup > 39745 [ACK] Seq=15719 Ack=775 Win=129 Len=1448 TSval=1219043552 TSecr=345872711"
"703","4.396912","194.29.146.149","194.29.146.97","TCP","1514","cvsup > 39745 [ACK] Seq=17167 Ack=775 Win=129 Len=1448 TSval=1219043552 TSecr=345872712"
"705","4.397148","194.29.146.149","194.29.146.97","TCP","2962","cvsup > 39745 [ACK] Seq=18615 Ack=775 Win=129 Len=2896 TSval=1219043552 TSecr=345872712"
"706","4.397158","194.29.146.149","194.29.146.97","TCP","522","cvsup > 39745 [PSH, ACK] Seq=21511 Ack=775 Win=129 Len=456 TSval=1219043553 TSecr=345872713"
"708","4.397654","194.29.146.149","194.29.146.97","TCP","2962","cvsup > 39745 [ACK] Seq=21967 Ack=775 Win=129 Len=2896 TSval=1219043553 TSecr=345872713"
"709","4.397917","194.29.146.149","194.29.146.97","TCP","2962","cvsup > 39745 [ACK] Seq=24863 Ack=775 Win=129 Len=2896 TSval=1219043553 TSecr=345872713"
"710","4.398167","194.29.146.149","194.29.146.97","TCP","2962","cvsup > 39745 [ACK] Seq=27759 Ack=775 Win=129 Len=2896 TSval=1219043553 TSecr=345872713"
"711","4.398417","194.29.146.149","194.29.146.97","TCP","2962","cvsup > 39745 [ACK] Seq=30655 Ack=775 Win=129 Len=2896 TSval=1219043553 TSecr=345872713"
"712","4.398671","194.29.146.149","194.29.146.97","TCP","1514","cvsup > 39745 [ACK] Seq=33551 Ack=775 Win=129 Len=1448 TSval=1219043553 TSecr=345872713"
"714","4.401605","194.29.146.149","194.29.146.97","TCP","650","cvsup > 39745 [PSH, ACK] Seq=34999 Ack=775 Win=129 Len=584 TSval=1219043557 TSecr=345872717"
"716","4.446840","194.29.146.149","194.29.146.97","TCP","66","cvsup > 39745 [ACK] Seq=35583 Ack=841 Win=129 Len=0 TSval=1219043602 TSecr=345872721"
"718","4.447405","194.29.146.149","194.29.146.97","TCP","66","cvsup > 39745 [ACK] Seq=35583 Ack=871 Win=129 Len=0 TSval=1219043603 TSecr=345872763"
"720","4.450436","194.29.146.149","194.29.146.97","TCP","66","cvsup > 39745 [ACK] Seq=35583 Ack=877 Win=129 Len=0 TSval=1219043606 TSecr=345872766"
"722","4.457982","194.29.146.149","194.29.146.97","TCP","66","cvsup > 39745 [ACK] Seq=35583 Ack=883 Win=129 Len=0 TSval=1219043614 TSecr=345872774"
"724","4.466863","194.29.146.149","194.29.146.97","TCP","66","cvsup > 39745 [ACK] Seq=35583 Ack=889 Win=129 Len=0 TSval=1219043622 TSecr=345872782"
"726","4.474496","194.29.146.149","194.29.146.97","TCP","66","cvsup > 39745 [ACK] Seq=35583 Ack=895 Win=129 Len=0 TSval=1219043630 TSecr=345872790"
"728","4.481952","194.29.146.149","194.29.146.97","TCP","66","cvsup > 39745 [ACK] Seq=35583 Ack=901 Win=129 Len=0 TSval=1219043638 TSecr=345872798"
"731","4.490296","194.29.146.149","194.29.146.97","TCP","66","cvsup > 39745 [ACK] Seq=35583 Ack=907 Win=129 Len=0 TSval=1219043646 TSecr=345872806"
"733","4.498850","194.29.146.149","194.29.146.97","TCP","66","cvsup > 39745 [ACK] Seq=35583 Ack=913 Win=129 Len=0 TSval=1219043654 TSecr=345872814"
"735","4.506899","194.29.146.149","194.29.146.97","TCP","66","cvsup > 39745 [ACK] Seq=35583 Ack=919 Win=129 Len=0 TSval=1219043662 TSecr=345872822"
"737","4.514485","194.29.146.149","194.29.146.97","TCP","66","cvsup > 39745 [ACK] Seq=35583 Ack=925 Win=129 Len=0 TSval=1219043670 TSecr=345872830"
"739","4.522608","194.29.146.149","194.29.146.97","TCP","66","cvsup > 39745 [ACK] Seq=35583 Ack=931 Win=129 Len=0 TSval=1219043678 TSecr=345872838"
"741","4.530220","194.29.146.149","194.29.146.97","TCP","66","cvsup > 39745 [ACK] Seq=35583 Ack=937 Win=129 Len=0 TSval=1219043686 TSecr=345872846"
"743","4.538747","194.29.146.149","194.29.146.97","TCP","66","cvsup > 39745 [ACK] Seq=35583 Ack=943 Win=129 Len=0 TSval=1219043694 TSecr=345872854"
"745","4.546208","194.29.146.149","194.29.146.97","TCP","66","cvsup > 39745 [ACK] Seq=35583 Ack=949 Win=129 Len=0 TSval=1219043702 TSecr=345872862"
"747","4.554795","194.29.146.149","194.29.146.97","TCP","66","cvsup > 39745 [ACK] Seq=35583 Ack=955 Win=129 Len=0 TSval=1219043710 TSecr=345872870"
"749","4.562173","194.29.146.149","194.29.146.97","TCP","66","cvsup > 39745 [ACK] Seq=35583 Ack=961 Win=129 Len=0 TSval=1219043718 TSecr=345872878"
"751","4.570745","194.29.146.149","194.29.146.97","TCP","66","cvsup > 39745 [ACK] Seq=35583 Ack=967 Win=129 Len=0 TSval=1219043726 TSecr=345872886"
"753","4.578302","194.29.146.149","194.29.146.97","TCP","66","cvsup > 39745 [ACK] Seq=35583 Ack=973 Win=129 Len=0 TSval=1219043734 TSecr=345872894"
"755","4.586816","194.29.146.149","194.29.146.97","TCP","66","cvsup > 39745 [ACK] Seq=35583 Ack=979 Win=129 Len=0 TSval=1219043742 TSecr=345872902"
"757","4.594301","194.29.146.149","194.29.146.97","TCP","66","cvsup > 39745 [ACK] Seq=35583 Ack=985 Win=129 Len=0 TSval=1219043750 TSecr=345872910"
"759","4.602690","194.29.146.149","194.29.146.97","TCP","66","cvsup > 39745 [ACK] Seq=35583 Ack=991 Win=129 Len=0 TSval=1219043758 TSecr=345872918"
"761","4.610109","194.29.146.149","194.29.146.97","TCP","66","cvsup > 39745 [ACK] Seq=35583 Ack=997 Win=129 Len=0 TSval=1219043766 TSecr=345872926"
"763","4.618391","194.29.146.149","194.29.146.97","TCP","66","cvsup > 39745 [ACK] Seq=35583 Ack=1003 Win=129 Len=0 TSval=1219043774 TSecr=345872934"
"765","4.626296","194.29.146.149","194.29.146.97","TCP","66","cvsup > 39745 [ACK] Seq=35583 Ack=1009 Win=129 Len=0 TSval=1219043782 TSecr=345872942"
"767","4.641873","194.29.146.149","194.29.146.97","TCP","1514","cvsup > 39745 [ACK] Seq=35583 Ack=1015 Win=129 Len=1448 TSval=1219043797 TSecr=345872950"
"769","4.642156","194.29.146.149","194.29.146.97","TCP","2962","cvsup > 39745 [ACK] Seq=37031 Ack=1015 Win=129 Len=2896 TSval=1219043797 TSecr=345872950"
"771","4.642371","194.29.146.149","194.29.146.97","TCP","2962","cvsup > 39745 [ACK] Seq=39927 Ack=1015 Win=129 Len=2896 TSval=1219043797 TSecr=345872950"
"773","4.642623","194.29.146.149","194.29.146.97","TCP","2962","cvsup > 39745 [ACK] Seq=42823 Ack=1015 Win=129 Len=2896 TSval=1219043797 TSecr=345872950"
"775","4.642870","194.29.146.149","194.29.146.97","TCP","2962","cvsup > 39745 [ACK] Seq=45719 Ack=1015 Win=129 Len=2896 TSval=1219043797 TSecr=345872950"
"777","4.643118","194.29.146.149","194.29.146.97","TCP","1514","cvsup > 39745 [ACK] Seq=48615 Ack=1015 Win=129 Len=1448 TSval=1219043797 TSecr=345872950"
"778","4.643123","194.29.146.149","194.29.146.97","TCP","1970","cvsup > 39745 [PSH, ACK] Seq=50063 Ack=1021 Win=129 Len=1904 TSval=1219043798 TSecr=345872958"
"779","4.644158","194.29.146.149","194.29.146.97","TCP","1514","cvsup > 39745 [ACK] Seq=51967 Ack=1021 Win=129 Len=1448 TSval=1219043800 TSecr=345872959"
"780","4.644409","194.29.146.149","194.29.146.97","TCP","2962","cvsup > 39745 [ACK] Seq=53415 Ack=1021 Win=129 Len=2896 TSval=1219043800 TSecr=345872959"
"781","4.644658","194.29.146.149","194.29.146.97","TCP","2962","cvsup > 39745 [ACK] Seq=56311 Ack=1021 Win=129 Len=2896 TSval=1219043800 TSecr=345872959"
"782","4.644907","194.29.146.149","194.29.146.97","TCP","1514","cvsup > 39745 [ACK] Seq=59207 Ack=1021 Win=129 Len=1448 TSval=1219043800 TSecr=345872959"
"784","4.647496","194.29.146.149","194.29.146.97","TCP","1514","cvsup > 39745 [ACK] Seq=60655 Ack=1021 Win=129 Len=1448 TSval=1219043803 TSecr=345872963"
"785","4.647746","194.29.146.149","194.29.146.97","TCP","3093","cvsup > 39745 [PSH, ACK] Seq=62103 Ack=1021 Win=129 Len=3027 TSval=1219043803 TSecr=345872963"
"788","4.691145","194.29.146.149","194.29.146.97","TCP","66","cvsup > 39745 [ACK] Seq=65130 Ack=1121 Win=129 Len=0 TSval=1219043847 TSecr=345872967"
"790","4.691425","194.29.146.149","194.29.146.97","TCP","66","cvsup > 39745 [ACK] Seq=65130 Ack=1151 Win=129 Len=0 TSval=1219043847 TSecr=345873007"
"792","4.698395","194.29.146.149","194.29.146.97","TCP","66","cvsup > 39745 [ACK] Seq=65130 Ack=1157 Win=129 Len=0 TSval=1219043854 TSecr=345873014"
"794","4.706010","194.29.146.149","194.29.146.97","TCP","66","cvsup > 39745 [ACK] Seq=65130 Ack=1163 Win=129 Len=0 TSval=1219043862 TSecr=345873022"
"796","4.714246","194.29.146.149","194.29.146.97","TCP","66","cvsup > 39745 [ACK] Seq=65130 Ack=1169 Win=129 Len=0 TSval=1219043870 TSecr=345873030"
"798","4.730785","194.29.146.149","194.29.146.97","TCP","66","cvsup > 39745 [ACK] Seq=65130 Ack=1175 Win=129 Len=0 TSval=1219043886 TSecr=345873046"
"803","4.738375","194.29.146.149","194.29.146.97","TCP","66","cvsup > 39745 [ACK] Seq=65130 Ack=1181 Win=129 Len=0 TSval=1219043894 TSecr=345873054"
"822","4.750732","194.29.146.149","194.29.146.97","TCP","66","cvsup > 39745 [ACK] Seq=65130 Ack=1187 Win=129 Len=0 TSval=1219043906 TSecr=345873063"
"834","4.754872","194.29.146.149","194.29.146.97","TCP","66","cvsup > 39745 [ACK] Seq=65130 Ack=1193 Win=129 Len=0 TSval=1219043911 TSecr=345873070"
"848","4.763024","194.29.146.149","194.29.146.97","TCP","66","cvsup > 39745 [ACK] Seq=65130 Ack=1199 Win=129 Len=0 TSval=1219043919 TSecr=345873078"
"858","4.770869","194.29.146.149","194.29.146.97","TCP","66","cvsup > 39745 [ACK] Seq=65130 Ack=1205 Win=129 Len=0 TSval=1219043926 TSecr=345873086"
"874","4.778253","194.29.146.149","194.29.146.97","TCP","66","cvsup > 39745 [ACK] Seq=65130 Ack=1211 Win=129 Len=0 TSval=1219043934 TSecr=345873094"
"887","4.786473","194.29.146.149","194.29.146.97","TCP","66","cvsup > 39745 [ACK] Seq=65130 Ack=1217 Win=129 Len=0 TSval=1219043942 TSecr=345873102"
"896","4.796833","194.29.146.149","194.29.146.97","TCP","66","cvsup > 39745 [ACK] Seq=65130 Ack=1223 Win=129 Len=0 TSval=1219043952 TSecr=345873110"
"898","4.802374","194.29.146.149","194.29.146.97","TCP","66","cvsup > 39745 [ACK] Seq=65130 Ack=1229 Win=129 Len=0 TSval=1219043958 TSecr=345873118"
"902","4.810861","194.29.146.149","194.29.146.97","TCP","66","cvsup > 39745 [ACK] Seq=65130 Ack=1235 Win=129 Len=0 TSval=1219043966 TSecr=345873126"
"904","4.818624","194.29.146.149","194.29.146.97","TCP","66","cvsup > 39745 [ACK] Seq=65130 Ack=1241 Win=129 Len=0 TSval=1219043974 TSecr=345873134"
"906","4.826503","194.29.146.149","194.29.146.97","TCP","66","cvsup > 39745 [ACK] Seq=65130 Ack=1247 Win=129 Len=0 TSval=1219043982 TSecr=345873142"
"908","4.834265","194.29.146.149","194.29.146.97","TCP","66","cvsup > 39745 [ACK] Seq=65130 Ack=1253 Win=129 Len=0 TSval=1219043990 TSecr=345873150"
"910","4.842011","194.29.146.149","194.29.146.97","TCP","66","cvsup > 39745 [ACK] Seq=65130 Ack=1259 Win=129 Len=0 TSval=1219043998 TSecr=345873158"
"913","4.849988","194.29.146.149","194.29.146.97","TCP","66","cvsup > 39745 [ACK] Seq=65130 Ack=1265 Win=129 Len=0 TSval=1219044006 TSecr=345873166"
"915","4.858003","194.29.146.149","194.29.146.97","TCP","66","cvsup > 39745 [ACK] Seq=65130 Ack=1271 Win=129 Len=0 TSval=1219044014 TSecr=345873174"
"917","4.866723","194.29.146.149","194.29.146.97","TCP","66","cvsup > 39745 [ACK] Seq=65130 Ack=1277 Win=129 Len=0 TSval=1219044022 TSecr=345873182"
"919","4.874061","194.29.146.149","194.29.146.97","TCP","66","cvsup > 39745 [ACK] Seq=65130 Ack=1283 Win=129 Len=0 TSval=1219044030 TSecr=345873190"
"921","4.882401","194.29.146.149","194.29.146.97","TCP","66","cvsup > 39745 [ACK] Seq=65130 Ack=1289 Win=129 Len=0 TSval=1219044038 TSecr=345873198"
"923","4.890127","194.29.146.149","194.29.146.97","TCP","66","cvsup > 39745 [ACK] Seq=65130 Ack=1295 Win=129 Len=0 TSval=1219044046 TSecr=345873206"
"925","4.904377","194.29.146.149","194.29.146.97","TCP","1514","cvsup > 39745 [ACK] Seq=65130 Ack=1301 Win=129 Len=1448 TSval=1219044060 TSecr=345873214"
"926","4.904628","194.29.146.149","194.29.146.97","TCP","2962","cvsup > 39745 [ACK] Seq=66578 Ack=1301 Win=129 Len=2896 TSval=1219044060 TSecr=345873214"
"927","4.904859","194.29.146.149","194.29.146.97","TCP","2962","cvsup > 39745 [ACK] Seq=69474 Ack=1301 Win=129 Len=2896 TSval=1219044060 TSecr=345873214"
"928","4.905101","194.29.146.149","194.29.146.97","TCP","2962","cvsup > 39745 [ACK] Seq=72370 Ack=1301 Win=129 Len=2896 TSval=1219044060 TSecr=345873214"
"930","4.905355","194.29.146.149","194.29.146.97","TCP","2962","cvsup > 39745 [ACK] Seq=75266 Ack=1301 Win=129 Len=2896 TSval=1219044060 TSecr=345873214"
"932","4.905602","194.29.146.149","194.29.146.97","TCP","1514","cvsup > 39745 [ACK] Seq=78162 Ack=1301 Win=129 Len=1448 TSval=1219044060 TSecr=345873214"
"933","4.906063","194.29.146.149","194.29.146.97","TCP","1970","cvsup > 39745 [PSH, ACK] Seq=79610 Ack=1301 Win=129 Len=1904 TSval=1219044061 TSecr=345873221"
"935","4.907383","194.29.146.149","194.29.146.97","TCP","1514","cvsup > 39745 [ACK] Seq=81514 Ack=1301 Win=129 Len=1448 TSval=1219044063 TSecr=345873221"
"936","4.907648","194.29.146.149","194.29.146.97","TCP","4410","cvsup > 39745 [ACK] Seq=82962 Ack=1301 Win=129 Len=4344 TSval=1219044063 TSecr=345873221"
"937","4.907883","194.29.146.149","194.29.146.97","TCP","2962","cvsup > 39745 [ACK] Seq=87306 Ack=1301 Win=129 Len=2896 TSval=1219044063 TSecr=345873223"
"938","4.908132","194.29.146.149","194.29.146.97","RELOAD Frame","2962","ACK"
"940","4.908895","194.29.146.149","194.29.146.97","TCP","1514","cvsup > 39745 [ACK] Seq=93098 Ack=1301 Win=129 Len=1448 TSval=1219044064 TSecr=345873224"
"941","4.909144","194.29.146.149","194.29.146.97","TCP","1847","cvsup > 39745 [PSH, ACK] Seq=94546 Ack=1301 Win=129 Len=1781 TSval=1219044064 TSecr=345873224"
"944","4.952156","194.29.146.149","194.29.146.97","TCP","66","cvsup > 39745 [ACK] Seq=96327 Ack=1427 Win=129 Len=0 TSval=1219044108 TSecr=345873228"
"946","4.953093","194.29.146.149","194.29.146.97","TCP","66","cvsup > 39745 [ACK] Seq=96327 Ack=1457 Win=129 Len=0 TSval=1219044109 TSecr=345873268"
"948","4.954445","194.29.146.149","194.29.146.97","TCP","66","cvsup > 39745 [ACK] Seq=96327 Ack=1463 Win=129 Len=0 TSval=1219044110 TSecr=345873270"
"950","4.962588","194.29.146.149","194.29.146.97","TCP","66","cvsup > 39745 [ACK] Seq=96327 Ack=1469 Win=129 Len=0 TSval=1219044118 TSecr=345873278"
"952","4.970015","194.29.146.149","194.29.146.97","TCP","66","cvsup > 39745 [ACK] Seq=96327 Ack=1475 Win=129 Len=0 TSval=1219044126 TSecr=345873286"
"954","4.978961","194.29.146.149","194.29.146.97","TCP","66","cvsup > 39745 [ACK] Seq=96327 Ack=1481 Win=129 Len=0 TSval=1219044135 TSecr=345873294"
"956","4.986602","194.29.146.149","194.29.146.97","TCP","66","cvsup > 39745 [ACK] Seq=96327 Ack=1487 Win=129 Len=0 TSval=1219044142 TSecr=345873302"
"958","4.994287","194.29.146.149","194.29.146.97","TCP","66","cvsup > 39745 [ACK] Seq=96327 Ack=1493 Win=129 Len=0 TSval=1219044150 TSecr=345873310"
"960","5.002278","194.29.146.149","194.29.146.97","TCP","66","cvsup > 39745 [ACK] Seq=96327 Ack=1499 Win=129 Len=0 TSval=1219044158 TSecr=345873318"
"962","5.010899","194.29.146.149","194.29.146.97","TCP","66","cvsup > 39745 [ACK] Seq=96327 Ack=1505 Win=129 Len=0 TSval=1219044167 TSecr=345873326"
"964","5.018308","194.29.146.149","194.29.146.97","TCP","66","cvsup > 39745 [ACK] Seq=96327 Ack=1511 Win=129 Len=0 TSval=1219044174 TSecr=345873334"
"966","5.026972","194.29.146.149","194.29.146.97","TCP","66","cvsup > 39745 [ACK] Seq=96327 Ack=1517 Win=129 Len=0 TSval=1219044183 TSecr=345873342"
"968","5.034113","194.29.146.149","194.29.146.97","TCP","66","cvsup > 39745 [ACK] Seq=96327 Ack=1523 Win=129 Len=0 TSval=1219044190 TSecr=345873350"
"970","5.042824","194.29.146.149","194.29.146.97","TCP","66","cvsup > 39745 [ACK] Seq=96327 Ack=1529 Win=129 Len=0 TSval=1219044198 TSecr=345873358"
"972","5.050496","194.29.146.149","194.29.146.97","TCP","66","cvsup > 39745 [ACK] Seq=96327 Ack=1535 Win=129 Len=0 TSval=1219044206 TSecr=345873366"
"974","5.057925","194.29.146.149","194.29.146.97","TCP","66","cvsup > 39745 [ACK] Seq=96327 Ack=1541 Win=129 Len=0 TSval=1219044214 TSecr=345873374"
"976","5.066451","194.29.146.149","194.29.146.97","TCP","66","cvsup > 39745 [ACK] Seq=96327 Ack=1547 Win=129 Len=0 TSval=1219044222 TSecr=345873382"
"978","5.073978","194.29.146.149","194.29.146.97","TCP","66","cvsup > 39745 [ACK] Seq=96327 Ack=1553 Win=129 Len=0 TSval=1219044230 TSecr=345873390"
"980","5.082576","194.29.146.149","194.29.146.97","TCP","66","cvsup > 39745 [ACK] Seq=96327 Ack=1559 Win=129 Len=0 TSval=1219044238 TSecr=345873398"
"982","5.091197","194.29.146.149","194.29.146.97","TCP","66","cvsup > 39745 [ACK] Seq=96327 Ack=1565 Win=129 Len=0 TSval=1219044247 TSecr=345873406"
"984","5.098629","194.29.146.149","194.29.146.97","TCP","66","cvsup > 39745 [ACK] Seq=96327 Ack=1571 Win=129 Len=0 TSval=1219044254 TSecr=345873414"
"986","5.105921","194.29.146.149","194.29.146.97","TCP","66","cvsup > 39745 [ACK] Seq=96327 Ack=1577 Win=129 Len=0 TSval=1219044262 TSecr=345873422"
"988","5.114493","194.29.146.149","194.29.146.97","TCP","66","cvsup > 39745 [ACK] Seq=96327 Ack=1583 Win=129 Len=0 TSval=1219044270 TSecr=345873430"
"990","5.123139","194.29.146.149","194.29.146.97","TCP","66","cvsup > 39745 [ACK] Seq=96327 Ack=1589 Win=129 Len=0 TSval=1219044279 TSecr=345873438"
"992","5.130483","194.29.146.149","194.29.146.97","TCP","66","cvsup > 39745 [ACK] Seq=96327 Ack=1595 Win=129 Len=0 TSval=1219044286 TSecr=345873446"
"994","5.138578","194.29.146.149","194.29.146.97","TCP","66","cvsup > 39745 [ACK] Seq=96327 Ack=1601 Win=129 Len=0 TSval=1219044294 TSecr=345873454"
"996","5.146729","194.29.146.149","194.29.146.97","TCP","66","cvsup > 39745 [ACK] Seq=96327 Ack=1607 Win=129 Len=0 TSval=1219044302 TSecr=345873462"
"998","5.156009","194.29.146.149","194.29.146.97","TCP","2962","cvsup > 39745 [ACK] Seq=96327 Ack=1613 Win=129 Len=2896 TSval=1219044311 TSecr=345873470"
"1000","5.156254","194.29.146.149","194.29.146.97","TCP","2962","cvsup > 39745 [ACK] Seq=99223 Ack=1613 Win=129 Len=2896 TSval=1219044311 TSecr=345873470"
"1001","5.156502","194.29.146.149","194.29.146.97","TCP","2962","cvsup > 39745 [ACK] Seq=102119 Ack=1613 Win=129 Len=2896 TSval=1219044311 TSecr=345873470"
"1002","5.156739","194.29.146.149","194.29.146.97","TCP","2962","cvsup > 39745 [ACK] Seq=105015 Ack=1613 Win=129 Len=2896 TSval=1219044311 TSecr=345873470"
"1004","5.156977","194.29.146.149","194.29.146.97","TCP","1514","cvsup > 39745 [ACK] Seq=107911 Ack=1613 Win=129 Len=1448 TSval=1219044311 TSecr=345873470"
"1005","5.157648","194.29.146.149","194.29.146.97","TCP","2962","cvsup > 39745 [ACK] Seq=109359 Ack=1613 Win=129 Len=2896 TSval=1219044313 TSecr=345873473"
"1006","5.157882","194.29.146.149","194.29.146.97","TCP","522","cvsup > 39745 [PSH, ACK] Seq=112255 Ack=1613 Win=129 Len=456 TSval=1219044313 TSecr=345873473"
"1008","5.159612","194.29.146.149","194.29.146.97","TCP","1514","cvsup > 39745 [ACK] Seq=112711 Ack=1613 Win=129 Len=1448 TSval=1219044315 TSecr=345873474"
"1009","5.159864","194.29.146.149","194.29.146.97","TCP","2962","cvsup > 39745 [ACK] Seq=114159 Ack=1613 Win=129 Len=2896 TSval=1219044315 TSecr=345873474"
"1011","5.160112","194.29.146.149","194.29.146.97","TCP","4410","cvsup > 39745 [ACK] Seq=117055 Ack=1613 Win=129 Len=4344 TSval=1219044315 TSecr=345873474"
"1012","5.160360","194.29.146.149","194.29.146.97","TCP","1514","cvsup > 39745 [ACK] Seq=121399 Ack=1613 Win=129 Len=1448 TSval=1219044315 TSecr=345873474"
"1013","5.160610","194.29.146.149","194.29.146.97","TCP","2962","cvsup > 39745 [ACK] Seq=122847 Ack=1613 Win=129 Len=2896 TSval=1219044316 TSecr=345873476"
"1014","5.160860","194.29.146.149","194.29.146.97","TCP","2095","cvsup > 39745 [PSH, ACK] Seq=125743 Ack=1613 Win=129 Len=2029 TSval=1219044316 TSecr=345873476"
"1017","5.204011","194.29.146.149","194.29.146.97","TCP","66","cvsup > 39745 [ACK] Seq=127772 Ack=1739 Win=129 Len=0 TSval=1219044360 TSecr=345873480"
"1019","5.204977","194.29.146.149","194.29.146.97","TCP","66","cvsup > 39745 [ACK] Seq=127772 Ack=1769 Win=129 Len=0 TSval=1219044361 TSecr=345873520"
"1021","5.211050","194.29.146.149","194.29.146.97","TCP","66","cvsup > 39745 [ACK] Seq=127772 Ack=1775 Win=129 Len=0 TSval=1219044366 TSecr=345873526"
"1023","5.218561","194.29.146.149","194.29.146.97","TCP","66","cvsup > 39745 [ACK] Seq=127772 Ack=1781 Win=129 Len=0 TSval=1219044374 TSecr=345873534"
"1025","5.225980","194.29.146.149","194.29.146.97","TCP","66","cvsup > 39745 [ACK] Seq=127772 Ack=1787 Win=129 Len=0 TSval=1219044382 TSecr=345873542"
"1027","5.233986","194.29.146.149","194.29.146.97","TCP","66","cvsup > 39745 [ACK] Seq=127772 Ack=1793 Win=129 Len=0 TSval=1219044390 TSecr=345873550"
"1029","5.242221","194.29.146.149","194.29.146.97","TCP","66","cvsup > 39745 [ACK] Seq=127772 Ack=1799 Win=129 Len=0 TSval=1219044398 TSecr=345873558"
"1031","5.250775","194.29.146.149","194.29.146.97","TCP","66","cvsup > 39745 [ACK] Seq=127772 Ack=1805 Win=129 Len=0 TSval=1219044406 TSecr=345873566"
"1033","5.258592","194.29.146.149","194.29.146.97","TCP","66","cvsup > 39745 [ACK] Seq=127772 Ack=1811 Win=129 Len=0 TSval=1219044414 TSecr=345873574"
"1035","5.273142","194.29.146.149","194.29.146.97","TCP","66","cvsup > 39745 [ACK] Seq=127772 Ack=1817 Win=129 Len=0 TSval=1219044429 TSecr=345873589"
"1037","5.274520","194.29.146.149","194.29.146.97","TCP","66","cvsup > 39745 [ACK] Seq=127772 Ack=1823 Win=129 Len=0 TSval=1219044430 TSecr=345873590"
"1039","5.282976","194.29.146.149","194.29.146.97","TCP","66","cvsup > 39745 [ACK] Seq=127772 Ack=1829 Win=129 Len=0 TSval=1219044438 TSecr=345873598"
"1041","5.290806","194.29.146.149","194.29.146.97","TCP","66","cvsup > 39745 [ACK] Seq=127772 Ack=1835 Win=129 Len=0 TSval=1219044446 TSecr=345873606"
"1043","5.298819","194.29.146.149","194.29.146.97","TCP","66","cvsup > 39745 [ACK] Seq=127772 Ack=1841 Win=129 Len=0 TSval=1219044454 TSecr=345873614"
"1045","5.307042","194.29.146.149","194.29.146.97","TCP","66","cvsup > 39745 [ACK] Seq=127772 Ack=1847 Win=129 Len=0 TSval=1219044462 TSecr=345873622"
"1047","5.314300","194.29.146.149","194.29.146.97","TCP","66","cvsup > 39745 [ACK] Seq=127772 Ack=1853 Win=129 Len=0 TSval=1219044470 TSecr=345873630"
"1049","5.322033","194.29.146.149","194.29.146.97","TCP","66","cvsup > 39745 [ACK] Seq=127772 Ack=1859 Win=129 Len=0 TSval=1219044478 TSecr=345873638"
"1051","5.332160","194.29.146.149","194.29.146.97","TCP","66","cvsup > 39745 [ACK] Seq=127772 Ack=1865 Win=129 Len=0 TSval=1219044488 TSecr=345873646"
"1053","5.338509","194.29.146.149","194.29.146.97","TCP","66","cvsup > 39745 [ACK] Seq=127772 Ack=1871 Win=129 Len=0 TSval=1219044494 TSecr=345873654"
"1055","5.346450","194.29.146.149","194.29.146.97","TCP","66","cvsup > 39745 [ACK] Seq=127772 Ack=1877 Win=129 Len=0 TSval=1219044502 TSecr=345873662"
"1057","5.353984","194.29.146.149","194.29.146.97","TCP","66","cvsup > 39745 [ACK] Seq=127772 Ack=1883 Win=129 Len=0 TSval=1219044509 TSecr=345873670"
"1059","5.361963","194.29.146.149","194.29.146.97","TCP","66","cvsup > 39745 [ACK] Seq=127772 Ack=1889 Win=129 Len=0 TSval=1219044517 TSecr=345873678"
"1061","5.370952","194.29.146.149","194.29.146.97","TCP","66","cvsup > 39745 [ACK] Seq=127772 Ack=1895 Win=129 Len=0 TSval=1219044526 TSecr=345873686"
"1063","5.379222","194.29.146.149","194.29.146.97","TCP","66","cvsup > 39745 [ACK] Seq=127772 Ack=1901 Win=129 Len=0 TSval=1219044534 TSecr=345873694"
"1065","5.387080","194.29.146.149","194.29.146.97","TCP","66","cvsup > 39745 [ACK] Seq=127772 Ack=1907 Win=129 Len=0 TSval=1219044542 TSecr=345873702"
"1067","5.397338","194.29.146.149","194.29.146.97","TCP","66","cvsup > 39745 [ACK] Seq=127772 Ack=1913 Win=129 Len=0 TSval=1219044553 TSecr=345873710"
"1069","5.407458","194.29.146.149","194.29.146.97","TCP","1514","cvsup > 39745 [ACK] Seq=127772 Ack=1919 Win=129 Len=1448 TSval=1219044563 TSecr=345873718"
"1070","5.407707","194.29.146.149","194.29.146.97","TCP","2962","cvsup > 39745 [ACK] Seq=129220 Ack=1919 Win=129 Len=2896 TSval=1219044563 TSecr=345873718"
"1072","5.407957","194.29.146.149","194.29.146.97","TCP","2962","cvsup > 39745 [ACK] Seq=132116 Ack=1919 Win=129 Len=2896 TSval=1219044563 TSecr=345873718"
"1073","5.408230","194.29.146.149","194.29.146.97","TCP","4410","cvsup > 39745 [ACK] Seq=135012 Ack=1919 Win=129 Len=4344 TSval=1219044563 TSecr=345873718"
"1074","5.408456","194.29.146.149","194.29.146.97","TCP","1514","cvsup > 39745 [ACK] Seq=139356 Ack=1919 Win=129 Len=1448 TSval=1219044563 TSecr=345873718"
"1076","5.409134","194.29.146.149","194.29.146.97","TCP","1514","cvsup > 39745 [ACK] Seq=140804 Ack=1919 Win=129 Len=1448 TSval=1219044565 TSecr=345873724"
"1077","5.409384","194.29.146.149","194.29.146.97","TCP","1970","cvsup > 39745 [PSH, ACK] Seq=142252 Ack=1919 Win=129 Len=1904 TSval=1219044565 TSecr=345873724"
"1079","5.410714","194.29.146.149","194.29.146.97","TCP","1514","cvsup > 39745 [ACK] Seq=144156 Ack=1919 Win=129 Len=1448 TSval=1219044566 TSecr=345873725"
"1080","5.410965","194.29.146.149","194.29.146.97","TCP","2962","cvsup > 39745 [ACK] Seq=145604 Ack=1919 Win=129 Len=2896 TSval=1219044566 TSecr=345873725"
"1082","5.411216","194.29.146.149","194.29.146.97","TCP","4410","cvsup > 39745 [ACK] Seq=148500 Ack=1919 Win=129 Len=4344 TSval=1219044566 TSecr=345873725"
"1083","5.411464","194.29.146.149","194.29.146.97","TCP","1514","cvsup > 39745 [ACK] Seq=152844 Ack=1919 Win=129 Len=1448 TSval=1219044566 TSecr=345873725"
"1084","5.411898","194.29.146.149","194.29.146.97","TCP","1514","cvsup > 39745 [ACK] Seq=154292 Ack=1919 Win=129 Len=1448 TSval=1219044567 TSecr=345873727"
"1085","5.412149","194.29.146.149","194.29.146.97","TCP","2962","cvsup > 39745 [ACK] Seq=155740 Ack=1919 Win=129 Len=2896 TSval=1219044567 TSecr=345873727"
