"No.","Time","Source","Destination","Protocol","Length","Info"
"345","2.335782","194.29.146.149","194.29.146.97","TCP","66","cvsup > 39746 [ACK] Seq=1 Ack=7 Win=62 Len=0 TSval=1219439699 TSecr=346268869"
"348","2.343751","194.29.146.149","194.29.146.97","TCP","66","cvsup > 39746 [ACK] Seq=1 Ack=13 Win=62 Len=0 TSval=1219439707 TSecr=346268877"
"352","2.347020","194.29.146.149","194.29.146.97","TCP","122","cvsup > 39746 [PSH, ACK] Seq=1 Ack=13 Win=62 Len=56 TSval=1219439710 TSecr=346268877"
"354","2.385159","194.29.146.149","194.29.146.97","TCP","168","cvsup > 39746 [PSH, ACK] Seq=57 Ack=23 Win=62 Len=102 TSval=1219439749 TSecr=346268880"
"356","2.425330","194.29.146.149","194.29.146.97","TCP","66","cvsup > 39746 [ACK] Seq=159 Ack=53 Win=62 Len=0 TSval=1219439789 TSecr=346268918"
"358","2.425610","194.29.146.149","194.29.146.97","TCP","66","cvsup > 39746 [ACK] Seq=159 Ack=93 Win=62 Len=0 TSval=1219439789 TSecr=346268958"
"359","2.431619","194.29.146.149","194.29.146.97","TCP","2523","cvsup > 39746 [PSH, ACK] Seq=159 Ack=93 Win=62 Len=2457 TSval=1219439795 TSecr=346268958"
"361","2.472337","194.29.146.149","194.29.146.97","TCP","66","cvsup > 39746 [ACK] Seq=2616 Ack=99 Win=62 Len=0 TSval=1219439836 TSecr=346268965"
"363","2.474681","194.29.146.149","194.29.146.97","TCP","66","cvsup > 39746 [ACK] Seq=2616 Ack=139 Win=62 Len=0 TSval=1219439838 TSecr=346269005"
"365","2.481485","194.29.146.149","194.29.146.97","TCP","66","cvsup > 39746 [ACK] Seq=2616 Ack=145 Win=62 Len=0 TSval=1219439845 TSecr=346269013"
"367","2.488814","194.29.146.149","194.29.146.97","TCP","66","cvsup > 39746 [ACK] Seq=2616 Ack=151 Win=62 Len=0 TSval=1219439852 TSecr=346269021"
"368","2.537381","194.29.146.149","194.29.146.97","TCP","2962","cvsup > 39746 [ACK] Seq=2616 Ack=151 Win=62 Len=2896 TSval=1219439900 TSecr=346269021"
"370","2.537625","194.29.146.149","194.29.146.97","TCP","1789","cvsup > 39746 [PSH, ACK] Seq=5512 Ack=151 Win=62 Len=1723 TSval=1219439900 TSecr=346269021"
"373","2.538650","194.29.146.149","194.29.146.97","TCP","66","cvsup > 39746 [ACK] Seq=7235 Ack=171 Win=62 Len=0 TSval=1219439902 TSecr=346269071"
"375","2.680164","194.29.146.149","194.29.146.97","TCP","66","cvsup > 39746 [ACK] Seq=7235 Ack=177 Win=62 Len=0 TSval=1219440044 TSecr=346269213"
"377","2.689293","194.29.146.149","194.29.146.97","TCP","66","cvsup > 39746 [ACK] Seq=7235 Ack=183 Win=62 Len=0 TSval=1219440053 TSecr=346269221"
"379","2.696929","194.29.146.149","194.29.146.97","TCP","66","cvsup > 39746 [ACK] Seq=7235 Ack=189 Win=62 Len=0 TSval=1219440060 TSecr=346269229"
"381","2.704009","194.29.146.149","194.29.146.97","TCP","66","cvsup > 39746 [ACK] Seq=7235 Ack=195 Win=62 Len=0 TSval=1219440068 TSecr=346269237"
"383","2.711977","194.29.146.149","194.29.146.97","TCP","66","cvsup > 39746 [ACK] Seq=7235 Ack=201 Win=62 Len=0 TSval=1219440076 TSecr=346269245"
"385","2.720078","194.29.146.149","194.29.146.97","TCP","66","cvsup > 39746 [ACK] Seq=7235 Ack=207 Win=62 Len=0 TSval=1219440084 TSecr=346269253"
"387","2.728007","194.29.146.149","194.29.146.97","TCP","66","cvsup > 39746 [ACK] Seq=7235 Ack=213 Win=62 Len=0 TSval=1219440092 TSecr=346269261"
"389","2.738287","194.29.146.149","194.29.146.97","TCP","66","cvsup > 39746 [ACK] Seq=7235 Ack=219 Win=62 Len=0 TSval=1219440102 TSecr=346269269"
"391","2.745569","194.29.146.149","194.29.146.97","TCP","66","cvsup > 39746 [ACK] Seq=7235 Ack=225 Win=62 Len=0 TSval=1219440109 TSecr=346269277"
"393","2.752778","194.29.146.149","194.29.146.97","TCP","66","cvsup > 39746 [ACK] Seq=7235 Ack=231 Win=62 Len=0 TSval=1219440116 TSecr=346269285"
"395","2.760351","194.29.146.149","194.29.146.97","TCP","66","cvsup > 39746 [ACK] Seq=7235 Ack=237 Win=62 Len=0 TSval=1219440124 TSecr=346269293"
"397","2.767801","194.29.146.149","194.29.146.97","TCP","66","cvsup > 39746 [ACK] Seq=7235 Ack=243 Win=62 Len=0 TSval=1219440131 TSecr=346269301"
"399","2.776117","194.29.146.149","194.29.146.97","TCP","66","cvsup > 39746 [ACK] Seq=7235 Ack=249 Win=62 Len=0 TSval=1219440140 TSecr=346269309"
"401","2.786010","194.29.146.149","194.29.146.97","TCP","66","cvsup > 39746 [ACK] Seq=7235 Ack=255 Win=62 Len=0 TSval=1219440149 TSecr=346269317"
"402","2.790839","194.29.146.149","194.29.146.97","TCP","122","cvsup > 39746 [PSH, ACK] Seq=7235 Ack=255 Win=62 Len=56 TSval=1219440154 TSecr=346269317"
"404","2.816170","194.29.146.149","194.29.146.97","TCP","2473","cvsup > 39746 [PSH, ACK] Seq=7291 Ack=265 Win=62 Len=2407 TSval=1219440179 TSecr=346269324"
"406","2.856211","194.29.146.149","194.29.146.97","TCP","66","cvsup > 39746 [ACK] Seq=9698 Ack=271 Win=62 Len=0 TSval=1219440220 TSecr=346269349"
"408","2.857436","194.29.146.149","194.29.146.97","TCP","66","cvsup > 39746 [ACK] Seq=9698 Ack=291 Win=62 Len=0 TSval=1219440221 TSecr=346269389"
"409","2.858543","194.29.146.149","194.29.146.97","TCP","2620","cvsup > 39746 [PSH, ACK] Seq=9698 Ack=291 Win=62 Len=2554 TSval=1219440222 TSecr=346269389"
"412","2.899228","194.29.146.149","194.29.146.97","TCP","66","cvsup > 39746 [ACK] Seq=12252 Ack=301 Win=62 Len=0 TSval=1219440263 TSecr=346269392"
"414","2.921955","194.29.146.149","194.29.146.97","TCP","66","cvsup > 39746 [ACK] Seq=12252 Ack=307 Win=62 Len=0 TSval=1219440286 TSecr=346269455"
"417","2.967421","194.29.146.149","194.29.146.97","TCP","437","cvsup > 39746 [PSH, ACK] Seq=12252 Ack=307 Win=62 Len=371 TSval=1219440331 TSecr=346269455"
"419","2.968436","194.29.146.149","194.29.146.97","TCP","66","cvsup > 39746 [ACK] Seq=12623 Ack=327 Win=62 Len=0 TSval=1219440332 TSecr=346269501"
"466","3.033980","194.29.146.149","194.29.146.97","TCP","66","cvsup > 39746 [ACK] Seq=12623 Ack=333 Win=62 Len=0 TSval=1219440397 TSecr=346269565"
"508","3.248485","194.29.146.149","194.29.146.97","TCP","1444","cvsup > 39746 [PSH, ACK] Seq=12623 Ack=333 Win=62 Len=1378 TSval=1219440611 TSecr=346269565"
"510","3.249473","194.29.146.149","194.29.146.97","TCP","66","cvsup > 39746 [ACK] Seq=14001 Ack=353 Win=62 Len=0 TSval=1219440613 TSecr=346269782"
"524","3.377558","194.29.146.149","194.29.146.97","TCP","167","cvsup > 39746 [PSH, ACK] Seq=14001 Ack=353 Win=62 Len=101 TSval=1219440741 TSecr=346269782"
"526","3.379493","194.29.146.149","194.29.146.97","TCP","66","cvsup > 39746 [ACK] Seq=14102 Ack=363 Win=62 Len=0 TSval=1219440743 TSecr=346269912"
"528","3.540215","194.29.146.149","194.29.146.97","TCP","66","cvsup > 39746 [ACK] Seq=14102 Ack=371 Win=62 Len=0 TSval=1219440904 TSecr=346270073"
"529","3.651857","194.29.146.149","194.29.146.97","TCP","1514","cvsup > 39746 [ACK] Seq=14102 Ack=371 Win=62 Len=1448 TSval=1219441015 TSecr=346270073"
"530","3.652098","194.29.146.149","194.29.146.97","TCP","2962","cvsup > 39746 [ACK] Seq=15550 Ack=371 Win=62 Len=2896 TSval=1219441015 TSecr=346270073"
"532","3.652330","194.29.146.149","194.29.146.97","TCP","2962","cvsup > 39746 [ACK] Seq=18446 Ack=371 Win=62 Len=2896 TSval=1219441015 TSecr=346270073"
"534","3.652639","194.29.146.149","194.29.146.97","TCP","524","cvsup > 39746 [PSH, ACK] Seq=21342 Ack=371 Win=62 Len=458 TSval=1219441016 TSecr=346270185"
"536","3.653323","194.29.146.149","194.29.146.97","TCP","66","cvsup > 39746 [ACK] Seq=21800 Ack=401 Win=62 Len=0 TSval=1219441017 TSecr=346270186"
"538","3.667901","194.29.146.149","194.29.146.97","TCP","66","cvsup > 39746 [ACK] Seq=21800 Ack=409 Win=62 Len=0 TSval=1219441032 TSecr=346270201"
"541","3.785238","194.29.146.149","194.29.146.97","TCP","514","cvsup > 39746 [PSH, ACK] Seq=21800 Ack=409 Win=62 Len=448 TSval=1219441148 TSecr=346270201"
"543","3.785728","194.29.146.149","194.29.146.97","TCP","66","cvsup > 39746 [ACK] Seq=22248 Ack=419 Win=62 Len=0 TSval=1219441149 TSecr=346270319"
"609","4.048079","194.29.146.149","194.29.146.97","TCP","66","cvsup > 39746 [ACK] Seq=22248 Ack=425 Win=62 Len=0 TSval=1219441411 TSecr=346270581"
"619","4.055966","194.29.146.149","194.29.146.97","TCP","66","cvsup > 39746 [ACK] Seq=22248 Ack=431 Win=62 Len=0 TSval=1219441420 TSecr=346270589"
"630","4.063943","194.29.146.149","194.29.146.97","TCP","66","cvsup > 39746 [ACK] Seq=22248 Ack=437 Win=62 Len=0 TSval=1219441428 TSecr=346270597"
"633","4.069317","194.29.146.149","194.29.146.97","TCP","1514","cvsup > 39746 [ACK] Seq=22248 Ack=437 Win=62 Len=1448 TSval=1219441432 TSecr=346270597"
"634","4.069563","194.29.146.149","194.29.146.97","RELOAD Frame","1514","ACK"
"636","4.069576","194.29.146.149","194.29.146.97","TCP","980","cvsup > 39746 [PSH, ACK] Seq=25144 Ack=437 Win=62 Len=914 TSval=1219441433 TSecr=346270597"
"640","4.074547","194.29.146.149","194.29.146.97","TCP","168","cvsup > 39746 [PSH, ACK] Seq=26058 Ack=583 Win=71 Len=102 TSval=1219441438 TSecr=346270607"
"642","4.091846","194.29.146.149","194.29.146.97","TCP","2358","cvsup > 39746 [PSH, ACK] Seq=26160 Ack=593 Win=71 Len=2292 TSval=1219441455 TSecr=346270609"
"645","4.131325","194.29.146.149","194.29.146.97","TCP","66","cvsup > 39746 [ACK] Seq=28452 Ack=605 Win=71 Len=0 TSval=1219441495 TSecr=346270625"
"647","4.131858","194.29.146.149","194.29.146.97","TCP","66","cvsup > 39746 [ACK] Seq=28452 Ack=645 Win=71 Len=0 TSval=1219441495 TSecr=346270664"
"648","4.132445","194.29.146.149","194.29.146.97","TCP","1823","cvsup > 39746 [PSH, ACK] Seq=28452 Ack=645 Win=71 Len=1757 TSval=1219441496 TSecr=346270664"
"652","4.173441","194.29.146.149","194.29.146.97","TCP","66","cvsup > 39746 [ACK] Seq=30209 Ack=655 Win=71 Len=0 TSval=1219441537 TSecr=346270666"
"654","4.173737","194.29.146.149","194.29.146.97","TCP","66","cvsup > 39746 [ACK] Seq=30209 Ack=685 Win=71 Len=0 TSval=1219441537 TSecr=346270707"
"656","4.175974","194.29.146.149","194.29.146.97","TCP","66","cvsup > 39746 [ACK] Seq=30209 Ack=691 Win=71 Len=0 TSval=1219441540 TSecr=346270709"
"658","4.183965","194.29.146.149","194.29.146.97","TCP","66","cvsup > 39746 [ACK] Seq=30209 Ack=697 Win=71 Len=0 TSval=1219441548 TSecr=346270717"
"660","4.191930","194.29.146.149","194.29.146.97","TCP","66","cvsup > 39746 [ACK] Seq=30209 Ack=703 Win=71 Len=0 TSval=1219441556 TSecr=346270725"
"662","4.199953","194.29.146.149","194.29.146.97","TCP","66","cvsup > 39746 [ACK] Seq=30209 Ack=709 Win=71 Len=0 TSval=1219441564 TSecr=346270733"
"664","4.207954","194.29.146.149","194.29.146.97","TCP","66","cvsup > 39746 [ACK] Seq=30209 Ack=715 Win=71 Len=0 TSval=1219441572 TSecr=346270741"
"666","4.216186","194.29.146.149","194.29.146.97","TCP","66","cvsup > 39746 [ACK] Seq=30209 Ack=721 Win=71 Len=0 TSval=1219441580 TSecr=346270749"
"668","4.223951","194.29.146.149","194.29.146.97","TCP","66","cvsup > 39746 [ACK] Seq=30209 Ack=727 Win=71 Len=0 TSval=1219441588 TSecr=346270757"
"670","4.231996","194.29.146.149","194.29.146.97","TCP","66","cvsup > 39746 [ACK] Seq=30209 Ack=733 Win=71 Len=0 TSval=1219441596 TSecr=346270765"
"673","4.239929","194.29.146.149","194.29.146.97","TCP","66","cvsup > 39746 [ACK] Seq=30209 Ack=739 Win=71 Len=0 TSval=1219441604 TSecr=346270773"
"675","4.247999","194.29.146.149","194.29.146.97","TCP","66","cvsup > 39746 [ACK] Seq=30209 Ack=745 Win=71 Len=0 TSval=1219441612 TSecr=346270781"
"677","4.255996","194.29.146.149","194.29.146.97","TCP","66","cvsup > 39746 [ACK] Seq=30209 Ack=751 Win=71 Len=0 TSval=1219441620 TSecr=346270789"
"679","4.264043","194.29.146.149","194.29.146.97","TCP","66","cvsup > 39746 [ACK] Seq=30209 Ack=757 Win=71 Len=0 TSval=1219441628 TSecr=346270797"
"681","4.272086","194.29.146.149","194.29.146.97","TCP","66","cvsup > 39746 [ACK] Seq=30209 Ack=763 Win=71 Len=0 TSval=1219441636 TSecr=346270805"
"683","4.280025","194.29.146.149","194.29.146.97","TCP","66","cvsup > 39746 [ACK] Seq=30209 Ack=769 Win=71 Len=0 TSval=1219441644 TSecr=346270813"
"685","4.287985","194.29.146.149","194.29.146.97","TCP","66","cvsup > 39746 [ACK] Seq=30209 Ack=775 Win=71 Len=0 TSval=1219441652 TSecr=346270821"
"687","4.295963","194.29.146.149","194.29.146.97","TCP","66","cvsup > 39746 [ACK] Seq=30209 Ack=781 Win=71 Len=0 TSval=1219441660 TSecr=346270829"
"689","4.304056","194.29.146.149","194.29.146.97","TCP","66","cvsup > 39746 [ACK] Seq=30209 Ack=787 Win=71 Len=0 TSval=1219441668 TSecr=346270837"
"691","4.312074","194.29.146.149","194.29.146.97","TCP","66","cvsup > 39746 [ACK] Seq=30209 Ack=793 Win=71 Len=0 TSval=1219441676 TSecr=346270845"
"694","4.320033","194.29.146.149","194.29.146.97","TCP","66","cvsup > 39746 [ACK] Seq=30209 Ack=799 Win=71 Len=0 TSval=1219441684 TSecr=346270853"
"696","4.327945","194.29.146.149","194.29.146.97","TCP","66","cvsup > 39746 [ACK] Seq=30209 Ack=805 Win=71 Len=0 TSval=1219441692 TSecr=346270861"
"709","4.336076","194.29.146.149","194.29.146.97","TCP","66","cvsup > 39746 [ACK] Seq=30209 Ack=811 Win=71 Len=0 TSval=1219441700 TSecr=346270869"
"735","4.344205","194.29.146.149","194.29.146.97","TCP","66","cvsup > 39746 [ACK] Seq=30209 Ack=817 Win=71 Len=0 TSval=1219441707 TSecr=346270877"
"763","4.352135","194.29.146.149","194.29.146.97","TCP","66","cvsup > 39746 [ACK] Seq=30209 Ack=823 Win=71 Len=0 TSval=1219441715 TSecr=346270885"
"767","4.360178","194.29.146.149","194.29.146.97","TCP","66","cvsup > 39746 [ACK] Seq=30209 Ack=829 Win=71 Len=0 TSval=1219441723 TSecr=346270893"
"769","4.367942","194.29.146.149","194.29.146.97","TCP","66","cvsup > 39746 [ACK] Seq=30209 Ack=835 Win=71 Len=0 TSval=1219441732 TSecr=346270901"
"771","4.375941","194.29.146.149","194.29.146.97","TCP","66","cvsup > 39746 [ACK] Seq=30209 Ack=841 Win=71 Len=0 TSval=1219441739 TSecr=346270909"
"773","4.383950","194.29.146.149","194.29.146.97","TCP","66","cvsup > 39746 [ACK] Seq=30209 Ack=847 Win=71 Len=0 TSval=1219441748 TSecr=346270917"
"775","4.392053","194.29.146.149","194.29.146.97","TCP","66","cvsup > 39746 [ACK] Seq=30209 Ack=853 Win=71 Len=0 TSval=1219441756 TSecr=346270925"
"778","4.400018","194.29.146.149","194.29.146.97","TCP","66","cvsup > 39746 [ACK] Seq=30209 Ack=859 Win=71 Len=0 TSval=1219441764 TSecr=346270933"
"780","4.408214","194.29.146.149","194.29.146.97","TCP","66","cvsup > 39746 [ACK] Seq=30209 Ack=865 Win=71 Len=0 TSval=1219441772 TSecr=346270941"
"782","4.415954","194.29.146.149","194.29.146.97","TCP","66","cvsup > 39746 [ACK] Seq=30209 Ack=871 Win=71 Len=0 TSval=1219441780 TSecr=346270949"
"784","4.427530","194.29.146.149","194.29.146.97","TCP","66","cvsup > 39746 [ACK] Seq=30209 Ack=877 Win=71 Len=0 TSval=1219441791 TSecr=346270957"
"786","4.437759","194.29.146.149","194.29.146.97","TCP","66","cvsup > 39746 [ACK] Seq=30209 Ack=883 Win=71 Len=0 TSval=1219441801 TSecr=346270965"
"788","4.440522","194.29.146.149","194.29.146.97","TCP","66","cvsup > 39746 [ACK] Seq=30209 Ack=889 Win=71 Len=0 TSval=1219441804 TSecr=346270973"
"790","4.448520","194.29.146.149","194.29.146.97","TCP","66","cvsup > 39746 [ACK] Seq=30209 Ack=895 Win=71 Len=0 TSval=1219441812 TSecr=346270981"
"792","4.456537","194.29.146.149","194.29.146.97","TCP","66","cvsup > 39746 [ACK] Seq=30209 Ack=901 Win=71 Len=0 TSval=1219441820 TSecr=346270989"
"794","4.464526","194.29.146.149","194.29.146.97","TCP","66","cvsup > 39746 [ACK] Seq=30209 Ack=907 Win=71 Len=0 TSval=1219441828 TSecr=346270997"
"796","4.472488","194.29.146.149","194.29.146.97","TCP","66","cvsup > 39746 [ACK] Seq=30209 Ack=913 Win=71 Len=0 TSval=1219441836 TSecr=346271005"
"798","4.480649","194.29.146.149","194.29.146.97","TCP","66","cvsup > 39746 [ACK] Seq=30209 Ack=919 Win=71 Len=0 TSval=1219441844 TSecr=346271013"
"800","4.488584","194.29.146.149","194.29.146.97","TCP","66","cvsup > 39746 [ACK] Seq=30209 Ack=925 Win=71 Len=0 TSval=1219441852 TSecr=346271021"
"802","4.504562","194.29.146.149","194.29.146.97","TCP","66","cvsup > 39746 [ACK] Seq=30209 Ack=931 Win=71 Len=0 TSval=1219441868 TSecr=346271037"
"979","6.100903","194.29.146.149","194.29.146.97","TCP","1514","cvsup > 39746 [ACK] Seq=30209 Ack=931 Win=71 Len=1448 TSval=1219443464 TSecr=346271037"
"980","6.101151","194.29.146.149","194.29.146.97","TCP","2962","cvsup > 39746 [ACK] Seq=31657 Ack=931 Win=71 Len=2896 TSval=1219443464 TSecr=346271037"
"982","6.101423","194.29.146.149","194.29.146.97","TCP","4410","cvsup > 39746 [ACK] Seq=34553 Ack=931 Win=71 Len=4344 TSval=1219443464 TSecr=346271037"
"984","6.102434","194.29.146.149","194.29.146.97","TCP","1514","cvsup > 39746 [ACK] Seq=38897 Ack=931 Win=71 Len=1448 TSval=1219443466 TSecr=346272635"
"985","6.102682","194.29.146.149","194.29.146.97","TCP","1356","cvsup > 39746 [PSH, ACK] Seq=40345 Ack=931 Win=71 Len=1290 TSval=1219443466 TSecr=346272635"
"988","6.104912","194.29.146.149","194.29.146.97","TCP","66","cvsup > 39746 [ACK] Seq=41635 Ack=1047 Win=71 Len=0 TSval=1219443468 TSecr=346272638"
"991","6.112113","194.29.146.149","194.29.146.97","TCP","66","cvsup > 39746 [ACK] Seq=41635 Ack=1053 Win=71 Len=0 TSval=1219443476 TSecr=346272645"
"993","6.120367","194.29.146.149","194.29.146.97","TCP","66","cvsup > 39746 [ACK] Seq=41635 Ack=1059 Win=71 Len=0 TSval=1219443484 TSecr=346272653"
"995","6.128182","194.29.146.149","194.29.146.97","TCP","66","cvsup > 39746 [ACK] Seq=41635 Ack=1065 Win=71 Len=0 TSval=1219443492 TSecr=346272661"
"997","6.136093","194.29.146.149","194.29.146.97","TCP","66","cvsup > 39746 [ACK] Seq=41635 Ack=1071 Win=71 Len=0 TSval=1219443500 TSecr=346272669"
"999","6.144205","194.29.146.149","194.29.146.97","TCP","66","cvsup > 39746 [ACK] Seq=41635 Ack=1077 Win=71 Len=0 TSval=1219443508 TSecr=346272677"
"1001","6.152312","194.29.146.149","194.29.146.97","TCP","66","cvsup > 39746 [ACK] Seq=41635 Ack=1083 Win=71 Len=0 TSval=1219443516 TSecr=346272685"
"1003","6.160195","194.29.146.149","194.29.146.97","TCP","66","cvsup > 39746 [ACK] Seq=41635 Ack=1089 Win=71 Len=0 TSval=1219443524 TSecr=346272693"
"1005","6.178364","194.29.146.149","194.29.146.97","TCP","66","cvsup > 39746 [ACK] Seq=41635 Ack=1095 Win=71 Len=0 TSval=1219443542 TSecr=346272709"
"1007","6.192700","194.29.146.149","194.29.146.97","TCP","66","cvsup > 39746 [ACK] Seq=41635 Ack=1101 Win=71 Len=0 TSval=1219443556 TSecr=346272725"
"1009","6.200145","194.29.146.149","194.29.146.97","TCP","66","cvsup > 39746 [ACK] Seq=41635 Ack=1107 Win=71 Len=0 TSval=1219443564 TSecr=346272733"
"1012","6.218246","194.29.146.149","194.29.146.97","TCP","66","cvsup > 39746 [ACK] Seq=41635 Ack=1113 Win=71 Len=0 TSval=1219443581 TSecr=346272749"
"1014","6.232467","194.29.146.149","194.29.146.97","TCP","66","cvsup > 39746 [ACK] Seq=41635 Ack=1119 Win=71 Len=0 TSval=1219443596 TSecr=346272765"
"1016","6.242959","194.29.146.149","194.29.146.97","TCP","66","cvsup > 39746 [ACK] Seq=41635 Ack=1125 Win=71 Len=0 TSval=1219443606 TSecr=346272773"
"1018","6.248499","194.29.146.149","194.29.146.97","TCP","66","cvsup > 39746 [ACK] Seq=41635 Ack=1131 Win=71 Len=0 TSval=1219443612 TSecr=346272781"
"1020","6.256476","194.29.146.149","194.29.146.97","TCP","66","cvsup > 39746 [ACK] Seq=41635 Ack=1137 Win=71 Len=0 TSval=1219443620 TSecr=346272789"
"1022","6.264425","194.29.146.149","194.29.146.97","TCP","66","cvsup > 39746 [ACK] Seq=41635 Ack=1143 Win=71 Len=0 TSval=1219443628 TSecr=346272797"
"1024","6.272417","194.29.146.149","194.29.146.97","TCP","66","cvsup > 39746 [ACK] Seq=41635 Ack=1149 Win=71 Len=0 TSval=1219443636 TSecr=346272805"
"1028","6.280350","194.29.146.149","194.29.146.97","TCP","66","cvsup > 39746 [ACK] Seq=41635 Ack=1155 Win=71 Len=0 TSval=1219443644 TSecr=346272813"
"1040","6.290247","194.29.146.149","194.29.146.97","TCP","66","cvsup > 39746 [ACK] Seq=41635 Ack=1161 Win=71 Len=0 TSval=1219443654 TSecr=346272821"
"1042","6.305068","194.29.146.149","194.29.146.97","TCP","66","cvsup > 39746 [ACK] Seq=41635 Ack=1167 Win=71 Len=0 TSval=1219443668 TSecr=346272837"
"1044","6.320234","194.29.146.149","194.29.146.97","TCP","66","cvsup > 39746 [ACK] Seq=41635 Ack=1173 Win=71 Len=0 TSval=1219443684 TSecr=346272853"
"1046","6.368509","194.29.146.149","194.29.146.97","TCP","66","cvsup > 39746 [ACK] Seq=41635 Ack=1179 Win=71 Len=0 TSval=1219443732 TSecr=346272901"
"1048","6.408730","194.29.146.149","194.29.146.97","TCP","66","cvsup > 39746 [ACK] Seq=41635 Ack=1185 Win=71 Len=0 TSval=1219443772 TSecr=346272941"
"1050","6.462033","194.29.146.149","194.29.146.97","TCP","66","cvsup > 39746 [ACK] Seq=41635 Ack=1191 Win=71 Len=0 TSval=1219443825 TSecr=346272989"
"1052","6.464448","194.29.146.149","194.29.146.97","TCP","66","cvsup > 39746 [ACK] Seq=41635 Ack=1197 Win=71 Len=0 TSval=1219443828 TSecr=346272997"
"1054","6.472655","194.29.146.149","194.29.146.97","TCP","66","cvsup > 39746 [ACK] Seq=41635 Ack=1203 Win=71 Len=0 TSval=1219443836 TSecr=346273005"
"1056","6.480723","194.29.146.149","194.29.146.97","TCP","66","cvsup > 39746 [ACK] Seq=41635 Ack=1209 Win=71 Len=0 TSval=1219443844 TSecr=346273013"
"1058","6.496732","194.29.146.149","194.29.146.97","TCP","66","cvsup > 39746 [ACK] Seq=41635 Ack=1215 Win=71 Len=0 TSval=1219443860 TSecr=346273029"
"1060","6.504651","194.29.146.149","194.29.146.97","TCP","66","cvsup > 39746 [ACK] Seq=41635 Ack=1221 Win=71 Len=0 TSval=1219443868 TSecr=346273037"
"1062","6.512824","194.29.146.149","194.29.146.97","TCP","66","cvsup > 39746 [ACK] Seq=41635 Ack=1227 Win=71 Len=0 TSval=1219443876 TSecr=346273045"
"1064","6.520792","194.29.146.149","194.29.146.97","TCP","66","cvsup > 39746 [ACK] Seq=41635 Ack=1233 Win=71 Len=0 TSval=1219443884 TSecr=346273053"
"1066","6.528569","194.29.146.149","194.29.146.97","TCP","66","cvsup > 39746 [ACK] Seq=41635 Ack=1239 Win=71 Len=0 TSval=1219443892 TSecr=346273061"
"1068","6.536776","194.29.146.149","194.29.146.97","TCP","66","cvsup > 39746 [ACK] Seq=41635 Ack=1245 Win=71 Len=0 TSval=1219443900 TSecr=346273069"
"1070","6.545241","194.29.146.149","194.29.146.97","TCP","66","cvsup > 39746 [ACK] Seq=41635 Ack=1251 Win=71 Len=0 TSval=1219443908 TSecr=346273078"
"1072","6.552541","194.29.146.149","194.29.146.97","TCP","66","cvsup > 39746 [ACK] Seq=41635 Ack=1257 Win=71 Len=0 TSval=1219443916 TSecr=346273085"
"1074","6.560525","194.29.146.149","194.29.146.97","TCP","66","cvsup > 39746 [ACK] Seq=41635 Ack=1263 Win=71 Len=0 TSval=1219443924 TSecr=346273093"
"1076","6.568549","194.29.146.149","194.29.146.97","TCP","66","cvsup > 39746 [ACK] Seq=41635 Ack=1269 Win=71 Len=0 TSval=1219443932 TSecr=346273101"
"1078","6.576537","194.29.146.149","194.29.146.97","TCP","66","cvsup > 39746 [ACK] Seq=41635 Ack=1275 Win=71 Len=0 TSval=1219443940 TSecr=346273109"
"1080","6.584543","194.29.146.149","194.29.146.97","TCP","66","cvsup > 39746 [ACK] Seq=41635 Ack=1281 Win=71 Len=0 TSval=1219443948 TSecr=346273117"
"1082","6.592555","194.29.146.149","194.29.146.97","TCP","66","cvsup > 39746 [ACK] Seq=41635 Ack=1287 Win=71 Len=0 TSval=1219443956 TSecr=346273125"
"1084","6.600566","194.29.146.149","194.29.146.97","TCP","66","cvsup > 39746 [ACK] Seq=41635 Ack=1293 Win=71 Len=0 TSval=1219443964 TSecr=346273133"
"1086","6.608554","194.29.146.149","194.29.146.97","TCP","66","cvsup > 39746 [ACK] Seq=41635 Ack=1299 Win=71 Len=0 TSval=1219443972 TSecr=346273141"
"1088","6.616524","194.29.146.149","194.29.146.97","TCP","66","cvsup > 39746 [ACK] Seq=41635 Ack=1305 Win=71 Len=0 TSval=1219443980 TSecr=346273149"
"1090","6.624592","194.29.146.149","194.29.146.97","TCP","66","cvsup > 39746 [ACK] Seq=41635 Ack=1311 Win=71 Len=0 TSval=1219443988 TSecr=346273157"
"1092","6.632471","194.29.146.149","194.29.146.97","TCP","66","cvsup > 39746 [ACK] Seq=41635 Ack=1317 Win=71 Len=0 TSval=1219443996 TSecr=346273165"
"1094","6.640521","194.29.146.149","194.29.146.97","TCP","66","cvsup > 39746 [ACK] Seq=41635 Ack=1323 Win=71 Len=0 TSval=1219444004 TSecr=346273173"
"1096","6.648437","194.29.146.149","194.29.146.97","TCP","66","cvsup > 39746 [ACK] Seq=41635 Ack=1329 Win=71 Len=0 TSval=1219444012 TSecr=346273181"
"1098","6.656567","194.29.146.149","194.29.146.97","TCP","66","cvsup > 39746 [ACK] Seq=41635 Ack=1335 Win=71 Len=0 TSval=1219444020 TSecr=346273189"
"1100","6.664714","194.29.146.149","194.29.146.97","TCP","66","cvsup > 39746 [ACK] Seq=41635 Ack=1341 Win=71 Len=0 TSval=1219444028 TSecr=346273197"
"1102","6.672323","194.29.146.149","194.29.146.97","TCP","66","cvsup > 39746 [ACK] Seq=41635 Ack=1347 Win=71 Len=0 TSval=1219444036 TSecr=346273205"
"1104","6.680493","194.29.146.149","194.29.146.97","TCP","66","cvsup > 39746 [ACK] Seq=41635 Ack=1353 Win=71 Len=0 TSval=1219444044 TSecr=346273213"
"1106","6.688413","194.29.146.149","194.29.146.97","TCP","66","cvsup > 39746 [ACK] Seq=41635 Ack=1359 Win=71 Len=0 TSval=1219444052 TSecr=346273221"
"1108","6.696504","194.29.146.149","194.29.146.97","TCP","66","cvsup > 39746 [ACK] Seq=41635 Ack=1365 Win=71 Len=0 TSval=1219444060 TSecr=346273229"
"1110","6.704494","194.29.146.149","194.29.146.97","TCP","66","cvsup > 39746 [ACK] Seq=41635 Ack=1371 Win=71 Len=0 TSval=1219444068 TSecr=346273237"
"1112","6.712431","194.29.146.149","194.29.146.97","TCP","66","cvsup > 39746 [ACK] Seq=41635 Ack=1377 Win=71 Len=0 TSval=1219444076 TSecr=346273245"
"1114","6.720715","194.29.146.149","194.29.146.97","TCP","66","cvsup > 39746 [ACK] Seq=41635 Ack=1383 Win=71 Len=0 TSval=1219444084 TSecr=346273253"
"1116","6.728702","194.29.146.149","194.29.146.97","TCP","66","cvsup > 39746 [ACK] Seq=41635 Ack=1389 Win=71 Len=0 TSval=1219444092 TSecr=346273261"
"1118","6.736690","194.29.146.149","194.29.146.97","TCP","66","cvsup > 39746 [ACK] Seq=41635 Ack=1395 Win=71 Len=0 TSval=1219444100 TSecr=346273269"
"1120","6.744681","194.29.146.149","194.29.146.97","TCP","66","cvsup > 39746 [ACK] Seq=41635 Ack=1401 Win=71 Len=0 TSval=1219444108 TSecr=346273277"
"1122","6.752695","194.29.146.149","194.29.146.97","TCP","66","cvsup > 39746 [ACK] Seq=41635 Ack=1407 Win=71 Len=0 TSval=1219444116 TSecr=346273285"
"1124","6.760717","194.29.146.149","194.29.146.97","TCP","66","cvsup > 39746 [ACK] Seq=41635 Ack=1413 Win=71 Len=0 TSval=1219444124 TSecr=346273293"
"1126","6.768749","194.29.146.149","194.29.146.97","TCP","66","cvsup > 39746 [ACK] Seq=41635 Ack=1419 Win=71 Len=0 TSval=1219444132 TSecr=346273301"
"1128","6.776720","194.29.146.149","194.29.146.97","TCP","66","cvsup > 39746 [ACK] Seq=41635 Ack=1425 Win=71 Len=0 TSval=1219444140 TSecr=346273309"
"1130","6.792859","194.29.146.149","194.29.146.97","TCP","66","cvsup > 39746 [ACK] Seq=41635 Ack=1431 Win=71 Len=0 TSval=1219444156 TSecr=346273325"
"1132","6.800571","194.29.146.149","194.29.146.97","TCP","66","cvsup > 39746 [ACK] Seq=41635 Ack=1437 Win=71 Len=0 TSval=1219444164 TSecr=346273333"
"1134","6.808506","194.29.146.149","194.29.146.97","TCP","66","cvsup > 39746 [ACK] Seq=41635 Ack=1443 Win=71 Len=0 TSval=1219444172 TSecr=346273341"
"1136","6.816472","194.29.146.149","194.29.146.97","TCP","66","cvsup > 39746 [ACK] Seq=41635 Ack=1449 Win=71 Len=0 TSval=1219444180 TSecr=346273349"
"1138","6.824772","194.29.146.149","194.29.146.97","TCP","66","cvsup > 39746 [ACK] Seq=41635 Ack=1455 Win=71 Len=0 TSval=1219444188 TSecr=346273357"
"1140","6.832730","194.29.146.149","194.29.146.97","TCP","66","cvsup > 39746 [ACK] Seq=41635 Ack=1461 Win=71 Len=0 TSval=1219444196 TSecr=346273365"
"1142","6.840589","194.29.146.149","194.29.146.97","TCP","66","cvsup > 39746 [ACK] Seq=41635 Ack=1467 Win=71 Len=0 TSval=1219444204 TSecr=346273373"
"1144","6.848741","194.29.146.149","194.29.146.97","TCP","66","cvsup > 39746 [ACK] Seq=41635 Ack=1473 Win=71 Len=0 TSval=1219444212 TSecr=346273381"
"1146","6.856708","194.29.146.149","194.29.146.97","TCP","66","cvsup > 39746 [ACK] Seq=41635 Ack=1479 Win=71 Len=0 TSval=1219444220 TSecr=346273389"
"1148","6.864442","194.29.146.149","194.29.146.97","TCP","66","cvsup > 39746 [ACK] Seq=41635 Ack=1485 Win=71 Len=0 TSval=1219444228 TSecr=346273397"
"1150","6.872712","194.29.146.149","194.29.146.97","TCP","66","cvsup > 39746 [ACK] Seq=41635 Ack=1491 Win=71 Len=0 TSval=1219444236 TSecr=346273405"
"1152","6.880704","194.29.146.149","194.29.146.97","TCP","66","cvsup > 39746 [ACK] Seq=41635 Ack=1497 Win=71 Len=0 TSval=1219444244 TSecr=346273413"
"1154","6.888882","194.29.146.149","194.29.146.97","TCP","66","cvsup > 39746 [ACK] Seq=41635 Ack=1503 Win=71 Len=0 TSval=1219444252 TSecr=346273421"
"1156","6.904514","194.29.146.149","194.29.146.97","TCP","66","cvsup > 39746 [ACK] Seq=41635 Ack=1509 Win=71 Len=0 TSval=1219444268 TSecr=346273437"
"1158","6.912987","194.29.146.149","194.29.146.97","TCP","66","cvsup > 39746 [ACK] Seq=41635 Ack=1515 Win=71 Len=0 TSval=1219444276 TSecr=346273445"
"1160","6.920555","194.29.146.149","194.29.146.97","TCP","66","cvsup > 39746 [ACK] Seq=41635 Ack=1521 Win=71 Len=0 TSval=1219444284 TSecr=346273453"
"1162","6.929435","194.29.146.149","194.29.146.97","TCP","66","cvsup > 39746 [ACK] Seq=41635 Ack=1527 Win=71 Len=0 TSval=1219444293 TSecr=346273461"
"1164","6.936989","194.29.146.149","194.29.146.97","TCP","66","cvsup > 39746 [ACK] Seq=41635 Ack=1533 Win=71 Len=0 TSval=1219444300 TSecr=346273469"
"1166","6.944799","194.29.146.149","194.29.146.97","TCP","66","cvsup > 39746 [ACK] Seq=41635 Ack=1539 Win=71 Len=0 TSval=1219444308 TSecr=346273477"
"1168","6.952486","194.29.146.149","194.29.146.97","TCP","66","cvsup > 39746 [ACK] Seq=41635 Ack=1545 Win=71 Len=0 TSval=1219444316 TSecr=346273485"
"1170","6.960488","194.29.146.149","194.29.146.97","TCP","66","cvsup > 39746 [ACK] Seq=41635 Ack=1551 Win=71 Len=0 TSval=1219444324 TSecr=346273493"
"1172","6.976540","194.29.146.149","194.29.146.97","TCP","66","cvsup > 39746 [ACK] Seq=41635 Ack=1557 Win=71 Len=0 TSval=1219444340 TSecr=346273509"
"1174","6.984853","194.29.146.149","194.29.146.97","TCP","66","cvsup > 39746 [ACK] Seq=41635 Ack=1563 Win=71 Len=0 TSval=1219444348 TSecr=346273517"
"1176","6.992448","194.29.146.149","194.29.146.97","TCP","66","cvsup > 39746 [ACK] Seq=41635 Ack=1569 Win=71 Len=0 TSval=1219444356 TSecr=346273525"
"1178","7.001137","194.29.146.149","194.29.146.97","TCP","66","cvsup > 39746 [ACK] Seq=41635 Ack=1575 Win=71 Len=0 TSval=1219444364 TSecr=346273533"
"1196","7.016818","194.29.146.149","194.29.146.97","TCP","66","cvsup > 39746 [ACK] Seq=41635 Ack=1581 Win=71 Len=0 TSval=1219444380 TSecr=346273549"
"1207","7.027380","194.29.146.149","194.29.146.97","TCP","66","cvsup > 39746 [ACK] Seq=41635 Ack=1587 Win=71 Len=0 TSval=1219444390 TSecr=346273557"
"1219","7.033315","194.29.146.149","194.29.146.97","TCP","66","cvsup > 39746 [ACK] Seq=41635 Ack=1593 Win=71 Len=0 TSval=1219444396 TSecr=346273565"
"1235","7.040992","194.29.146.149","194.29.146.97","TCP","66","cvsup > 39746 [ACK] Seq=41635 Ack=1599 Win=71 Len=0 TSval=1219444404 TSecr=346273574"
"1243","7.048813","194.29.146.149","194.29.146.97","TCP","66","cvsup > 39746 [ACK] Seq=41635 Ack=1605 Win=71 Len=0 TSval=1219444412 TSecr=346273581"
"1270","7.064775","194.29.146.149","194.29.146.97","TCP","66","cvsup > 39746 [ACK] Seq=41635 Ack=1611 Win=71 Len=0 TSval=1219444428 TSecr=346273598"
"1276","7.072542","194.29.146.149","194.29.146.97","TCP","66","cvsup > 39746 [ACK] Seq=41635 Ack=1617 Win=71 Len=0 TSval=1219444436 TSecr=346273605"
"1278","7.081115","194.29.146.149","194.29.146.97","TCP","66","cvsup > 39746 [ACK] Seq=41635 Ack=1623 Win=71 Len=0 TSval=1219444444 TSecr=346273613"
"1280","7.088419","194.29.146.149","194.29.146.97","TCP","66","cvsup > 39746 [ACK] Seq=41635 Ack=1629 Win=71 Len=0 TSval=1219444452 TSecr=346273621"
"1282","7.109142","194.29.146.149","194.29.146.97","TCP","1514","cvsup > 39746 [ACK] Seq=41635 Ack=1635 Win=71 Len=1448 TSval=1219444472 TSecr=346273637"
"1283","7.109393","194.29.146.149","194.29.146.97","TCP","2962","cvsup > 39746 [ACK] Seq=43083 Ack=1635 Win=71 Len=2896 TSval=1219444472 TSecr=346273637"
"1284","7.109643","194.29.146.149","194.29.146.97","TCP","2962","cvsup > 39746 [ACK] Seq=45979 Ack=1635 Win=71 Len=2896 TSval=1219444472 TSecr=346273637"
"1286","7.109892","194.29.146.149","194.29.146.97","TCP","1514","cvsup > 39746 [ACK] Seq=48875 Ack=1635 Win=71 Len=1448 TSval=1219444472 TSecr=346273637"
"1288","7.110448","194.29.146.149","194.29.146.97","TCP","1514","cvsup > 39746 [ACK] Seq=50323 Ack=1635 Win=71 Len=1448 TSval=1219444473 TSecr=346273643"
"1290","7.110698","194.29.146.149","194.29.146.97","TCP","2470","cvsup > 39746 [PSH, ACK] Seq=51771 Ack=1635 Win=71 Len=2404 TSval=1219444473 TSecr=346273643"
"1293","7.152442","194.29.146.149","194.29.146.97","TCP","66","cvsup > 39746 [ACK] Seq=54175 Ack=1731 Win=71 Len=0 TSval=1219444516 TSecr=346273645"
"1295","7.153014","194.29.146.149","194.29.146.97","TCP","66","cvsup > 39746 [ACK] Seq=54175 Ack=1755 Win=71 Len=0 TSval=1219444516 TSecr=346273686"
"1297","7.160218","194.29.146.149","194.29.146.97","TCP","66","cvsup > 39746 [ACK] Seq=54175 Ack=1761 Win=71 Len=0 TSval=1219444524 TSecr=346273693"
"1299","7.169106","194.29.146.149","194.29.146.97","TCP","66","cvsup > 39746 [ACK] Seq=54175 Ack=1767 Win=71 Len=0 TSval=1219444532 TSecr=346273701"
"1301","7.176383","194.29.146.149","194.29.146.97","TCP","66","cvsup > 39746 [ACK] Seq=54175 Ack=1773 Win=71 Len=0 TSval=1219444540 TSecr=346273709"
"1303","7.192975","194.29.146.149","194.29.146.97","TCP","66","cvsup > 39746 [ACK] Seq=54175 Ack=1779 Win=71 Len=0 TSval=1219444556 TSecr=346273725"
"1305","7.200251","194.29.146.149","194.29.146.97","TCP","66","cvsup > 39746 [ACK] Seq=54175 Ack=1785 Win=71 Len=0 TSval=1219444564 TSecr=346273733"
"1307","7.217187","194.29.146.149","194.29.146.97","TCP","66","cvsup > 39746 [ACK] Seq=54175 Ack=1791 Win=71 Len=0 TSval=1219444580 TSecr=346273749"
"1309","7.240333","194.29.146.149","194.29.146.97","TCP","66","cvsup > 39746 [ACK] Seq=54175 Ack=1797 Win=71 Len=0 TSval=1219444604 TSecr=346273773"
"1311","7.264328","194.29.146.149","194.29.146.97","TCP","66","cvsup > 39746 [ACK] Seq=54175 Ack=1803 Win=71 Len=0 TSval=1219444628 TSecr=346273797"
"1313","7.289040","194.29.146.149","194.29.146.97","TCP","66","cvsup > 39746 [ACK] Seq=54175 Ack=1809 Win=71 Len=0 TSval=1219444652 TSecr=346273821"
"1315","7.296597","194.29.146.149","194.29.146.97","TCP","66","cvsup > 39746 [ACK] Seq=54175 Ack=1815 Win=71 Len=0 TSval=1219444660 TSecr=346273829"
"1322","7.333823","194.29.146.149","194.29.146.97","TCP","1514","cvsup > 39746 [ACK] Seq=54175 Ack=1815 Win=71 Len=1448 TSval=1219444697 TSecr=346273829"
"1323","7.334069","194.29.146.149","194.29.146.97","TCP","2962","cvsup > 39746 [ACK] Seq=55623 Ack=1815 Win=71 Len=2896 TSval=1219444697 TSecr=346273829"
"1325","7.334303","194.29.146.149","194.29.146.97","TCP","2962","cvsup > 39746 [ACK] Seq=58519 Ack=1815 Win=71 Len=2896 TSval=1219444697 TSecr=346273829"
"1328","7.334557","194.29.146.149","194.29.146.97","TCP","1514","cvsup > 39746 [ACK] Seq=61415 Ack=1815 Win=71 Len=1448 TSval=1219444697 TSecr=346273829"
"1330","7.335105","194.29.146.149","194.29.146.97","TCP","2724","cvsup > 39746 [PSH, ACK] Seq=62863 Ack=1815 Win=71 Len=2658 TSval=1219444698 TSecr=346273867"
"1389","7.376451","194.29.146.149","194.29.146.97","TCP","66","cvsup > 39746 [ACK] Seq=65521 Ack=1905 Win=71 Len=0 TSval=1219444740 TSecr=346273869"
"1392","7.424979","194.29.146.149","194.29.146.97","TCP","66","cvsup > 39746 [ACK] Seq=65521 Ack=1911 Win=71 Len=0 TSval=1219444788 TSecr=346273958"
"1393","7.559877","194.29.146.149","194.29.146.97","TCP","1514","cvsup > 39746 [ACK] Seq=65521 Ack=1911 Win=71 Len=1448 TSval=1219444923 TSecr=346273958"
"1394","7.560126","194.29.146.149","194.29.146.97","TCP","2962","cvsup > 39746 [ACK] Seq=66969 Ack=1911 Win=71 Len=2896 TSval=1219444923 TSecr=346273958"
"1395","7.560373","194.29.146.149","194.29.146.97","TCP","2962","cvsup > 39746 [ACK] Seq=69865 Ack=1911 Win=71 Len=2896 TSval=1219444923 TSecr=346273958"
"1397","7.560623","194.29.146.149","194.29.146.97","TCP","1514","cvsup > 39746 [ACK] Seq=72761 Ack=1911 Win=71 Len=1448 TSval=1219444923 TSecr=346273958"
"1398","7.561236","194.29.146.149","194.29.146.97","TCP","1514","cvsup > 39746 [ACK] Seq=74209 Ack=1911 Win=71 Len=1448 TSval=1219444924 TSecr=346274094"
"1400","7.561516","194.29.146.149","194.29.146.97","TCP","2962","cvsup > 39746 [ACK] Seq=75657 Ack=1911 Win=71 Len=2896 TSval=1219444924 TSecr=346274094"
"1401","7.561858","194.29.146.149","194.29.146.97","TCP","246","cvsup > 39746 [PSH, ACK] Seq=78553 Ack=1911 Win=71 Len=180 TSval=1219444925 TSecr=346274095"
"1404","7.566077","194.29.146.149","194.29.146.97","TCP","66","cvsup > 39746 [ACK] Seq=78733 Ack=2051 Win=79 Len=0 TSval=1219444929 TSecr=346274099"
"1406","7.633094","194.29.146.149","194.29.146.97","TCP","66","cvsup > 39746 [ACK] Seq=78733 Ack=2057 Win=79 Len=0 TSval=1219444996 TSecr=346274165"
"1408","7.640304","194.29.146.149","194.29.146.97","TCP","66","cvsup > 39746 [ACK] Seq=78733 Ack=2063 Win=79 Len=0 TSval=1219445004 TSecr=346274173"
"1410","7.650003","194.29.146.149","194.29.146.97","TCP","66","cvsup > 39746 [ACK] Seq=78733 Ack=2069 Win=79 Len=0 TSval=1219445014 TSecr=346274183"
"1412","7.656658","194.29.146.149","194.29.146.97","TCP","66","cvsup > 39746 [ACK] Seq=78733 Ack=2075 Win=79 Len=0 TSval=1219445020 TSecr=346274189"
"1414","7.666906","194.29.146.149","194.29.146.97","TCP","66","cvsup > 39746 [ACK] Seq=78733 Ack=2081 Win=79 Len=0 TSval=1219445030 TSecr=346274197"
"1416","7.673857","194.29.146.149","194.29.146.97","TCP","66","cvsup > 39746 [ACK] Seq=78733 Ack=2087 Win=79 Len=0 TSval=1219445037 TSecr=346274205"
"1418","7.681049","194.29.146.149","194.29.146.97","TCP","66","cvsup > 39746 [ACK] Seq=78733 Ack=2093 Win=79 Len=0 TSval=1219445044 TSecr=346274213"
"1420","7.688335","194.29.146.149","194.29.146.97","TCP","66","cvsup > 39746 [ACK] Seq=78733 Ack=2099 Win=79 Len=0 TSval=1219445052 TSecr=346274221"
"1422","7.698090","194.29.146.149","194.29.146.97","TCP","66","cvsup > 39746 [ACK] Seq=78733 Ack=2105 Win=79 Len=0 TSval=1219445061 TSecr=346274229"
"1424","7.704868","194.29.146.149","194.29.146.97","TCP","66","cvsup > 39746 [ACK] Seq=78733 Ack=2111 Win=79 Len=0 TSval=1219445068 TSecr=346274237"
"1426","7.712293","194.29.146.149","194.29.146.97","TCP","66","cvsup > 39746 [ACK] Seq=78733 Ack=2117 Win=79 Len=0 TSval=1219445076 TSecr=346274245"
"1428","7.729061","194.29.146.149","194.29.146.97","TCP","66","cvsup > 39746 [ACK] Seq=78733 Ack=2123 Win=79 Len=0 TSval=1219445092 TSecr=346274261"
"1431","7.825370","194.29.146.149","194.29.146.97","TCP","66","cvsup > 39746 [ACK] Seq=78733 Ack=2129 Win=79 Len=0 TSval=1219445188 TSecr=346274357"
"1433","7.825653","194.29.146.149","194.29.146.97","TCP","66","cvsup > 39746 [ACK] Seq=78733 Ack=2135 Win=79 Len=0 TSval=1219445189 TSecr=346274358"
"1435","7.851669","194.29.146.149","194.29.146.97","TCP","1514","cvsup > 39746 [ACK] Seq=78733 Ack=2135 Win=79 Len=1448 TSval=1219445215 TSecr=346274358"
"1436","7.851914","194.29.146.149","194.29.146.97","TCP","2962","cvsup > 39746 [ACK] Seq=80181 Ack=2135 Win=79 Len=2896 TSval=1219445215 TSecr=346274358"
"1438","7.852356","194.29.146.149","194.29.146.97","TCP","4410","cvsup > 39746 [ACK] Seq=83077 Ack=2135 Win=79 Len=4344 TSval=1219445215 TSecr=346274358"
"1440","7.853835","194.29.146.149","194.29.146.97","TCP","2664","cvsup > 39746 [PSH, ACK] Seq=87421 Ack=2135 Win=79 Len=2598 TSval=1219445217 TSecr=346274386"
"1443","7.855981","194.29.146.149","194.29.146.97","TCP","174","cvsup > 39746 [PSH, ACK] Seq=90019 Ack=2315 Win=88 Len=108 TSval=1219445219 TSecr=346274388"
"1445","7.896467","194.29.146.149","194.29.146.97","TCP","66","cvsup > 39746 [ACK] Seq=90127 Ack=2325 Win=88 Len=0 TSval=1219445260 TSecr=346274389"
"1447","7.897041","194.29.146.149","194.29.146.97","TCP","66","cvsup > 39746 [ACK] Seq=90127 Ack=2337 Win=88 Len=0 TSval=1219445260 TSecr=346274430"
"1449","7.946730","194.29.146.149","194.29.146.97","TCP","66","cvsup > 39746 [ACK] Seq=90127 Ack=2343 Win=88 Len=0 TSval=1219445310 TSecr=346274477"
"1451","7.947006","194.29.146.149","194.29.146.97","TCP","66","cvsup > 39746 [ACK] Seq=90127 Ack=2349 Win=88 Len=0 TSval=1219445310 TSecr=346274480"
"1541","8.129574","194.29.146.149","194.29.146.97","TCP","1514","cvsup > 39746 [ACK] Seq=90127 Ack=2349 Win=88 Len=1448 TSval=1219445492 TSecr=346274480"
"1542","8.129822","194.29.146.149","194.29.146.97","TCP","2962","cvsup > 39746 [ACK] Seq=91575 Ack=2349 Win=88 Len=2896 TSval=1219445492 TSecr=346274480"
"1543","8.130072","194.29.146.149","194.29.146.97","TCP","4410","cvsup > 39746 [ACK] Seq=94471 Ack=2349 Win=88 Len=4344 TSval=1219445492 TSecr=346274480"
"1545","8.131158","194.29.146.149","194.29.146.97","TCP","1514","cvsup > 39746 [ACK] Seq=98815 Ack=2349 Win=88 Len=1448 TSval=1219445494 TSecr=346274664"
